Id|Description|Speaker|Text
MegaeraWithHypnos01|Duo - Megaera and Hypnos (1)|Hypnos|Oh, *hahaha*, na ja, ich pflege unseren Besuchern, die unfreiwillig hereinschneien, einen Fingerzeig zu geben, denn ich bringe ja dies und das in Erfahrung, wenn ich so mit jedem spreche! Über, du weißt schon... das Sterben?
MegaeraWithHypnos01|Duo - Megaera and Hypnos (1)|Megaera|Zagreus. Er sagte mir, ich sollte mich beim nächsten Mal stärker bemühen, deinen Angriffen auszuweichen. Dann halt da draußen schön die Augen auf, denn Hypnos hier hat deine Geheimnisse ausgeplaudert.
MegaeraWithHypnos02|Duo - Megaera and Hypnos (2)|Megaera|...Ich glaube, ich finde den Weg zum Salon auch von allein, Hypnos. Oder... Moment mal... hast du mich etwa gerade zu einer Verabredung eingeladen?
MegaeraWithHypnos02|Duo - Megaera and Hypnos (2)|Hypnos|Ich? Nein,* nein-nein-nein-nein-nein*, nein! Der Gedanke würde mir niemals kommen, Fräulein, denn du hast deinen Posten und ich den meinen. Wir stammen aus zwei unterschiedlichen Welten, könnte man sagen. Dazu verdammt, nur selten zusammen gesehen zu werden.
MegaeraWithHypnos02|Duo - Megaera and Hypnos (2)|Megaera|Jedes Mal, wenn ich mit dir spreche, betrachtest du das irgendwie als Kompliment, stimmt's? Dann möchte ich dir einen Rat geben, ausnahmsweise. Hör auf, dich wie ein Schwachkopf zu benehmen.
MegaeraWithHypnos03|Duo - Megaera and Hypnos (3)|Megaera|...Du hast mich in letzter Zeit aber nicht oft gewohnt willkommen geheißen, Hypnos. Es wäre mir nicht aufgefallen, wenn es nicht einen Großteil deiner Arbeit ausmachen würde. Wenn du mir etwas sagen willst, dann heraus mit der Sprache.
MegaeraWithHypnos03|Duo - Megaera and Hypnos (3)|Hypnos|Oh, ähm, na ja, ich, weißt du, es ist so, Megaira, Fräulein Megaira, darf ich dich so nennen? Wie ich gerade sagte, ich dachte, wir hätten vielleicht ein Ding, eine echte Verbindung, so in letzter Zeit, weil du immer häufiger stirbst und ich immer hier stehe? Aber dann... ich dachte immer, du wärest unbezwingbar...
MegaeraWithHypnos03|Duo - Megaera and Hypnos (3)|Megaera|Ich verstehe. Du begreifst jetzt also, dass das Bild, das du dir von mir gemacht hattest, vollkommen deiner Phantasie entsprungen ist, ist es das?
MegaeraWithHypnos03|Duo - Megaera and Hypnos (3)|Hypnos|Na ja, es ist bloß! Ich hatte wirklich gedacht, dass du dank all meine Ratschläge wieder Zagreus töten würdest anstatt er dich! Die Dinge entwickeln sich einfach nicht so, wie ich gehofft hatte, weißt du?
MegaeraWithHypnos03|Duo - Megaera and Hypnos (3)|Megaera|Das klingt ja fast, als hättest du dich von mir getrennt, aber... bist du sicher, dass du klarkommen wirst?
MegaeraWithHypnos03|Duo - Megaera and Hypnos (3)|Hypnos|Oh, ja! Schau mal, ich bin ja froh, dass es einer von euch beiden ist! Das ist allemal besser, als ständig Schatten willkommen heißen zu müssen! Die reden nie mit mir.
MegaeraWithHypnos03|Duo - Megaera and Hypnos (3)|Megaera|Gut, dann... heißt du mich beim nächsten Mal willkommen.
