Id|Description|Speaker|Text
SisyphusGift07_A|Sisyphus Gift A 07|Sisyphus|이 작은 친구는 돌덩이가 눈에 띄지 않는 곳에서 돌봐 온 녀석입니다. 앞으로 어디를 가시든 이 친구가 동료가 되어 드릴 겁니다. 그리고 이 친구가 함께 있을 때에는 저와 돌덩이도 혼령으로 함께할 거고요.
SisyphusGift08_A|Sisyphus Gift A 08|Sisyphus|왕자님, 지난번에 주신 빈티지 암브로시아 말입니다. 세상에! 제가 그동안 맛봤던 것 중에 최고였습니다! 돌덩이도 아주 좋아하더군요!
SisyphusGift08_A|Sisyphus Gift A 08|Zagreus|좋아하실 줄 알았어요. 그래서 여기 하나 더 가져왔답니다! 올림포스에서 물건을 들여오는 일이 거의 없다는 사실이 아쉬울 정도였습니다. 언젠가는 제가 직접 음미할 수 있기를 바랍니다. 이 모든 일이 다 정리되고 나면 말이죠.
SisyphusGift08_A|Sisyphus Gift A 08|Sisyphus|아니, 이전에는 한 번도 건드리지 않았다는 거예요? 저보다 자제력이 훨씬 뛰어나시네요. 언젠가는 우리 둘이 함께 나눌 기회가 있겠죠!
SisyphusGift08_B|Sisyphus Gift B 08|Zagreus|좋아하실 줄 알았어요. 그래서 여기 하나 더 가져왔답니다! 올림포스에서 물건을 들여오는 일이 거의 없다는 사실이 아쉬울 정도였습니다.
SisyphusGift08_B|Sisyphus Gift B 08|Sisyphus|아, 왕자님이 가져다 주신 것을 좀 봐, 돌덩이야! 언젠가 우리가 함께 나눠 먹을 날이 올지도 몰라.
SisyphusGift09_A|Sisyphus Gift A 09|Sisyphus|저 같은 자에게 이런 호의를 베푸시다니. 제가 이곳에 온 이유를 알고 계시죠, 왕자님? 왕자님의 아버지와 착한 타나토스가 저를 버렸기 때문만은 아닙니다. 그럼에도 왕자님은 제가 왕이었을 때 이후로 경험한 적 없는 품위를 보여주셨습니다. 어쩌면 왕이었을 때조차 경험한 적 없을지도 모릅니다.
SisyphusGift09_A|Sisyphus Gift A 09|Zagreus|당신이 과거 어떤 사람이었는지는 모르겠지만, 이제는 달라졌다고 믿어요. 당신이 제 친구인 것이 자랑스러워요. 저기 돌덩이도 말이에요. 이렇게 말하면 이상하지만, 당신이 여기 와서 기뻐요. 그동안 당신에게서 정말 많은 것을 배웠으니까요.
SisyphusGift09_A|Sisyphus Gift A 09|Sisyphus|영광입니다, 폐하. 폐하와 친구가 된 것은 저 같은 미천한 자가 누릴 수 있는 최고의 영예입니다. 그렇지 않니, 돌덩이야?
SisyphusGift09_A|Sisyphus Gift A 09|Sisyphus|이걸 가지고 가십시오, 자그레우스 왕자님. 돌덩이도 그러라고 하더군요.
SisyphusGift07|Sisyphus Gift 07|Sisyphus|잠시만요. 이걸, 절 주려 하신다고요? 진심이세요, 왕자님? 거절하려는 건 아니지만. 제가 감히 어떻게 거절하겠어요? 감사합니다! 정말 감사합니다.
SisyphusGift07|Sisyphus Gift 07|Zagreus|천만에요. 절 위해 많은 걸 해 주셨는데 이 정도야 아무것도 아니죠.
SisyphusGift08|Sisyphus Gift 08|Sisyphus|...왕자님, 몸 둘 바를 모르겠네요. 전 그저 벌을 받는 혼령일 뿐인데. 왕자님에게 이런 은총을 받다니 가당치 않습니다.
SisyphusGift08|Sisyphus Gift 08|Zagreus|이러지 마세요. 친구 사이에 신들이 마시는 술 한 병이 뭐 그리 대수라고.
