Id|Description|Speaker|Text
ZeusWithAres01|Duo - Zeus and Ares (1)|Zeus|Племянник! По моему повелению мой сын Арес, мотивы которого ясны немногим, вручит тебе небольшой дар — символ своей силы. Из него ещё выйдет толк!
ZeusWithAres01|Duo - Zeus and Ares (1)|Ares|Всё будет в точности так, как ты сказал, мой царственный отец. Мои желания полностью совпадают с твоими.
AresWithPoseidon01|Duo - Ares and Poseidon (1)|Ares|Прости мне мою откровенность, мой рождённый в преисподней собрат, но порой я сожалею, что не могу ближе узнать твоего отца. Мой отец и дядя здесь... у нас не так уж и много общего.
AresWithPoseidon01|Duo - Ares and Poseidon (1)|Poseidon|Возможно, если бы ты был не таким эксцентричным и немного более дружелюбным, Арес, у нас было бы гораздо больше общего! Не стесняйся обращаться ко мне за советами!
AresWithAthena01|Duo - Ares and Athena (1)|Ares|Я лишь хотел ещё раз поговорить с тобой с глазу на глаз, собрат, только, видишь ли...
AresWithAthena01|Duo - Ares and Athena (1)|Athena|...Только дело в том, дорогой кузен, что некоторые члены нашей семьи способны на немыслимые вещи. На твоём месте я была бы осторожнее с моим сводным братом, вот и всё. А теперь продолжай.
AresWithAthena01|Duo - Ares and Athena (1)|Ares|Ты снова перебиваешь меня, дорогая сестра. А ты ведь знаешь, что это я этого не люблю. Предупреждаю тебя: не вмешивайся в мои дела. Я буду помогать своему собрату так, как посчитаю нужным.
AresWithAthena01|Duo - Ares and Athena (1)|Athena|Ты поступаешь только так, как считаешь нужным, владыка Арес. Постарайся двигаться в том же направлении, что, и все мы.
AresWithAphrodite01|Duo - Ares and Aphrodite (1)|Ares|С нетерпением жду того дня, когда ты наконец прибудешь на Олимп. Мало кто здесь разделяет мои интересы, а вот ты, кажется, мог бы.
AresWithAphrodite01|Duo - Ares and Aphrodite (1)|Aphrodite|И всё же здесь сейчас присутствуют те, кто разделяет эти интересы, не так ли, владыка Арес? Что касается тебя, дорогуша, не торопись и действуй, как сочтёшь нужным!
AresWithAphrodite02|Duo - Ares and Aphrodite (2)|Ares|Войны во имя любви, собрат... Представляешь себе? Мы с владычицей Афродитой можем вечно обсуждать сей вариант развития событий. Думается мне, иногда ты перестаёшь задаваться вопросом, что же вынудило тебя сражаться. Если бы для сражений вообще нужна была причина.
AresWithAphrodite02|Duo - Ares and Aphrodite (2)|Aphrodite|Ах, владыка Арес, не следует затуманивать мысли и суждения нашего юного бога подобными комментариями, м-м? Давай просто даруем ему то, чего он желает, и продолжим разговор наедине.
AresWithDionysus01|Duo - Ares and Dionysus (1)|Ares|А, собрат! А я тут как раз расспрашивал владыку Диониса о том, при каких обстоятельствах смертные обычно устраивают свои величайшие пиры. Ибо есть у меня некоторые догадки на сей счёт...
AresWithDionysus01|Duo - Ares and Dionysus (1)|Dionysus|Да-да, Арес, отдаю тебе должное, дружище. Пирушки после войн — самые грандиозные, ты прав! Если тебе повезло оказаться на выжившей стороне. Осмелюсь предположить, что в противном случае пировать придётся там внизу вместе с *тобой*, Заг!
AresWithDemeter01|Duo - Ares and Demeter (1)|Ares|Холод смерти весьма к лицу богине Деметре, тебе так не кажется, мой смертоносный собрат? Да и она к нему уже почти привыкла.
AresWithDemeter01|Duo - Ares and Demeter (1)|Demeter|Ты забываешься, владыка Арес. Я куда старше тебя, и насланный мною голод успел сразить десятки тысяч смертных ещё до того, как ты впервые осмелился замыслить подобное.
AresKillQuestComplete|Ares Kill Quest Complete|Ares|Уже десять тысяч душ пали перед тобой, мой рождённый в преисподней собрат. Должен признать, я вне себя от восторга. Прекрасная работа.
AresAboutOlympianReunionQuest01|Ares About Olympian Reunion Quest 01|Zagreus|Ну, приступим. Именем Аида! Олимп, это официальное послание! Владыка Арес, прошу, рассмотри наше предложение... когда тебе удастся расшифровать его.
AresAboutOlympianReunionQuest01|Ares About Olympian Reunion Quest 01|Ares|О, что же это такое, собрат? Полагаю, некое приглашение для меня. И не только для меня... этот символ относится и ко всем остальным, не так ли? Загадочно. Приступлю к осмыслению этого послания, как только смогу. Ну а пока!
AresPostEpilogue01|Ares Post Epilogue 01|Ares|Хочу ещё раз сказать тебе, что я замечательно провёл время на нашем последнем совместном праздновании, собрат. Мне наконец удалось своими глазами повидать твоё переполненное смертью царство! Я узнал много нового. Надеюсь, вскоре благодаря нашему плодотворному сотрудничеству я смогу узнать ещё больше.
AresAboutZeus01|Ares About Zeus 01|Ares|Я вижу, владыка Зевс добрался до тебя первым? Дары моего отца очень щедры, но, думаю, я тоже смогу тебе помочь.
AresAboutPoseidon01|Ares About Poseidon 01|Ares|Благословение твоего дяди, владыки Посейдона помогало тебе до этого момента, но смотри: мой дар позволит тебе пройти ещё дальше.
AresAboutAthena01|Ares About Athena 01|Ares|Ты получил благословение Афины, верно? Она стремится защитить тебя от врагов, но по мне, лучше уничтожить их и дело с концом.
AresAboutAphrodite01|Ares About Aphrodite 01|Ares|*Хм*, я вижу, что ты уже получил благословение владычицы Афродиты. Любовь и смерть — вместе, рука об руку? Прекрасный тандем, как по мне.
AresAboutArtemis01|Ares About Artemis 01|Ares|Значит, Артемида, моя нелюдимая сводная сестра, разыскала тебя первой? Она просто помогает тебе в охоте, а я помогу тебе убивать. Смотри.
AresAboutDionysus01|Ares About Dionysus 01|Ares|Помощь этого забулдыги Диониса не сравнится с тем, что я могу предложить тебе, собрат из преисподней. Сравни его дар с моим.
AresAboutHermes01|Ares About Hermes 01|Ares|Наш вестник Гермес уже связался с тобой, не так ли? Вероятно, ты нечасто будешь видеться с ним, ведь плоды моего труда не позволяют ему надолго расслабляться — постоянно приходится провожать души в последний путь.
AresAboutDemeter01|Ares About Demeter 01|Ares|Я ощущаю на тебе неуловимую метку богини Деметры. Её повелевающие изобилием силы в каком-то смысле противоположны моим, но с недавних пор она стала пользоваться ими в стиле, подобном моему.
AresAboutHadesKeepsake01|Ares About Hades Keepsake 01|Ares|Ах, тебя благословил твой отец, собрат? Удивительно... Мне известно, что вы двое теперь работаете сообща, и всё же... По-прежнему не могу избавиться от мысли, что в вас кипит воинственная ненависть друг к другу. Но, возможно, всё ещё остались её отголоски, хм?
AresKillProgress01|Ares Kill Progress 01|Ares|Знаешь ли ты, собрат, что уничтожил более сотни врагов с тех пор, как начал свой путь? Так и есть, ведь я веду счёт. И ты впечатлил меня.
AresKillProgress02|Ares Kill Progress 02|Ares|Твои достижения в уничтожении врагов весьма впечатляют, собрат. По моим подсчётам, ты истребил не меньше тысячи душ там внизу! Конечно, эти души уже были мертвы, но всё же.
AresKillQuest01|Ares Kill Quest 01|Ares|Я знаю, что у тебя немало амбиций, мой славный собрат. Буду с тобой честен и расскажу о своей личной мотивации: пока ты продолжаешь сеять быструю и непоколебимую смерть, моя незыблемая помощь всегда будет с тобой.
AresKillQuestAftermath01|Ares Kill Quest Aftermath 01|Ares|Чем больше врагов ты убиваешь, собрат, тем крепче связь между нами. Разве ты тоже не чувствуешь это? Хотя, возможно, твоя жажда крови затмевает остальные чувства, хм?
AresAboutThanatos01|Ares About Thanatos 01|Ares|Вероятно, тебе знаком бог по имени Танатос? Мы с ним близкие соратники, знаешь ли. Передай ему мои наилучшие пожелания, если он встретится тебе в пути.
AresAboutThanatos02|Ares About Thanatos 02|Ares|Я надеюсь, что у Танатоса всё хорошо? Мне близок его стиль, хоть он и приносит смертным милосердный исход, а я такого совершенно не приемлю.
AresAboutThanatos03|Ares About Thanatos 03|Ares|Верно ли я понимаю, что вы с Танатосом весьма сблизились, собрат? Ты выбрал идеального спутника, но признаюсь, я не ожидал, что Смерть может испытывать привязанность к кому-либо кроме себя.
AresRunProgress01|Ares Run Progress 01|Ares|С тех пор как мы виделись в последний раз, ты сильно продвинулся на своём пути, собрат. А это значит, что на твоём счету бесчисленное количество смертей. И я хочу выразить своё одобрение.
AresRunProgress02|Ares Run Progress 02|Ares|*О*, мой собрат! Я чувствую, что совсем недавно ты пролил немало крови — и настоящей! Ты уничтожил тех, кто живёт у поверхности, ведь так? Конечно, это были жалкие грызуны, но я и этим доволен.
AresRunCleared01|Ares Run Cleared 01|Ares|Недавно на поверхности произошёл всплеск жестокости. Неподалёку от того места, где ты сейчас, но повыше. Это событие было довольно необычным и, по-видимому, именно оно вынудило тебя вновь вернуться. Пустяки, ведь время на нашей стороне.
AresRunCleared02|Ares Run Cleared 02|Ares|С недавних пор я часто ощущаю смерть у врат, ведущих в царство твоего отца, собрат. Да, на первый взгляд кажется, что всё абсолютно логично, но... не думаю, что это так. Интересно, не знаешь ли *ты*, в чём причина...
AresRunCleared03|Ares Run Cleared 03|Ares|Твои попытки попасть к нам раз за разом терпят неудачу, мой славный собрат. Однако за это время мы принесли столько страданий, что на самом деле даже остались в выигрыше. Так не будем же останавливаться на достигнутом.
AresAboutWar01|Ares About War 01|Ares|Уверен, тебе доводилось слышать о войне, развернувшейся на поверхности, и ты наверняка заметил наплыв павших смертных. Эта война весьма неплоха, должен сказать! Но сомневаюсь, что она попадёт в число великих. Боюсь, для этого в ней участвует слишком мало армий.
AresAboutWar02|Ares About War 02|Ares|Война — удивительное явление, собрат. Она решает множество проблем и поражает своей извечной неизбежностью. Так давай же не дадим ей закончиться, м?
AresAboutWar03|Ares About War 03|Ares|Тебя никогда не посещала мысль о том, что, возможно, ты родился слишком поздно, собрат? Мне, вот, хотелось бы лично поучаствовать в свирепой войне, которую мой отец с семьёй вели против титанов. О, должно быть, она была великолепной!
AresAboutWeaponEnchantments01|Ares About Weapon Enchantments 01|Ares|Я чувствую, что ты сильно сблизился со своими орудиями разрушения, собрат. Это очень хорошо. Пусть их изменённые формы сослужат тебе добрую службу.
AresAboutGuanYuAspect|Ares About Guan Yu Aspect|Ares|О, я полагаю, в твоих руках Ледяное гуаньдао! Думается мне, однажды оно станет излюбленным инструментом очередного бога войны. Жду не дождусь встречи с тем, кто так же любит сеять смерть.
AresAboutArthurAspect|Ares About Arthur Aspect|Ares|О, твой клинок... Похоже, он без труда сможет лишить смертного головы. Экскалибур, не так ли? Я изучал все замыслы Мойр, и, должен сказать, этот — среди моих фаворитов.
AresAboutRamaAspect01|Ares About Rama Aspect 01|Ares|В твоих руках судьбоносный лук Шаранга! Не ожидал, что ты завладеешь этой формой. У тебя утончённый вкус в оружии, собрат!
AresAboutBeowulfAspect01|Ares About Beowulf Aspect 01|Ares|В твоём владении пожирающий пламя щит, принадлежащий великому воину Беовульфу? Мне было известно, что у Мойр есть планы на него, но я никак не ожидал, что ты окажешься в них замешан!
AresAboutGilgameshAspect01|Ares About Gilgamesh Aspect 01|Ares|Это же перчатки судьбоносного царя Гильгамеша, не так ли? Ты сеешь разрушение и исполняешь волю Мойр... да ты полон сюрпризов, собрат!
AresAboutLuciferAspect01|Ares About Lucifer Aspect 01|Ares|Вижу, ты владеешь инструментом для ведения войны, принадлежащим Люциферу. Мне о нём практически ничего не известно, но ведь очевидно, что он эксперт в разрушениях, не так ли?
AresAboutKeepsake01|Ares About Keepsake 01|Ares|О, ты взял с собой фиал с кровью, который я даровал тебе! В нём заключена кровь смертного... я сам пролил её. Слишком уж редко мне удаётся самостоятельно вмешаться в подобные дела.
AresBackstory01|Ares Backstory 01|Ares|Знай, что я восхищаюсь твоим царственным отцом. Ведь его мрачная работа позволяет мне продолжать свою. Надеюсь, однажды вы разрешите свои разногласия.
AresPostFlashback01|Ares Post Flashback 01|Ares|Говорят, ты сын самой богини ночи? Она интригующее создание. Её недолюбливают на Олимпе, но мне всегда хотелось встретиться с ней.
AresPostGiftPickup01|Ares Post Gift Pickup 01|Ares|А-а, мой любимый посланник смерти из Подземного мира. Я с нетерпением жду, какие же страдания ты посеешь вокруг на этот раз.
AresPostGiftPickup02|Ares Post Gift Pickup 02|Ares|Если бы только внезапные бедствия войны могли помочь тебе выбраться из этой неприятной ситуации. Я не задумываясь затеял бы ради тебя заварушку!
AresPostGiftPickup03|Ares Post Gift Pickup 03|Ares|А, мой самый дорогой собрат во всём Подземном мире, кажется, я вижу тебя там! Каким жестоким делам мы посвятим себя сегодня?
AresPostGiftPickup04|Ares Post Gift Pickup 04|Ares|Здесь наверху постоянно ведут невыносимые беседы о мирной жизни, собрат. Я всегда рад уделить своё внимание куда более важным делам, например тебе.
AresPostGiftPickup05|Ares Post Gift Pickup 05|Ares|Должно быть, тебе известно, что я нередко испытываю необузданную жажду сеять разрушения. Но я заметил, что тебе удаётся утолить её.
AresPostGiftPickup06|Ares Post Gift Pickup 06|Ares|Пусть по всему миру боязливые смертные шёпотом пересказывают друг другу легенды о твоих убийствах, собрат.
AresAboutNyxIntro01|Ares About Nyx Intro 01|Ares|О, как бы мне хотелось лично познакомиться с богиней Никтой, собрат! Многие мои войны велись под покровом ночи... Я крайне благодарен и желаю ей успехов.
AresAboutNyx01|Ares About Nyx 01|Ares|Как поживает твоя матерь Никта в последнее время, собрат? Ты уже передал ей моё приветствие? Ибо, думается мне, Ночь и Война во многом схожи.
AresAboutNyx01_B|Ares About Nyx 01 B|Ares|Как поживает Никта в последнее время, собрат? Ты уже передал ей моё приветствие? Ибо, думается мне, Ночь и Война во многом схожи.
AresAboutNyx02|Ares About Nyx 02|Ares|Обязательно передай своей матери-воплощению ночи, что я нередко думаю о ней, хоть мы и не знакомы. Она должна знать, что на Олимпе есть те, кто ей восхищается.
AresAboutNyx02_B|Ares About Nyx 02 B|Ares|Обязательно передай воплощению ночи, что я нередко думаю о ней. Она должна знать, что на Олимпе есть те, кто восхищается ею.
AresAboutNyx03|Ares About Nyx 03|Ares|Возможно, когда всё это будет уже позади, мой славный собрат, тебе удастся как-нибудь наладить общение между мной и твоей матерью тьмы, Никтой? Прошу, подумай об этом и сообщи ей о моей заинтересованности, коли пожелаешь.
AresAboutNyx03_B|Ares About Nyx 03 B|Ares|Возможно, когда всё это будет уже позади, мой славный собрат, тебе удастся как-нибудь наладить общение между мной и богиней Никтой? Прошу, подумай об этом и сообщи ей о моей заинтересованности, коли пожелаешь.
AresAboutNyx04|Ares About Nyx 04|Ares|Мы с твоей матерью Никтой начали обмениваться посланиями, мой славный собрат. Я очень ценю то, что ты наладил общение между нами. Позволю себе заметить, что она — весьма очаровательная особа.
AresAboutNyx04_B|Ares About Nyx 04 B|Ares|Мы с богиней Никтой начали обмениваться посланиями, мой славный собрат. Я очень ценю то, что ты наладил общение между нами. Позволю себе заметить, что она — весьма очаровательная особа.
AresAboutNyx05|Ares About Nyx 05|Ares|Думаю, ты будешь рад узнать, что мы с твоей матерью Никтой собираемся встретиться. Я с нетерпением жду возможности обмениваться идеями с ней лично.
AresAboutNyx05_B|Ares About Nyx 05 B|Ares|Думаю, ты будешь рад узнать, что мы с Никтой собираемся встретиться. Я с нетерпением жду возможности обмениваться идеями с ней лично.
AresAboutNyx06|Ares About Nyx 06|Ares|Прошу, передай своей матери Никте мой сердечный привет, собрат. Жаль, другие жители Олимпа не понимают и не знают подобных тебе так, как я теперь.
AresAboutNyx06_B|Ares About Nyx 06 B|Ares|Прошу, передай богине Никте мой сердечный привет, собрат. Жаль, другие жители Олимпа не понимают и не знают подобных тебе так, как я теперь.
AresPostEpilogue02|Ares Post Epilogue 02|Ares|Знаешь, собрат, я ошибочно полагал, что Никта является твоей матерью. А вот Персефона? Никогда не думал, что её может заинтересовать твоё царство. Жаль, у нас не было возможности обсудить эту тему здесь.
