Id|Description|Speaker|Text
AresPostEpilogue03|Ares Post Epilogue 03|Ares|Твоя славная мать Персефона... ужасающая царица Подземного мира! Несомненно, я составил о ней неправильное мнение, когда нам доводилось видеться на Олимпе. Возможно, и мне следует задуматься о проживании в твоём царстве...
AresHasWeapon01|Ares Has Weapon 01|Ares|У тебя в руках Варата, Вечное копьё!.. Я думал, оно утеряно! Ты хоть представляешь, сколько жизней оно погубило в дни великой славы твоего отца?
AresHasWeapon02|Ares Has Weapon 02|Ares|А, ты выбрал Коронахт, Ищущий сердца. В годы войны между представителями нашего рода он одной стрелой пронзил сразу трёх титанов. Прошу тебя, обращайся с ним бережно!
AresHasWeapon03|Ares Has Weapon 03|Ares|У тебя в руках Эгида, щит Хаоса... Он совсем не похож на тот, с которым красуется моя добрая сестра Афина. У тебя весьма неплохой вкус.
AresHasWeapon04|Ares Has Weapon 04|Ares|Да это же Экcагриф, Адамантовое орудие! Одно из самых удивительных оружейных устройств. Только представь себе новое обличье войны, если его секреты однажды будут разгаданы и отданы всем смертным!
AresHasWeapon05|Ares Has Weapon 05|Ares|Да это же перчатки-близнецы Мальфон в твоих умелых руках! Многие виды оружия лишь косвенно влекут разрушения, но не Мальфон — с ним ты наиболее вовлечён в процесс.
AresLegendaryPickUp01|Ares Legendary Pick Up 01|Ares|В величайших войнах заключаются великие союзы, собрат, и поэтому я дарую тебе одни из лучших средств уничтожения, которые я успел создать.
AresLegendaryPickUp02|Ares Legendary Pick Up 02|Ares|Сейчас ветра войны на поверхности дуют всё яростнее, собрат. И поэтому я могу предложить тебе ещё более великие силы, чем прежде.
AresLowHealth01|Ares Low Health 01|Ares|Кажется, ты на волоске от смерти, собрат. Мне не терпится услышать об этом! Опыт смерти, возможность переживать её снова и снова! Ты единственный в своём роде!
AresLowHealth02|Ares Low Health 02|Ares|О, я вижу, тебе пришлось нелегко на пути сюда, собрат. Это неважно, ведь очень скоро твоих врагов ждёт расплата.
AresLowHealth03|Ares Low Health 03|Ares|Так много крови пролито, так много... да ещё и твоей собственной. Давай попытаемся не дать тебе умереть, чтобы ты смог ринуться в битву ещё ненадолго.
AresLowHealth04|Ares Low Health 04|Ares|Вижу, ты близок к очередной встрече со смертью, мой рождённый в преисподней собрат. Не забудь забрать кого-нибудь с собой, договорились?
AresLowHealth05|Ares Low Health 05|Ares|Несомненно, смертный бы уже скончался от ран, подобных твоим. Впечатляет, что ты можешь двигаться дальше в таком состоянии.
AresFirstPickUp|Ares First Pick Up|Zagreus|Пожалуй, рано или поздно он был обязан появиться. Именем Аида! Олимп! Я принимаю это послание.
AresFirstPickUp|Ares First Pick Up|Ares|Должен признать, ты сражаешься как истинный воин. Интригующе, но в то же время ничего удивительного для того, кто был рождён в преисподней. Когда выберешься оттуда, расскажешь мне всё подробно. Видишь ли, я и сам ученик смерти.
AresMiscPickup01|Ares Misc Pickup 01|Ares|Должен признать, ты мастерски освоил искусство сеять смерть. Хотя, возможно, тебе пригодится моя помощь, м?
AresMiscPickup02|Ares Misc Pickup 02|Ares|*А*, я догадывался, что ты и есть причина кровопролития в Подземном мире. Давай посмотрим, смогу ли я помочь тебе сеять смерть щедрой рукой.
AresMiscPickup03|Ares Misc Pickup 03|Ares|Ну что же, мой рождённый в преисподней брат, отдаю своё благословение в твоё полное распоряжение. Но обещай, что в благодарность причинишь врагам толику страданий?
AresMiscPickup04|Ares Misc Pickup 04|Ares|В этот раз я подобрал для тебя кое-что особенное, собрат. Позволь представить мои орудия, сеющие боль.
AresMiscPickup05|Ares Misc Pickup 05|Ares|Надеюсь, ты уже потерял счёт своим кровопролитным сражениям, да не будет им конца! Как и всегда, я здесь, чтобы помочь тебе.
AresMiscPickup06|Ares Misc Pickup 06|Ares|Как продвигается твоя бесконечная война против мёртвых? Да будет тебе известно: я с радостью выбираю стороны в подобных делах. Ну же, я настаиваю!
AresMiscPickup07|Ares Misc Pickup 07|Ares|У смерти тысячи лиц. Уверен, тебе это известно. Вряд ли возможно узреть их все, однако я призываю тебя попробовать.
AresMiscPickup08|Ares Misc Pickup 08|Ares|Проклятые мертвецы, которые стоят у тебя на пути, похоже, забыли своё место. Иди и напомни им о мучениях, которые привели их в твой мир.
AresMiscPickup09|Ares Misc Pickup 09|Ares|Жизнь и смерть неразрывны, и зачастую война — это то, что связывает их. Ты не находишь?
AresMiscPickup10|Ares Misc Pickup 10|Ares|Этот мир обладает безграничными возможностями для боли, и меня совсем не затруднит помочь тебе причинять ещё больше страданий.
AresMiscPickup11|Ares Misc Pickup 11|Ares|Как живые, так и мёртвые страстно желают того, что я олицетворяю. Их жажду крови нелегко утолить. Цель, к которой стоит стремиться, разве не так?
AresMiscPickup12|Ares Misc Pickup 12|Ares|Похоже, мертвецы, с которыми ты сражаешься, давно забыли об отчаянии и страданиях. Полагаю, ты вскоре напомнишь им об этом за меня?
AresMiscPickup13|Ares Misc Pickup 13|Ares|Красиво, не правда ли? Раздор, который следует за тобой по пятам. У тебя к этому природный талант, и я рад помочь ему раскрыться.
AresMiscPickup14|Ares Misc Pickup 14|Ares|Некоторым могут не понравиться разрушения, которые ты сеешь, но только не мне. Я прекрасно понимаю эти порывы и готов поспособствовать тебе.
AresMiscPickup15|Ares Misc Pickup 15|Ares|Твой царственный отец не раз благодарил меня за то, что я увеличивал поток его клиентов. Несомненно, ты тоже будешь благодарен мне за мои дары.
AresMiscPickup16|Ares Misc Pickup 16|Ares|Как ты думаешь, мёртвые испытывают боль иначе, чем живые? Для меня это предмет бесконечного любопытства, так что продолжай — дай мне новую пищу для размышлений.
AresMiscPickup17|Ares Misc Pickup 17|Ares|Ты продолжаешь вести войну против мёртвых, и я с радостью окажу тебе поддержку — без лишних вопросов, ведь мы одна семья.
AresMiscPickup18|Ares Misc Pickup 18|Ares|То, что твой отец отгородился от всех нас, — настоящее преступление. Большая удача, что ты оказался более сговорчивым.
AresMiscPickup19|Ares Misc Pickup 19|Ares|Давай же с тобой вместе посеем смерть!
AresMiscPickup20|Ares Misc Pickup 20|Ares|Не продолжить ли нам наш поход против мёртвых?
AresMiscPickup21|Ares Misc Pickup 21|Ares|А не пора ли нам причинить мёртвым немного боли, как в старые добрые времена?
AresMiscPickup22|Ares Misc Pickup 22|Ares|Разрушения, которые ты вызвал, не ускользнули от моего внимания!
AresMiscPickup23|Ares Misc Pickup 23|Ares|Перед нами открывается уникальный шанс сеять боль и страдания. Приступим!
AresMiscPickup24|Ares Misc Pickup 24|Ares|Не существует проблемы, которую бы не смогла решить война.
AresMiscPickup25|Ares Misc Pickup 25|Ares|А вот и ты, собрат! У меня есть дар, который поможет тебе вершить твоё кровавое возмездие.
AresMiscPickup26|Ares Misc Pickup 26|Ares|Прими моё благословение, и пусть смерть следует за тобой.
AresMiscPickup27|Ares Misc Pickup 27|Ares|Прошу, причиняй страдания здесь ради меня, собрат.
AresMiscPickup28|Ares Misc Pickup 28|Ares|Я дам тебе силу, чтобы ты мог причинить ещё больше боли, чем прежде.
AresMiscPickup29|Ares Misc Pickup 29|Ares|Война должна вестись не только на поверхности земли, собрат.
AresMiscPickup30|Ares Misc Pickup 30|Ares|Я так понимаю, ты успешно несёшь разрушение на своём пути?
AresMiscPickup31|Ares Misc Pickup 31|Ares|Недавние разрушения, учинённые тобой, впечатлили меня.
AresMiscPickup32|Ares Misc Pickup 32|Ares|Всякий раз, когда ты убиваешь, ты можешь рассчитывать на мою полную поддержку.
AresMiscPickup33|Ares Misc Pickup 33|Ares|Как продвигается беспрерывное кромсание твоих врагов, собрат? Успешно?
AresMiscPickup34|Ares Misc Pickup 34|Ares|Возможно, моё благословение поможет тебе убивать ещё более эффективно.
AresMiscPickup35|Ares Misc Pickup 35|Ares|Думается мне, что царство твоего отца будет переполнено, когда мы с тобой закончим свою работу.
AresMiscPickup36|Ares Misc Pickup 36|Ares|Я дарую тебе лучшие смертоносные инструменты из всех, что у меня есть.
AresMiscPickup37|Ares Misc Pickup 37|Ares|Я хочу предложить тебе выбрать один из моих самых изысканных инструментов, призванных причинять страдания.
AresMiscPickup38|Ares Misc Pickup 38|Ares|Как ты думаешь, а не начать ли нам следующую войну с особым даром, собрат?
AresMiscPickup39|Ares Misc Pickup 39|Ares|Давно я не видел яростного кровопролития. Прошу, давай наверстаем упущенное.
AresMiscPickupExtra01|Ares Misc Pickup Extra 01|Ares|Существует столь много способов погибнуть... и всё же внезапную насильственную смерть ничто не превзойдёт.
AresMiscPickupExtra02|Ares Misc Pickup Extra 02|Ares|С нетерпением жду, когда же мы начнём вместе убивать твоих врагов, собрат.
AresMiscPickupExtra03|Ares Misc Pickup Extra 03|Ares|Как ты думаешь, не пора ли нам вновь начать одну из наших прославленных серий убийств, собрат?
AresMiscPickupExtra04|Ares Misc Pickup Extra 04|Ares|Не так давно я наблюдал за кровополитием в последний раз... но для меня это было будто целую вечность назад.
AresMiscPickupRareExtra01|Ares Misc Pickup Rare Extra 01|Ares|Сейчас я предоставлю тебе свои наиболее искусные орудия, сеющие смерть, собрат.
AresMiscPickupRareExtra02|Ares Misc Pickup Rare Extra 02|Ares|Давай сделаем это кровопролитие поистине запоминающимся, м?
AresMiscPickupRareExtra03|Ares Misc Pickup Rare Extra 03|Ares|Надеюсь, ты посеешь столько разрушений, что эта гора содрогнётся до самого основания, собрат.
AresMiscPickupRareExtra04|Ares Misc Pickup Rare Extra 04|Ares|А сейчас я дарую тебе орудия для грандиозного опустошения, собрат!
AresMiscPickupAboutNyx01|Ares Misc Pickup About Nyx 01|Ares|Меня крайне порадовало недавнее послание от Никты, собрат.
AresMiscPickupAboutNyx02|Ares Misc Pickup About Nyx 02|Ares|Пускай удивительная богиня Никта и дальше присматривает за тобой, застилая пеленой тьмы взор твоих врагов.
AresMiscPickupAboutNyx03|Ares Misc Pickup About Nyx 03|Ares|Подумать только, тебе помогает не только богиня Никта, но и я!
AresLootBought01|Ares Loot Bought 01|Ares|Я знал, что этот гнусный лодочник не подведёт меня, и среди его товаров ты найдёшь мой дар!
AresLootBought02|Ares Loot Bought 02|Ares|В знак уважения я передаю тебе этот дар, не смотри, что он погребён среди скарба лодочника.
AresLootBought03|Ares Loot Bought 03|Ares|Я вижу, что в последнее время лодочник Харон трудится не покладая рук, и всё благодаря мне?
AresLootBought04|Ares Loot Bought 04|Ares|Чтобы поспевать за мной, собрат, перевозчику Харону стоит приобрести лодку повместительнее.
AresLootBought05|Ares Loot Bought 05|Ares|Кажется, твой лодочник — надёжный сеятель смерти. Значит, здесь трое мастеров сего ремесла.
AresRejection01|Ares Rejection 01|Ares|Ты отклоняешь моё щедрое предложение помощи? *Ха-ха-ха*, должно быть, ты меня плохо знаешь. Смерть обязательно придёт, и неважно к кому — к твоим врагам или к тебе.
AresRejection02|Ares Rejection 02|Ares|Ты отказываешься от помощи, которую я предлагаю тебе? Какое разочарование. Тебе ещё многому предстоит научиться, чтобы освоить искусство убивать.
AresRejection03|Ares Rejection 03|Ares|Пойти против меня — неверное решение, собрат. Должна пролиться кровь, и твоя как раз сгодится для этого.
AresRejection04|Ares Rejection 04|Ares|Очень глупо с твоей стороны отказываться от моего предложения. Теперь ты понесёшь наказание от моей руки.
AresRejection05|Ares Rejection 05|Ares|Твой выбор оставляет желать лучшего, собрат. Я с трудом сдерживаю свой гнев.
AresRejection06|Ares Rejection 06|Ares|Я разочарован твоим выбором, собрат. Такие действия влекут за собой определённые последствия. Каждый раз.
AresRejection07|Ares Rejection 07|Ares|Твоя стратегия неразумна, собрат. Ибо война придёт к тебе несмотря ни на что. И сейчас я это докажу.
AresRejection08|Ares Rejection 08|Ares|Капризы богов непредсказуемы, собрат. Но, как тебе предстоит убедиться, наша реакция на подобные деяния всегда остаётся неизменной.
AresRejection09|Ares Rejection 09|Ares|Я не потерплю такого пренебрежения нашей былой дружбой, собрат. На войне каждый выбирает лишь одну сторону, и лучше бы тебе было выбрать мою.
AresRejection10|Ares Rejection 10|Ares|Война должна разразиться здесь, не взирая ни на что, собрат. Но всё равно я обескуражен, что ты пошёл против меня.
AresRejection11|Ares Rejection 11|Ares|Хочешь узнать, каково это — пойти на меня войной? Что же, я покажу тебе.
AresRejection12|Ares Rejection 12|Ares|Я действительно почувствовал твою нерешительность там? Вероятно, уже тогда ты знал, что просчитался. Не важно. Ты научишься на своих ошибках.
AresRejection13|Ares Rejection 13|Ares|Не следует пытаться разгневать меня подобными мелочными оскорблениями. И всё же, тебе придётся поплатиться за них.
AresMakeUp01|Ares Make Up 01|Ares|Ты принёс жертву кровью и расплатился за свой проступок. Но в следующий раз подумай дважды, прежде чем перечить мне, а?
AresMakeUp02|Ares Make Up 02|Ares|Тебе удалось выдержать мою жажду убийства! Такая стойкость заслуживает награды, и сегодня я очень щедр.
AresMakeUp03|Ares Make Up 03|Ares|Не часто случается выжить тем, кого я намереваюсь убить. Браво! На этот раз мы сравняли счёты и можем остаться друзьями.
AresMakeUp04|Ares Make Up 04|Ares|Ты пережил мой гнев, и я отдаю тебе за это должное. Продолжим наше общее дело — как друзья и родственники.
AresMakeUp05|Ares Make Up 05|Ares|Думаю, мы уладили это недоразумение до поры. Но не стоит и дальше испытывать моё терпение, да?
AresMakeUp06|Ares Make Up 06|Ares|Ты с честью преодолел поле битвы. И всё же поблагодари свою удачу за то, что я в щедром расположении духа.
AresMakeUp07|Ares Make Up 07|Ares|После того как проливается кровь и приходит смерть, я просто не могу оставаться в плохом настроении.
AresMakeUp08|Ares Make Up 08|Ares|Эта яркая демонстрация жестокости заслуживает самой высокой похвалы, собрат. Вот, держи.
AresMakeUp09|Ares Make Up 09|Ares|Жертва, которую ты принёс мне, подтолкнула меня к прощению на сей раз. Объявим же перемирие.
AresMakeUp10|Ares Make Up 10|Ares|Война не может продолжаться вечно, собрат. Думаю, эта ссора не стоит того, чтобы длить её. Лучше вернёмся к великим сражениям вместе.
AresMakeUp11|Ares Make Up 11|Ares|Ах, разве после такого жестокого поединка я могу продолжать грустить, собрат?
AresMakeUp12|Ares Make Up 12|Ares|Твоё неуважение уже забыто, ибо я был чрезвычайно рад узреть такое чудовищное проявление силы.
AresGift01|Ares Gift 01|Zagreus|Владыка Арес, прошу принять это подношение в знак благодарности за силу, которую ты даровал мне для победы.
AresGift01|Ares Gift 01|Ares|А ты опытный льстец, мой смертоносный брат. Сегодня я тоже очень щедр, поэтому вот, возьми это! Небольшой подарок в знак моего расположения к тебе.
AresGift02|Ares Gift 02|Zagreus|Владыка Арес, позволь отблагодарить тебя за силу, которую ты даровал мне, чтобы сокрушить моих врагов.
AresGift02|Ares Gift 02|Ares|Какое великолепное подношение! Очень предусмотрительно с твоей стороны, собрат. Ты застал меня врасплох, но я принимаю твой дар!
AresGift03|Ares Gift 03|Zagreus|Владыка Арес! Прошу тебя принять это в знак моей глубочайшей признательности за твою щедрую помощь.
AresGift03|Ares Gift 03|Ares|Подношение для меня? Ну надо же! Как любезно с твоей стороны, что ты подумал обо мне. Знай, что и я не забываю о тебе.
AresGift04|Ares Gift 04|Zagreus|Владыка Арес, для меня большая честь познакомиться с тобой и обучиться твоему смертоносному искусству.
AresGift04|Ares Gift 04|Ares|Я ценю твой подарок, хотя тебе вовсе не стоило беспокоиться! Страдания, которые ты сеешь вокруг, с лихвой компенсируют мой труд.
AresGift05|Ares Gift 05|Zagreus|Ты всегда относился ко мне с уважением и раз за разом даровал свои благословения, владыка Арес. Этим я едва ли могу отплатить за твою доброту.
AresGift05|Ares Gift 05|Ares|Обычно, когда мне совершают подношения, это делается с просьбами о помощи в приближающейся войне. Хотя с твоей стороны, собрат, я не чувствую подобного стремления. И, должен признать, это меня обескураживает.
AresGift06|Ares Gift 06|Zagreus|Владыка Арес! Поскольку без кровопролития в моей ситуации не обойтись, я хочу выразить благодарность за твою помощь. Я знаю, что не стоит принимать её как должное.
AresGift06|Ares Gift 06|Ares|Ты крайне милостив ко мне, собрат, и я навечно очарован твоей любовью к кровопролитию. Полагаю, жестокость, которую я сеял от твоего имени, пришлась тебе по вкусу?
