Id|Description|Speaker|Text
AresGift07|Ares Gift 07|Zagreus|Я подношу эту амброзию, чтобы восславить тебя, владыка Арес. За бога войны! Сколько врагов я уничтожил благодаря твоей помощи и поддержке? Это честь для меня — знать тебя и быть твоим кузеном.
AresGift07|Ares Gift 07|Ares|Ах, какой изысканный подарок. И всё же разрушения, посеянные тобой, настоящая кровавая бойня... ничто не сможет их превзойти. Если когда-нибудь начнёшь войну, собрат... я имею в виду настоящую войну... обязательно свяжись со мной. Думаю, я приму твою сторону.
ArtemisWithAres01|Duo - Artemis and Ares (1)|Artemis|Загрей, хотела бы я, чтобы мы все могли тебя слышать. Тогда славный владыка Арес смог бы осознать, что мои силы используются абсолютно в других целях, нежели его.
ArtemisWithAres01|Duo - Artemis and Ares (1)|Ares|Возможно, дорогая Артемида, наши силы когда-то и использовались в разных целях. Но разве мы можем поспорить с конечным результатом? Понаблюдай за тем, что произойдёт, когда мы даруем нашему собрату свою единую мощь.
ArtemisWithAres02|Duo - Artemis and Ares (2)|Artemis|Загрей, я лишь мечтала немного побыть в одиночестве перед этой охотой, ибо я всегда предпочитаю поступать именно так, но, видишь ли, владыка Арес вечно оказывается поблизости, как только завидит какое-либо охотничье оружие!
ArtemisWithAres02|Duo - Artemis and Ares (2)|Ares|Ах, моя дорогая Артемида, охота — всего лишь прелюдия к войне, разве нет? Ибо если смертным было бы ничего не известно об охоте, они бы не смогли так умело убивать друг друга.
ArtemisWithAres02|Duo - Artemis and Ares (2)|Artemis|Послушай, владыка Арес, если я одолжу тебе способность лучше попадать в цель, ты оставишь меня в покое?
AphroditeWithAres01|Duo - Aphrodite and Ares (1)|Aphrodite|Мне кажется, дорогуша, что для многих станет сюрпризом то, что нередко любовь и война идут рука об руку. Эти силы противоположны, но всё же что-то их объединяет. Самые яркие страсти богов и смертных! Не так ли, владыка Арес?
AphroditeWithAres01|Duo - Aphrodite and Ares (1)|Ares|Смертные так сильно цепляются за свою жизнь, что многие из них с радостью будут убивать, лишь бы её сохранить. Этот всплеск эмоций... Подобные страсти ничуть не отличаются друг от друга, милая владычица Афродита.
DionysusWithAres01|Duo - Dionysus and Ares (1)|Dionysus|Знаешь, Заг, возможно, когда ты сюда доберёшься, тебе удастся немного развеселить старого доброго Ареса, а, дружище? Вечно он убивает хорошее настроение своими беседами о крови, мерзостях и тому подобной ерунде!
DionysusWithAres01|Duo - Dionysus and Ares (1)|Ares|Надо же, владыка Дионис! Мне не ясно, почему эти темы для беседы считаются неподходящими для пира. Ведь успешно завершённая война — превосходный повод для празднования, или я не прав?
PoseidonWithAres01|Duo - Poseidon and Ares (1)|Poseidon|Итак, младшенький Аид, ты ведь уже успел узнать, что помимо тебя у меня есть здесь и другие племянники? Первым на ум мне приходит Арес — бог войны! Некоторые великие войны велись на морских просторах, не так ли?
PoseidonWithAres01|Duo - Poseidon and Ares (1)|Ares|Да, всё верно, дядя Посейдон. Когда дело доходит до войны, смертные проявляют удивительную изобретательность — она стимулирует их чувство прогресса сильнее, чем что бы то ни было. Возможно, однажды они смогут развернуть войну даже на отцовских небесах.
DemeterWithAres01|Duo - Demeter and Ares (1)|Demeter|Юный Загрей, раз ты здесь, скажи владыке Аресу, что его великая сила ничего не стоит без моей. У войн есть причины, и многие из них появляются благодаря мне.
DemeterWithAres01|Duo - Demeter and Ares (1)|Ares|Я не сомневаюсь, что ты можешь сподвигнуть смертных начать войну, величественная богиня Деметра. Мы могли бы сойтись на том, что наши силы весьма соизмеримы!
