Id|Description|Speaker|Text
DemeterMakeUp10|Demeter Make Up 10|Demeter|Может, пережив ещё несколько таких зим, ты поймёшь, как устроен этот мир?
DemeterMakeUp11|Demeter Make Up 11|Demeter|Хватит. Я не припоминаю старые обиды, Загрей. Ты получил мою благосклонность, и я больше не сержусь.
DemeterGift01|Demeter Gift 01|Zagreus|Славная владычица Деметра, ты приняла меня с теплом и щедростью, и я благодарен тебе за это. Прими этот скромный подарок в знак моей благодарности.
DemeterGift01|Demeter Gift 01|Demeter|Юный Загрей, этот подарок идеально подходит ко времени года! За твоё благородство и послушание я подарю тебе взамен то, чего я не дарила смертным.
DemeterGift02|Demeter Gift 02|Zagreus|Маленький подарок для тебя, славная владычица Деметра. Я глубоко благодарен тебе за готовность помочь мне со всем этим.
DemeterGift02|Demeter Gift 02|Demeter|Загрей, я принимаю твой прекрасный подарок — этот нектар. Ах, если бы смертные выказывали нам такое почтение.
DemeterGift03|Demeter Gift 03|Zagreus|Пусть этот скромный подарок порадует тебя там на Олимпе, владычица Деметра. Благодарю тебя за помощь.
DemeterGift03|Demeter Gift 03|Demeter|Продуманный подарок, мой малый росточек. Благодарю за твою щедрость. Капля нектара может расколоть лёд, ты знал?
DemeterGift04|Demeter Gift 04|Zagreus|Твои сила и мудрость невероятно помогли мне, владычица Деметра. Для меня это большая честь, и это меньшее, что я могу дать взамен.
DemeterGift04|Demeter Gift 04|Demeter|Я была уверена, что нынешнее молодое поколение не отличается тактичностью, юный Загрей. В кои-то веки я рада, что ошибалась.
DemeterGift05|Demeter Gift 05|Zagreus|Владычица Деметра, я навсегда у тебя в долгу за проявленную тобой доброту и за силы, которыми ты одариваешь меня.
DemeterGift05|Demeter Gift 05|Demeter|Запасы нектара почти иссякли из-за вечной зимы. И посему я не забуду того, что ты решил вручить *мне *подобный подарок.
DemeterGift06|Demeter Gift 06|Zagreus|Нередко я вспоминаю, что мир не так жесток, только благодаря твоей милости, владычица Деметра. Я счастлив, что мы сблизились.
DemeterGift06|Demeter Gift 06|Demeter|Ты вновь совершаешь мне подношения? Хоть я и ясно сказала, что в последнее время не желаю быть щедрой с кем-либо, а, Загрей? Ты либо наивен, либо чересчур добр, либо и то, и другое.
DemeterGift07|Demeter Gift 07|Zagreus|*Эм*, бабушка? Надеюсь, ты не против, если я буду тебя так звать. Я очень горд тем, что мы с тобой связаны родственными узами. Твоя власть над жизнью... кажется, мне тоже досталась её доля! И я бы не справился без твоей помощи. Прошу, за всё, что ты сделала... это тебе.
DemeterGift07|Demeter Gift 07|Demeter|Ах, внук, это такая честь для меня... Я невероятно счастлива, что мы повстречались, и что... ты — это *ты*, если ты понимаешь, что я хочу этим сказать. У меня есть сёстры, но... очень долгое время у меня были лишь они.
