Id|Description|Speaker|Text
ZeusWithDemeter01|Duo - Zeus and Demeter (1)|Zeus|Так-так, юноша, что бы тебе ни наговорили о славной Деметре, я хочу всё прояснить. Она как сестра мне, это верно. Хотя и её родителей-титанов, и моих постигла одна и та же участь.
ZeusWithDemeter01|Duo - Zeus and Demeter (1)|Demeter|Ну что же ты, приёмный братец Зевс! Удивительно слышать от тебя настолько откровенные речи! Кажется, будто ты говоришь правду лишь тогда, когда я могу тебя услышать.
AresWithDemeter01|Duo - Ares and Demeter (1)|Ares|Холод смерти весьма к лицу богине Деметре, тебе так не кажется, мой смертоносный собрат? Да и она к нему уже почти привыкла.
AresWithDemeter01|Duo - Ares and Demeter (1)|Demeter|Ты забываешься, владыка Арес. Я куда старше тебя, и насланный мною голод успел сразить десятки тысяч смертных ещё до того, как ты впервые осмелился замыслить подобное.
ArtemisWithDemeter01|Duo - Artemis and Demeter (1)|Artemis|О, привет, Загрей, а я тут как раз безуспешно пытаюсь уговорить владычицу Деметру ослабить власть снега, который хозяйничает у нас уже какое-то время. Некоторых смертных он порядком утомил, да и охотиться с ним куда сложнее!
ArtemisWithDemeter01|Duo - Artemis and Demeter (1)|Demeter|Смертные изобретательны, Артемида. Пожалуй, это единственная их хорошая черта! Они найдут способ пережить долгую зиму. Им придётся, ибо они сами навлекли её на себя.
AphroditeWithDemeter01|Duo - Aphrodite and Demeter (1)|Aphrodite|Почтенная богиня смены времён года Деметра предпочитает выглядеть как можно более недоступной, представляешь себе, дорогуша? Хотя мне не понять, почему хоть кому-то может нравиться видеть столько мелких морщинок на своём лице.
AphroditeWithDemeter01|Duo - Aphrodite and Demeter (1)|Demeter|Ах, дорогая Афродита... твои знания поверхностны, а внешний вид заставляет задуматься о пристойности. Выбранное тобою обличье полностью раскрывает все твои стремления и интересы.
DionysusWithDemeter01|Duo - Dionysus and Demeter (1)|Dionysus|Эй, Заг, хочу попросить тебя об услуге: не мог бы ты уговорить владычицу Деметру смилостивиться и перестать запрещать всему расти, чем она занимается в последнее время?
DionysusWithDemeter01|Duo - Dionysus and Demeter (1)|Demeter|Осмелюсь заметить, владыка Дионис, что тебе пошло бы на пользу уменьшить своё потребление вина хотя бы ненадолго. И всё же, тебе не уговорить меня улучшить урожай.
AthenaWithDemeter01|Duo - Athena and Demeter (1)|Athena|Хочу представить тебе владычицу Деметру, кузен. Я попросила её ни о чём беспокоиться и заверила, что твои дела полностью под контролем. Однако из своего бесконечного сострадания она решила помочь тебе, несмотря ни на что!
AthenaWithDemeter01|Duo - Athena and Demeter (1)|Demeter|Ах, не нужно усыпать меня своей робкой похвалой, дорогая Афина. Зная о твоём безграничном уме, я полагала, ты понимаешь, что я вижу все твои замыслы насквозь.
PoseidonWithDemeter01|Duo - Poseidon and Demeter (1)|Poseidon|Моя приёмная сестра, богиня Деметра, несмотря на свою суровость, нередко подшучивает надо мной, племянник! О, а вот и она!
PoseidonWithDemeter01|Duo - Poseidon and Demeter (1)|Demeter|Если ты уже закончил трепать языком, Посейдон, пора бы и отправить нашего Загрея по его важным делам. Ему нужны твои благословения, а не мнение. Не так ли, малый росточек?
DemeterWithZeus01|Duo - Demeter and Zeus (1)|Demeter|Что ж, малый росточек, ты уже повстречал так называемого царя олимпийцев и познакомился со мной. Кто же, по-твоему, является истинным правителем нашей заснеженной вершины?
DemeterWithZeus01|Duo - Demeter and Zeus (1)|Zeus|О, *ха-ха-ха*, владычица Деметра! Ты так же остроумна, как суха необработанная земля, о которой ты должна заботиться! Возможно, тебе следовало бы вернуться к этому занятию, но для начала давай поможем нашему юноше!
DemeterWithPoseidon01|Duo - Demeter and Poseidon (1)|Demeter|А, малый росточек. Я тут как раз напоминала владыке Посейдону, что все его владения существуют только потому, что мне так угодно. Помни, мой приёмный брат, я могу заморозить твои океаны по своей прихоти.
DemeterWithPoseidon01|Duo - Demeter and Poseidon (1)|Poseidon|*А-ха-ха-ха! *Прекрасно сказано, почтенная богиня Деметра! Ты вновь напомнила мне о своём богатом опыте, но я думаю, нам всем больше по нраву океаны в виде жидкости, не так ли, племянник?!
DemeterWithAthena01|Duo - Demeter and Athena (1)|Demeter|Подумать только, малый росточек, Афина — наша расчётливая богиня-воительница — появилась на свет из головы Зевса! Я и помыслить не могла, что оттуда сможет появиться что-то настолько умное.
DemeterWithAthena01|Duo - Demeter and Athena (1)|Athena|Не обращай внимания на добродушные шутки владычицы Деметры, Загрей. Они с моим отцом часто подшучивают друг над другом, даже в самые тяжёлые времена.
DemeterWithAres01|Duo - Demeter and Ares (1)|Demeter|Юный Загрей, раз ты здесь, скажи владыке Аресу, что его великая сила ничего не стоит без моей. У войн есть причины, и многие из них появляются благодаря мне.
DemeterWithAres01|Duo - Demeter and Ares (1)|Ares|Я не сомневаюсь, что ты можешь сподвигнуть смертных начать войну, величественная богиня Деметра. Мы могли бы сойтись на том, что наши силы весьма соизмеримы!
DemeterWithAphrodite01|Duo - Demeter and Aphrodite (1)|Demeter|Запомни вот что, Загрей: ничто не заставит трепетать ледяное сердце. Не правда ли, Афродита, дорогая?
DemeterWithAphrodite01|Duo - Demeter and Aphrodite (1)|Aphrodite|О, даже не знаю, моя дражайшая Деметра! Ледяные сердца нередко оттаивают и затем начинают биться с новой силой. Я верю, что твоё время ещё придёт! Никогда не бывает поздно, разве что для несчастных смертных.
DemeterWithArtemis|Duo - Demeter and Artemis ()|Demeter|Что ж, Загрей, моя кроткая Артемида как раз говорила о том, как она обеспокоена твоим тяжёлым положением! Я уверена, она бы хотела, чтобы мы обе помогли тебе справиться с этим.
DemeterWithArtemis|Duo - Demeter and Artemis ()|Artemis|Обеспокоена? Я не заметила, чтобы кто-то беспокоился, а ты, Загрей? Тебе не нужна ничья помощь, ты можешь сам пройти через это. Но на всякий случай... просто на всякий случай! Вот, держи.
DemeterWithDionysus01|Duo - Demeter and Dionysus (1)|Demeter|Урожай будет чахнуть и увядать так долго, как мне того захочется, юный Загрей. Но на Олимпе есть те, кто со мной не согласны...
DemeterWithDionysus01|Duo - Demeter and Dionysus (1)|Dionysus|*Эм*, да, владычица, я протестую! Хочу сказать, как может расти виноград и литься вино, когда ты такая напряжённая? Тебе нужно немного расслабиться. Посмотрим, что можно сделать!
DemeterAboutZeus01|Demeter About Zeus 01|Demeter|Я вижу, благородный царь Олимпа добрался до тебя раньше меня, Загрей. Интересно, какую из множества своих лживых речей он поведал тебе последней.
DemeterAboutPersephone01|Demeter About Persephone 01|Demeter|А вот и блудный сын моего приёмного брата! Я тоже однажды потеряла дитя, Загрей. С самого начала я вела себя глупо по отношению к ней. Её отец был жалким фермером, боготворившим меня! Конечно, и он уже погиб. Остался только холод.
DemeterAboutPersephone02|Demeter About Persephone 02|Demeter|Моя дочь от жалкого фермера, она... что ж, малый росточек, думаю, я была не очень добра к ней. Особенно когда её отец ушёл из жизни. Кровь смертного сделала её слабой! Она родилась от смертного, и, подозреваю, что смертные забрали её у меня. Теперь они *поплатятся*.
DemeterAboutPersephone03|Demeter About Persephone 03|Demeter|Не может же быть, что... Нет, ничего, малый росточек, просто... До меня то и дело доходят слухи о моей потерянной дочери и о том, что с ней случилось. Мы звали её Корой. Персефоной она звала себя сама, до того как бесследно исчезла...
DemeterAboutPersephone04|Demeter About Persephone 04|Demeter|После исчезновения моей дочери Коры я покинула эту гору. Я скиталась по земле и пыталась её разыскать. Конечно, безуспешно. Думаю, мне это было нужно. Может, тебе повезёт больше.
DemeterAboutOlympianReunionQuest01|Demeter About Olympian Reunion Quest 01|Zagreus|Надеюсь, мама знает, что делает. Именем Аида! Олимп, это официальное послание! Владычица Деметра, это тебе.
DemeterAboutOlympianReunionQuest01|Demeter About Olympian Reunion Quest 01|Demeter|Что случилось, юный Загрей? Некое послание для меня? Я... не могу расшифровать его, хотя... на нём стоят печати двух моих приёмных братьев и... что ж! Кажется, нам нужно сверить свои послания!
DemeterPostEpilogue01|Demeter Post Epilogue 01|Demeter|Ах, малый росточек, юный Загрей... мой внук! Я всё ещё едва могу поверить в это! Подумать только, что Кора или... Персефона, моя дочь... всё это время была с моим приёмным братом Аидом! О подобной паре я и подумать не могла... или одобрить её. Поэтому она и ушла! Наши проклятые сердца поступают, как им угодно.
DemeterLiftsWinterCurse01|Demeter Lifts Winter Curse 01|Demeter|Мой юный внук, малый росточек, я тут подумала... если моя Персефона жива, то... разве эта зима не слишком затянулась?.. Она стала довольно упрямой, но я... Ведь я же богиня времён года, Загрей. Возможно, пришло время вновь сменить их.
DemeterLiftsWinterCurse02|Demeter Lifts Winter Curse 02|Demeter|Я избавила землю от холода, как и говорила, внук. Но рядом с царством твоего отца... Решила, что пускай всё остаётся, как есть. Без тепла. В качестве напоминания для всех нас о том, что произошло.
DemeterAboutPoseidon01|Demeter About Poseidon 01|Demeter|У тебя есть благословение Посейдона, Загрей? Однажды я напомню ему, где его место, и полностью покрою льдом его водные владения.
DemeterAboutAthena01|Demeter About Athena 01|Demeter|Афина поделилась с тобой своей *мудростью*, Загрей? В любом случае, то было лишь жалкое её подобие. Настоящая мудрость приходит только с возрастом, как мне кажется.
DemeterAboutAphrodite01|Demeter About Aphrodite 01|Demeter|Вся любовь и красота мира увядает за один сезон, Загрей. Вспомни об этом в следующий раз, когда Афродита тебе что-нибудь пообещает.
DemeterAboutAres01|Demeter About Ares 01|Demeter|Владыка Арес уже добрался до тебя, не так ли? Он умело заставляет смертных убивать друг друга, это правда. Но в нём абсолютно нет утончённости.
DemeterAboutArtemis01|Demeter About Artemis 01|Demeter|Кроткая Артемида уже нашла тебя, Загрей? Она хорошо исполняет мои приказы, и никто не может её в этом упрекнуть, ибо если бы не я, ей было бы не на что охотиться.
DemeterAboutDionysus01|Demeter About Dionysus 01|Demeter|Ты столкнулся с Дионисом, Загрей? Однажды я не позволю созреть ни единой ягодке на его виноградниках — тогда и посмотрим на его беззаботность.
DemeterAboutChaos01|Demeter About Chaos 01|Demeter|Ты несёшь на себе метку Хаоса. Эта сила ещё старее, чем я! Но не следует столь беззаветно ей доверять, ведь она абсолютно абсурдна.
DemeterAboutPom01|Demeter About Pom 01|Demeter|Это кровавое пятно от граната, Загрей? Сей стойкий фрукт способен пережить зимнюю стужу. Интересно наблюдать, как они выживают там, внизу.
DemeterLegendaryPickUp01|Demeter Legendary Pick Up 01|Demeter|Я редко раздаю подобные благословения, как сейчас, Загрей. Не благодари меня за это, но обязательно используй мою силу с умом.
DemeterLegendaryPickUp02|Demeter Legendary Pick Up 02|Demeter|Я привязалась к тебе, малый росточек. Во взаимности нет нужды, но сейчас я предложу тебе самые свирепые из своих умений.
DemeterPostGiftPickup01|Demeter Post Gift Pickup 01|Demeter|Должна признаться, я привязалась к тебе, малый росточек; и всё же я не буду баловать тебя как невоспитанное дитя.
DemeterPostGiftPickup02|Demeter Post Gift Pickup 02|Demeter|Ах, ты так же целеустремлён, как мои приёмные братья давным-давно, когда мы с ними и моими сёстрами противостояли титанам.
DemeterAboutLoss01|Demeter About Loss 01|Demeter|Что ж, я думаю, наша семья кое-что знает об утратах, не так ли, Загрей? Чего не скажешь о смертных на поверхности. Они всегда так много просят. Но ничего не получат. А вот тебе я многое могла бы предложить!
DemeterAboutLoss02|Demeter About Loss 02|Demeter|Ты слишком молод, чтобы прочувствовать утрату в полной мере, юный Загрей. Моли, чтобы тебе никогда не пришлось её познать.
DemeterAboutSurface01|Demeter About Surface 01|Demeter|Ты живёшь в глубинах земли и привык к её теплу. Но здесь, наверху, совсем не так тепло, юный Загрей. Ты действительно хочешь почувствовать суровый холод внешнего мира? Как пожелаешь.
DemeterAboutSurface02|Demeter About Surface 02|Demeter|Однажды ты доберёшься до поверхности, Загрей. Ты своими глазами увидишь, что натворили смертные. Напоминает то, что происходит в твоих владениях.
DemeterAboutMotherhood01|Demeter About Motherhood 01|Demeter|Быть матерью — это проклятье, юный Загрей. К счастью, тебе это не грозит. Я слышала, ты был рождён самой Никтой? Я появилась на свет от Тейи, кем бы она ни была. И когда-то я тоже родила дитя. Она пропала очень давно. Материнство... пустая трата времени, тебе не кажется?
DemeterAboutHades01|Demeter About Hades 01|Demeter|У нас с твоим отцом Аидом похожие судьбы: мы оба потеряли взрослых детей. Разница только в том, что он просто глупец, которого покинул собственный ребёнок! А моя дочь никогда бы так не поступила. Никогда!
DemeterAboutHades02|Demeter About Hades 02|Demeter|В твоём отце всегда чувствовалась суровость — черта, которой не хватало его братьям. Я считала его достойным, по крайней мере, в сравнении с другими. Хотя очевидно, что это не так.
DemeterAboutLove01|Demeter About Love 01|Demeter|Когда ты достигнешь своей цели и увидишь внешний мир, Загрей, вспомни вот о чём: никогда не влюбляйся в смертных. Используй их, если потребуется, но не трать свою любовь на тех, кто покинет тебя.
DemeterAboutHelios01|Demeter About Helios 01|Demeter|У меня есть брат Гелиос — он само солнце. Чудак с пылающей колесницей. Однажды он сказал мне, что моя Кора... что она спустилась в твой Подземный мир! Абсурд. Теперь он полностью скрыт за облаками.
DemeterAboutHelios02|Demeter About Helios 02|Demeter|Эти земли в каком-то смысле не так сильно отличаются от твоих владений. Бог-солнце Гелиос некоторое время не проливал на них свет. Сказать по правде, я не знаю, как долго, малый росточек! Но этого времени явно хватило, чтобы даже смертные заметили.
DemeterAboutSisters01|Demeter About Sisters 01|Demeter|Конечно, мои сёстры Гестия и Гера тоже помогли бы тебе, малый росточек. Вот только они не ладят с нашими приёмными братьями в последнее время. Я же никогда не оставлю свою гору.
DemeterAboutFather01|Demeter About Father 01|Demeter|Все мы упрямые дети, не так ли? Как ты знаешь, я дочь Гипериона. Этот титан был так упрям и ужасен, что владыка Зевс начал звать меня своей единоутробной сестрой — так сильно его раздражала правда! Ну и конечно, он не упускал случая разозлить меня.
DemeterAboutFather02|Demeter About Father 02|Demeter|Полагаю, поколения сменяют друг друга подобно временам года. Гиперион, мой отец? У него нет ни единого достоинства. Мы с моими сёстрами и приёмными братьями... Этот мир в долгу перед нами за избавление от него и ему подобных.
DemeterAboutZeus02|Demeter About Zeus 02|Demeter|Я должна предупредить тебя: у моего приёмного брата Зевса просто отвратительное чувство юмора, малый росточек. Он, небось, внушил тебе, что от него произошла половина человечества! От одной мысли об этом меня бросает в дрожь.
DemeterAboutRumors01|Demeter About Rumors 01|Demeter|Смертные говорят о нашей семье такой вздор, Загрей. Как быстро расходятся слухи! Их распускает этот глупец Зевс или, ещё вероятнее, смертные пьяницы-поэты, которым больше не на что тратить своё и без того ограниченное время!
DemeterHighAffinity01|Demeter High Affinity 01|Demeter|Предостерегаю тебя, Загрей, не следует пытаться сблизиться со мной. Всё же я намного старше, а ты — мой малый росточек. Пускай всё так и остаётся, м-м?
DemeterHighAffinity02|Demeter High Affinity 02|Demeter|Я... я очень тронута... моя дочь вернулась. И теперь... у меня есть и внук! Мне показалось, что я нечто почувствовала при встрече с тобой, но... я отмахнулась от этого. Как от назойливых снежинок...
DemeterRunCleared01|Demeter Run Cleared 01|Demeter|Однажды, мой малый росточек, ты доберёшься до поверхности царства своего отца и увидишь плоды моих трудов. До тех пор я буду помогать тебе всем, чем смогу. Честно говоря, это довольно весело!
