Id|Description|Speaker|Text
DemeterPostEpilogue02|Demeter Post Epilogue 02|Demeter|Кстати, внук, в доме твоего отца было просто замечательно. И оттого, что я вновь повидалась с Корой... моё сердце немного оттаяло. Я очень признательна, что твоя мать в безопасности. Ну а тебя ждёт важная работа. Вот, я помогу.
DemeterPostEpilogue03|Demeter Post Epilogue 03|Demeter|Я хотела кое-что сказать тебе, внук мой... Тебе не следовало обманывать всех нас. Ты ведь мог отправить хотя бы весточку о том, что всё это время моя дочь была с тобой там внизу! Ах, семейные дела вечно запутаны. Просто поклянись, что в следующий раз ты будешь честен с нами.
DemeterPostEpilogue04|Demeter Post Epilogue 04|Demeter|Ты просто обязан когда-нибудь навестить нас здесь наверху, внук! Я понимаю, что поверхность не желает принимать тебя... Но, возможно, мы всё же сможем дождаться тебя — не в этом веке, так в следующем. Здесь прохладно... но довольно уютно, как мне кажется.
DemeterPostEpilogue05|Demeter Post Epilogue 05|Demeter|Малый росточек, мне не удаётся полностью понять решения моей дочери. Например, мне не ясно, что она увидела в твоём угрюмом отце, дабы сбежать с ним. Но если в результате появился ты, то она куда мудрее, чем я полагала.
DemeterPostEpilogue06|Demeter Post Epilogue 06|Demeter|Я допускала ошибки, когда воспитывала твою мать, росточек. Когда она ещё была моей Корой. Я не допускала и мысли о том, что она могла покинуть меня, но... теперь я понимаю. Если у тебя когда-нибудь будут свои дети... возможно, ты будешь к ним внимательнее, чем я.
DemeterPostEpilogue07|Demeter Post Epilogue 07|Demeter|Передай моей Коре... кхм, Персефоне, то есть... царице! Передай, что её мать отправляет свои самые тёплые пожелания. Обязательно скажи ей это. И береги её.
DemeterPostEpilogue08|Demeter Post Epilogue 08|Demeter|Внук, моя дочь, царица Персефона, недавно передала мне милейшее послание с помощью Гермеса. Я рада, что вы отлично ладите. Но поскольку ты на работе, вот, держи!
DemeterAboutKeepsake01|Demeter About Keepsake 01|Demeter|Обмороженный рог, что у тебя в руках, однажды был символом изобилия. Конечно, в нём еще осталась какая-то сила. Но смертные больше никогда не посмеют принимать её как должное.
DemeterAboutPact01|Demeter About Pact 01|Demeter|Там стало гораздо жарче, не так ли? Если мой приёмный брат играет с температурой, мне придётся всё немного охладить.
DemeterAboutAsphodel01|Demeter About Asphodel 01|Demeter|Должно быть, тяжело переносить окружающую тебя жару, мой малый росточек. К счастью, у меня есть то, что тебе поможет.
DemeterAboutStyx01|Demeter About Styx 01|Demeter|Сдаётся мне, я чувствую холод, потому что ты близок к поверхности, Загрей. Если ты пройдёшь последние испытания, то вскоре своими глазами увидишь долгую зиму.
DemeterHasWeapon01|Demeter Has Weapon 01|Demeter|Ты завладел Ищущим сердца моей сестры Геры! Именно с помощью него ей удалось низвергнуть наших предков. Смотрю, он ещё не утратил своей силы. Не беспокойся, я не стану упоминать об этом, если встречу её.
DemeterHasWeapon02|Demeter Has Weapon 02|Demeter|Что это у тебя там? Странное орудие моей сестры Гестии? Она всегда питала слабость к пламени. Я думала, она никогда с ним не расстанется! Раз уж это орудие может попасть к кому угодно, то пусть оно лучше будет у тебя.
DemeterHasWeapon03|Demeter Has Weapon 03|Demeter|Не могу разглядеть... у тебя с собой перчатки-близнецы, малый росточек? В былые времена я сама пользовалась ими, и, можешь себе представить, мне хватило сполна. С тех пор я довольствуюсь своим холодом. А вот ты мог бы пустить их в дело, как я когда-то.
DemeterLowHealth01|Demeter Low Health 01|Demeter|Что ж, ты выглядишь так, будто пережил невероятно длинную зиму, Загрей! Надеюсь, теперь ты сможешь пожить ещё немного.
DemeterLowHealth02|Demeter Low Health 02|Demeter|Я чувствую, как жизнь покидает тебя, юный Загрей. А теперь обрати холод, что ты чувствуешь, против своих врагов.
DemeterLowHealth03|Demeter Low Health 03|Demeter|Кажется, тебе очень нужна помощь, Загрей. Возможно, я смогу её оказать.
DemeterLowHealth04|Demeter Low Health 04|Demeter|На твоём жизненном пути сейчас зима, не так ли, Загрей? Постарайся пожить ещё немного ради меня, ладно?
DemeterLowHealth05|Demeter Low Health 05|Demeter|Ты пытаешься умереть как простой смертный, Загрей. Для бога это непозволительно.
DemeterLowHealth06|Demeter Low Health 06|Demeter|Пламя жизни можно легко потушить льдом, юный Загрей. Уверена, ты чувствуешь, как холод вытесняет тепло внутри?
DemeterLowHealth07|Demeter Low Health 07|Demeter|Холод не облегчит твоё тяжелое положение, юный Загрей, но я рядом.
DemeterFirstPickUp|Demeter First Pick Up|Zagreus|В последний раз я чувствовал такой холод... на поверхности, но кто?.. Что ж, есть только один способ узнать это. Именем Аида! Олимп, я принимаю это послание!
DemeterFirstPickUp|Demeter First Pick Up|Demeter|Как я понимаю, юный Загрей, ты стремишься покинуть ту безнадёжную тьму ради этого свирепого холода? Честно говоря, я не понимаю, почему. Но я помогу тебе, почему бы и нет? Ибо я могу предложить свою помощь, и мне кажется, что тебе она понравится.
DemeterMiscPickup01|Demeter Misc Pickup 01|Demeter|Когда-то у меня было множество благословений, которые я охотно предлагала, юный Загрей. Но я не чувствую себя такой же щедрой в последнее время.
DemeterMiscPickup02|Demeter Misc Pickup 02|Demeter|Возможно, ты уловил специфический сотрясающий дух холод в воздухе, юный Загрей?
DemeterMiscPickup03|Demeter Misc Pickup 03|Demeter|У меня осталось немало благословений. Впрочем, они лишь для тебя, юный Загрей.
DemeterMiscPickup04|Demeter Misc Pickup 04|Demeter|Твои враги не смогут укрыться от холода, пока я на твоей стороне, юный Загрей.
DemeterMiscPickup05|Demeter Misc Pickup 05|Demeter|В пустоте, где ты обитаешь, что-то есть. Возможно, когда-нибудь здесь наверху будет что-то подобное.
DemeterMiscPickup06|Demeter Misc Pickup 06|Demeter|Твоё царство там такое же, как опустошённая ветром поверхность. В последнее время здесь почти нет жизни.
DemeterMiscPickup07|Demeter Misc Pickup 07|Demeter|Олимп, должно быть, кажется тебе далёким раем, юный Загрей. Для меня же это замёрзшая пустыня. Но все же, это мой дом.
DemeterMiscPickup08|Demeter Misc Pickup 08|Demeter|Твои враги подхватят не только простуду, когда мы покончим с ними, не правда ли, малый росточек?
DemeterMiscPickup09|Demeter Misc Pickup 09|Demeter|Все, кто пытаются противостоять тебе... ну что ж, мы разобьём не только их решимость, юный Загрей.
DemeterMiscPickup10|Demeter Misc Pickup 10|Demeter|В один из этих сезонов, я полагаю, мне следует перепроверить, не вымерли ли смертные без моего участия во всех их делах.
DemeterMiscPickup11|Demeter Misc Pickup 11|Demeter|Никто не может выдержать бесконечный зимний мороз, юный Загрей, даже безжизненные прислужники твоего отца там под землёй.
DemeterMiscPickup12|Demeter Misc Pickup 12|Demeter|Я считаю, что сезоны обладают своей особой красотой. Хотя если ты продолжишь сражаться, то узнаешь это на своём опыте.
DemeterMiscPickup13|Demeter Misc Pickup 13|Demeter|Я знаю твоего отца и его братьев уже много сезонов, и они бесконечно спорят со мной и друг с другом.
DemeterMiscPickup14|Demeter Misc Pickup 14|Demeter|Я должна сказать тебе кое-что, малый росточек. Я утешаю себя, зная, что мой приёмный брат Аид, как и я, не самый успешный родитель.
DemeterMiscPickup15|Demeter Misc Pickup 15|Demeter|Я бы с удовольствием обыскала всё царство твоего отца, если бы это освободило тебя от его хватки, Загрей.
DemeterMiscPickup16|Demeter Misc Pickup 16|Demeter|Я расскажу тебе кое-что, юный Загрей: свирепый холод и мороз так же неизбежны, как сама смерть.
DemeterMiscPickup17|Demeter Misc Pickup 17|Demeter|Сезоны меняются неумолимо, без оглядки, и поэтому ты должен упрямо следовать своему пути.
DemeterMiscPickup18|Demeter Misc Pickup 18|Demeter|Я навлеку запустение на тех, кто навредит тебе, малый росточек.
DemeterMiscPickup19|Demeter Misc Pickup 19|Demeter|Я надеюсь ты знаешь насколько редко я даю свои благословения в последнее время, юный Загрей.
DemeterMiscPickup20|Demeter Misc Pickup 20|Demeter|Ты же знаешь, нельзя уйти от свирепого холода.
DemeterMiscPickup21|Demeter Misc Pickup 21|Demeter|Думаю, твои противники вскоре узнают, что такое утрата.
DemeterMiscPickup22|Demeter Misc Pickup 22|Demeter|Позаботимся же о том, чтобы твои враги остались ни с чем.
DemeterMiscPickup23|Demeter Misc Pickup 23|Demeter|Я полагаю, что сегодня мы будем собирать урожай только из душ, юный Загрей.
DemeterMiscPickup24|Demeter Misc Pickup 24|Demeter|Мои тёплые пожелания, и все мои благословения для тебя, малый росточек.
DemeterMiscPickup25|Demeter Misc Pickup 25|Demeter|Свирепость холода и смерть идут рука об руку, я так полагаю.
DemeterMiscPickup26|Demeter Misc Pickup 26|Demeter|Когда всё заберут, останется холод, юный Загрей.
DemeterMiscPickup27|Demeter Misc Pickup 27|Demeter|Я не чувствую себя щедрой в последнее время, юный Загрей, но несмотря ни на что: выбирай.
DemeterMiscPickup28|Demeter Misc Pickup 28|Demeter|Должно быть, твои безжизненные враги наивно верят, что им нечего терять.
DemeterMiscPickup29|Demeter Misc Pickup 29|Demeter|Попробуй мои благословения, Загрей. Но ты можешь взять только что-то одно.
DemeterMiscPickup30|Demeter Misc Pickup 30|Demeter|Увядание — это неизбежное состояние вещей, а мы лишь помогаем им достигнуть его.
DemeterMiscPickup31|Demeter Misc Pickup 31|Demeter|Холод горы Олимп безжалостно погубит твоих врагов.
DemeterMiscPickup32|Demeter Misc Pickup 32|Demeter|Смерть и холод необратимо связаны друг с другом, Загрей.
DemeterMiscPickup33|Demeter Misc Pickup 33|Demeter|Я полагаю, что климату в тех глубинах нужно стать прохладнее, Загрей?
DemeterMiscPickup34|Demeter Misc Pickup 34|Demeter|Ты несёшь за собой сезон увядания, юный Загрей.
DemeterMiscPickup35|Demeter Misc Pickup 35|Demeter|Твои враги все завянут перед тобой как засохшие посевы.
DemeterMiscPickup36|Demeter Misc Pickup 36|Demeter|Мороз со временем накроет всё, юный Загрей.
DemeterMiscPickup37|Demeter Misc Pickup 37|Demeter|Ты узнаешь, что жизнь довольно легко поддаётся холоду, малый росточек.
DemeterMiscPickup38|Demeter Misc Pickup 38|Demeter|Посмотри внимательно на мои благословения, Загрей, и возьми лишь одно из них.
DemeterMiscPickup39|Demeter Misc Pickup 39|Demeter|Я уповаю на то, что сбор мёртвых душ не так уж отличается от сбора урожая у нас на поверхности, Загрей.
DemeterMiscPickup40|Demeter Misc Pickup 40|Demeter|Ты как маленькое пламя в царстве своего отца: тебя достаточно легко заметить.
DemeterMiscPickup41|Demeter Misc Pickup 41|Demeter|Мне кажется, твои враги уже созрели для сбора урожая, юный Загрей.
DemeterMiscPickup42|Demeter Misc Pickup 42|Demeter|Любой, кто встанет на твоём пути, скоро завянет от холода, малый росточек.
DemeterMiscRarePickup01|Demeter Misc Rare Pickup 01|Demeter|Я редко чувствую себя щедрой в последнее время, и всё же для тебя, юный Загрей? Почему бы и нет.
DemeterMiscRarePickup02|Demeter Misc Rare Pickup 02|Demeter|Давным-давно я предлагала смертным такие же щедрые блага, как и тебе, и порой они были даже более обильными.
DemeterMiscRarePickup03|Demeter Misc Rare Pickup 03|Demeter|Думаю, скоро и в Подземном мире будет исключительный холод.
DemeterMiscRarePickup04|Demeter Misc Rare Pickup 04|Demeter|Я надеюсь, ты знаешь, что я бы никогда не дала подобные благословения первому встречному.
DemeterMiscRarePickup05|Demeter Misc Rare Pickup 05|Demeter|У меня есть достойный урожай на выбор, мой малый росточек.
DemeterMiscRarePickup06|Demeter Misc Rare Pickup 06|Demeter|Скоро тот сезон станет невообразимо холодным, юный Загрей.
DemeterMiscRarePickup07|Demeter Misc Rare Pickup 07|Demeter|Сегодня снаружи особенно холодно, и скоро здесь будет так же и для тебя.
DemeterMiscPickupAboutWinter01|Demeter Misc Pickup About Winter 01|Demeter|Ну что ж, мой малый росточек, нам придётся провести тебя через этот зимний холод.
DemeterMiscPickupAboutWinter02|Demeter Misc Pickup About Winter 02|Demeter|Бодрящего и приятного зимнего вечера тебе, Загрей. Вот, держи.
DemeterMiscPickupAboutWinter03|Demeter Misc Pickup About Winter 03|Demeter|Мои лучшие зимние благословения для тебя, малый росточек.
DemeterMiscPickupExtra01|Demeter Misc Pickup Extra 01|Demeter|Что же, внук, здесь холодает, ты так не думаешь?
DemeterMiscPickupExtra02|Demeter Misc Pickup Extra 02|Demeter|Я пришла хотя бы немного облегчить твою ношу, мой малый росточек. Для этого мы, бабушки, и нужны.
DemeterMiscPickupExtra03|Demeter Misc Pickup Extra 03|Demeter|Надеюсь, ты не мёрзнешь, внук?
DemeterMiscPickupExtra04|Demeter Misc Pickup Extra 04|Demeter|Когда всё закончится, обязательно навещай нас время от времени, внук.
DemeterMiscPickupExtra05|Demeter Misc Pickup Extra 05|Demeter|Я прошу тебя не перетруждаться, внук, хоть твой семье и пригодились бы трудолюбивые личности.
DemeterMiscPickupExtra06|Demeter Misc Pickup Extra 06|Demeter|Твоих врагов ждёт лишь ненастная погода, внук.
DemeterMiscPickupExtra07|Demeter Misc Pickup Extra 07|Demeter|Не позволяй моему приёмному брату помыкать тобой, хорошо, внук?
DemeterMiscPickupExtra08|Demeter Misc Pickup Extra 08|Demeter|Давай-ка немного остудим твой пыл, хорошо, внук?
DemeterMiscPickupExtra09|Demeter Misc Pickup Extra 09|Demeter|Передай мои наилучшие пожелания царице Персефоне и твоему царственному отцу, малый росточек. Продолжай в том же духе.
DemeterMiscPickupExtra10|Demeter Misc Pickup Extra 10|Demeter|Полагаю, твоя мать, царица Персефона, поживает просто чудесно, раз уж у нее такой замечательный сын как ты, юный Загрей.
DemeterMiscPickupPersephoneAway01|Demeter Misc Pickup Persephone Away 01|Demeter|Твоя мать передаёт тебе привет с горы Олимп, внук.
DemeterMiscPickupPersephoneAway02|Demeter Misc Pickup Persephone Away 02|Demeter|Царица Персефона желает тебе всего наилучшего, малый росточек. Ты знаешь, она скучает по тебе.
DemeterMiscPickupPersephoneAway03|Demeter Misc Pickup Persephone Away 03|Demeter|У Персефоны всё хорошо на Олимпе, Загрей. Тебе следовало бы тоже иногда заглядывать к нам.
DemeterLootBought01|Demeter Loot Bought 01|Demeter|Будь благодарен, что реки, текущие в твоём царстве, ещё не замерзли, Загрей.
DemeterLootBought02|Demeter Loot Bought 02|Demeter|Я предполагаю, что твой лодочник Харон не имеет ничего против низких температур тут наверху?
DemeterLootBought03|Demeter Loot Bought 03|Demeter|Мои слова достигли тебя благодаря лодке на реке в этот раз, юный Загрей. По крайней мере, Харон не противится нашим попыткам связаться с тобой.
DemeterRejection01|Demeter Rejection 01|Demeter|Я редко дарую благословения, поэтому не стоит так поспешно отказываться от них, юный Загрей.
DemeterRejection02|Demeter Rejection 02|Demeter|Я привыкла к подобному неуважению от всех этих проклятых смертных, Загрей, но *ты*?..
DemeterRejection03|Demeter Rejection 03|Demeter|Если тебе настолько безразлична моя щедрость, юный Загрей, ты испытаешь на себе мой гнев.
DemeterRejection04|Demeter Rejection 04|Demeter|Не помню, говорила ли я тебе, что не стоит так делать. Впрочем, это всё равно неважно.
DemeterRejection05|Demeter Rejection 05|Demeter|Ты думаешь, я часто разбрасываюсь благословениями, Загрей? Что же, тогда у меня для тебя новости.
DemeterRejection06|Demeter Rejection 06|Demeter|Оскорбишь меня, и твои розовые щёчки быстро посинеют.
DemeterRejection07|Demeter Rejection 07|Demeter|Это было неразумное решение, Загрей. Я не скоро прощаю подобные ошибки.
DemeterRejection08|Demeter Rejection 08|Demeter|Ты и вправду думаешь, что сможешь противостоять суровой зиме, Загрей? Я бы на это посмотрела.
DemeterRejection09|Demeter Rejection 09|Demeter|Суровая зима идёт за тобой, Загрей. Боюсь, ты сам навлёк её на себя.
DemeterRejection10|Demeter Rejection 10|Demeter|Из-за твоего решения, Загрей, этот день вот-вот станет самым холодным днём для Подземного мира.
DemeterRejection11|Demeter Rejection 11|Demeter|Ты принял необдуманное решение, Загрей. Может, когда ты станешь старше, ты будешь лучше понимать, кому можно доверять и к кому всегда следует относиться с уважением.
DemeterMakeUp01|Demeter Make Up 01|Demeter|Может, в следующий раз ты будешь мудрее в подобной ситуации, а?
DemeterMakeUp02|Demeter Make Up 02|Demeter|В конце концов, я не хочу оставлять тебя на таком морозе, юный Загрей.
DemeterMakeUp03|Demeter Make Up 03|Demeter|Убийственный холод, должно быть, вытянул из тебя всю жизнь, но я приказала ему отступить на время.
DemeterMakeUp04|Demeter Make Up 04|Demeter|В следующий раз, юный Загрей, я могу забрать всё тепло, что ты оставил там внизу.
DemeterMakeUp05|Demeter Make Up 05|Demeter|Я самая старшая на Олимпе, Загрей. Надеюсь, ты будешь относиться ко мне соответствующе.
DemeterMakeUp06|Demeter Make Up 06|Demeter|Суровая зима отступила, юный Загрей. Соберись с силами и будь осторожен.
DemeterMakeUp07|Demeter Make Up 07|Demeter|Значит, ты пережил небольшой зимний холодок? Будь осторожен — следующая зима может быть куда страшнее.
DemeterMakeUp08|Demeter Make Up 08|Demeter|Помни, Загрей: в следующий раз я могу забрать у тебя всё, если пожелаю.
DemeterMakeUp09|Demeter Make Up 09|Demeter|Я вполне могу сделать твою жизнь намного сложнее, теперь-то ты это понимаешь, юный Загрей?
