Id|Description|Speaker|Text
Fury2MiscStartVsFuryLoseStreak03|Fury 2 Misc Start Vs Fury Lose Streak 03|Alecto|メガイラがヘマをしたから、今度はあたしが相手だよ。
Fury2MiscStartVsFuryLoseStreak04|Fury 2 Misc Start Vs Fury Lose Streak 04|Alecto|メガイラがやらかしたから、尻ぬぐいにきてやったよ。
Fury2MiscStartVsFury3LoseStreak01|Fury 2 Misc Start Vs Fury 3 Lose Streak 01|Alecto|よくもティシポネを殺ってくれたね…
Fury2MiscStartVsFury3LoseStreak02|Fury 2 Misc Start Vs Fury 3 Lose Streak 02|Alecto|ティシポネを、よくも… 覚悟はできてんだろうね？
Fury2MiscStartVsFury3LoseStreak03|Fury 2 Misc Start Vs Fury 3 Lose Streak 03|Alecto|ティシポネは、あんたに手を焼いてるようだね。\n今回はあたしが相手だよ。
Fury2MiscStartVsFury3LoseStreak04|Fury 2 Misc Start Vs Fury 3 Lose Streak 04|Alecto|ティシポネに手を出していいのは、あたしだけだよ。
Fury2MiscStart01|Fury 2 Misc Start 01|Alecto|楽しませてもらうよ、赤い血の坊や。
Fury2MiscStart02|Fury 2 Misc Start 02|Alecto|ちょうど退屈してたところさ。
Fury2MiscStart03|Fury 2 Misc Start 03|Alecto|あんたの手足を、一本一本、引きちぎってやるよ。
Fury2MiscStart04|Fury 2 Misc Start 04|Alecto|運命の三女神も、あんたの血が見たくてしかたないようだねえ。
Fury2MiscStart05|Fury 2 Misc Start 05|Alecto|また来たね、赤い血の坊や。それじゃ、さっそく死んでもらうよ。
Fury2MiscStart06|Fury 2 Misc Start 06|Alecto|楽しいねえ… これだから、この仕事はやめられない。
Fury2MiscStart07|Fury 2 Misc Start 07|Alecto|ゴミの神のお出ましだね。さっそく死んでもらうよ。
Fury2MiscStart08|Fury 2 Misc Start 08|Alecto|いいところへ来たね。\nちょうど待ちくたびれたところさ。
Fury2MiscStart09|Fury 2 Misc Start 09|Alecto|わざわざ戻ってきてくれたのかい？うれしいねえ。
Fury2MiscStart10|Fury 2 Misc Start 10|Alecto|赤い血の坊やは、よっぽど死ぬのが好きらしい。
Fury2MiscStart11|Fury 2 Misc Start 11|Alecto|あんたの相手ができるなんて、\n運命の三女神に感謝だね。
Fury2MiscStart12|Fury 2 Misc Start 12|Alecto|それじゃ、お手並み拝見といこうじゃないか。
Fury2MiscStart13A|Fury 2 Misc Start 13 A|Alecto|これはこれは… ゴミの神様のお出ましだね。
Fury2MiscStart13|Fury 2 Misc Start 13|Alecto|痛みと苦しみ… たっぷり味わう覚悟はできてるかい？
Fury2MiscStart14|Fury 2 Misc Start 14|Alecto|そんなに鼻息荒くして…\nちょっと落ち着いたらどうだい？
Fury2MiscStart15|Fury 2 Misc Start 15|Alecto|掛かってきな… ドロドロの血溜まりにしてやるよ！
Fury2MiscStart16|Fury 2 Misc Start 16|Alecto|あんたの口から聞きたいのは、苦痛の叫び声だけさ。
Fury2MiscStart17|Fury 2 Misc Start 17|Alecto|あんた、痛めつけられるのが好きなクチだね？
Fury2MiscStart18|Fury 2 Misc Start 18|Alecto|また死んでもらうよ… 楽しみだねぇ…！
Fury2MiscStart19|Fury 2 Misc Start 19|Alecto|遠慮はいらないよ、全力で掛かってきな！
Fury2MiscStart20|Fury 2 Misc Start 20|Alecto|そろそろ本気を見せてもらおうじゃないか！
Fury2MiscStart21|Fury 2 Misc Start 21|Alecto|ゴミの神への祈りが通じたようだねえ… うれしいよ！
Fury2MiscStart22|Fury 2 Misc Start 22|Alecto|どうしたんだい、黙りこくって。機嫌が悪いのかい？ひょっとして、あたしのせいかい？
Fury2MiscStart23|Fury 2 Misc Start 23|Alecto|フフフ…\nその身体の血、一滴残らず搾り取ってやるよ。
Fury2MiscStart24|Fury 2 Misc Start 24|Alecto|またあたしに盾突く気かい？上等だよ、掛かってきな！
Fury2MiscStart25|Fury 2 Misc Start 25|Alecto|不思議なもんだね… あんたにはヘドが出るけど、\nあんたを殺すのは嫌いじゃないよ。
Fury2MiscStart26|Fury 2 Misc Start 26|Alecto|さっさと掛かってきな！片づけなきゃならないゴミは、あんただけじゃないんだ。
Fury2MiscStart27|Fury 2 Misc Start 27|Alecto|あの扉の先へ行きたいって？血を流す覚悟はできてるんだろうね？
Fury2MiscStart28|Fury 2 Misc Start 28|Alecto|メガイラは弱いだけじゃなく、男の趣味も最悪だね。
Fury2MiscStart29B|Fury 2 Misc Start 29 B|Alecto|ちょうど、生者を痛めつけたいと思ってたところさ…
Fury2MiscStart29A|Fury 2 Misc Start 29 A|Alecto|あんたが死のうと、生き延びようと、パパは気にしちゃいないよ！
Fury2MiscStart29|Fury 2 Misc Start 29|Alecto|あんたがパパから嫌われててよかったよ。おかげでこうして、出会えたんだからね！
Fury2MiscStart30|Fury 2 Misc Start 30|Alecto|ここで待ちぼうけを食わされるのには、うんざりさ。\n一気に片をつけようじゃないか！
Fury2MiscStart31|Fury 2 Misc Start 31|Alecto|やっぱり、あったかくて新鮮な血に限るね！
Fury2MiscStart32|Fury 2 Misc Start 32|Alecto|あんたがこっちへ向かってるって聞いて、\nメガイラとティシポネに頼んだのさ… \nあたしに相手をさせろってね。
Fury2MiscStart33|Fury 2 Misc Start 33|Alecto|よく来たね、赤い血の坊や… \nじっくり楽しもうじゃないか。
Fury2MiscStart34|Fury 2 Misc Start 34|Alecto|あんたが近くにいるって聞いてね。あたしがここの番を買って出たのさ。
Fury2MiscStart35|Fury 2 Misc Start 35|Alecto|さあ… あたしのために、たっぷり血を流しとくれ。
Fury2MiscStart36|Fury 2 Misc Start 36|Alecto|掛かってきな。\n泣いてパパのところへ帰ることになるけどねえ…！
