Id|Description|Speaker|Text
AphroditeMiscPickup22|Aphrodite Misc Pickup 22|Aphrodite|ねえ… 前置きは飛ばして、“本題”に入らない？
AphroditeMiscPickup23|Aphrodite Misc Pickup 23|Aphrodite|あらあら… ひとりぼっちでさみしそうなコがいるわ。
AphroditeMiscPickup24|Aphrodite Misc Pickup 24|Aphrodite|ふたりで、どんなイタズラしましょうか？
AphroditeMiscPickup25|Aphrodite Misc Pickup 25|Aphrodite|私に祝福されたい？おやすいご用よ。
AphroditeMiscPickup26|Aphrodite Misc Pickup 26|Aphrodite|お待たせしちゃったかしら？
AphroditeMiscPickup27|Aphrodite Misc Pickup 27|Aphrodite|女神の心だって、傷つくのよ。
AphroditeMiscPickup28|Aphrodite Misc Pickup 28|Aphrodite|ねえ… 新しいお友だちを作りにいかない？
AphroditeMiscPickup29|Aphrodite Misc Pickup 29|Aphrodite|うふふ… 顔に書いてあるわよ？「助けてほしい」って。
AphroditeMiscPickup30|Aphrodite Misc Pickup 30|Aphrodite|愛の力は、どんな困難も乗り越えるのよ。
AphroditeMiscPickup31|Aphrodite Misc Pickup 31|Aphrodite|愛は、逆境を乗り越えて強くなるの。
AphroditeMiscPickup32|Aphrodite Misc Pickup 32|Aphrodite|あなたがつらそうにしているところは、見たくないわ。くれぐれも気をつけてちょうだいね。
AphroditeMiscPickup33|Aphrodite Misc Pickup 33|Aphrodite|愛はすべてに勝つ。あなたもわかってるでしょう？
AphroditeMiscPickup34|Aphrodite Misc Pickup 34|Aphrodite|愛するひとたち、全員の顔を思い浮かべてみて。彼らがあなたに勇気をもたらしますように。
AphroditeMiscPickup35|Aphrodite Misc Pickup 35|Aphrodite|目的を達成しようとするあなたの情熱、\n見ているこちらも、力をもらえるわ！
AphroditeMiscPickup36|Aphrodite Misc Pickup 36|Aphrodite|冥界の闇は深すぎて、\nあなたの姿がよく見えないのが本当に残念。
AphroditeMiscPickup37|Aphrodite Misc Pickup 37|Aphrodite|愛は心に勇気をもたらし、\nいつにも増して勇敢に振る舞わせてくれる。\nでしょう？
AphroditeMiscPickup38|Aphrodite Misc Pickup 38|Aphrodite|あなたには、がんばってほしいの。\nさあ、これを受け取ってちょうだい。
AphroditeMiscPickup39|Aphrodite Misc Pickup 39|Aphrodite|あなたのためなら、\nどんなことでも力になってあげたいの。
AphroditeMiscPickupRare01|Aphrodite Misc Pickup Rare 01|Aphrodite|今回は、特に素敵な祝福を用意したの。さあ、どうぞ。
AphroditeMiscPickupRare02|Aphrodite Misc Pickup Rare 02|Aphrodite|せっかくだから、\nとっておきの祝福を授けてあげましょうね。
AphroditeMiscPickupRare03|Aphrodite Misc Pickup Rare 03|Aphrodite|いざというとき、力になってあげること…\nこれほど純粋な愛情の示し方って、ないでしょう？
AphroditeMiscPickupRare04|Aphrodite Misc Pickup Rare 04|Aphrodite|このところ、とっても気分がいいの。あなたにも幸せのお裾分けをさせてね。
AphroditeLootBought01|Aphrodite Loot Bought 01|Aphrodite|また会えたわね。愛の女神アフロディテを\n渡し守のガラクタ屋に呼び出すなんて…\nザグレウス、あなただけよ。
AphroditeLootBought02|Aphrodite Loot Bought 02|Aphrodite|渡し守のカロンって、すごく変わってるし、はじめは取っつきにくいと思ったわ。でも、金貨に目がないと知ってからは、彼の心が手に取るように読めるようになったの。
AphroditeLootBought03|Aphrodite Loot Bought 03|Aphrodite|苦労して稼いだお金を、私のために使ってくれたの？こんなにうれしいことはないわ！
AphroditeLootBought04|Aphrodite Loot Bought 04|Aphrodite|愛はお金では買えない。でも、お気に入りの彼が、\n渡し守カロンを通じて私の祝福を買ってくれるなら… \nそれは例外よ。
AphroditeRejection01|Aphrodite Rejection 01|Aphrodite|あなたと私は、特別な関係を築いてると\n思っていたのに… あなたがあとで後悔しないように、\n今、伝えておくわ。私、とっても嫉妬深いの。
AphroditeRejection02|Aphrodite Rejection 02|Aphrodite|私の愛をものにしたからって、調子に乗らないことね。\nアフロディテは惜しみなく与える女神だけれど、\nその価値のない相手からは、すぐに取り上げるわ。
AphroditeRejection03|Aphrodite Rejection 03|Aphrodite|私がどういう女神か、いろいろ言われて\nいるけれど、ひとつ教えてあげる…\nくれぐれも、機嫌を損ねないことよ。\nそのわけを、今教えてあげるわ。
AphroditeRejection04|Aphrodite Rejection 04|Aphrodite|この女神アフロディテを、頭の軽いニンフみたいに\n弄べると思ったら大間違いよ。私の愛が欲しければ、\nあなたも私だけに愛を注ぎなさい。いいわね？
AphroditeRejection05|Aphrodite Rejection 05|Aphrodite|まあ、ひどい。そんな仕打ちを私が\nおとなしく受けると思ったら大間違いよ。\n今、たっぷり思い知らせてあげる。
AphroditeRejection06|Aphrodite Rejection 06|Aphrodite|私たちふたりのステキな関係を、あなたは脅かすの？\nそんなことをするとどうなるか…\n今わからせてあげるわ。
AphroditeRejection07|Aphrodite Rejection 07|Aphrodite|ひどい。今のはどう考えても、\n賢い選択とはいえないわね…
AphroditeRejection08|Aphrodite Rejection 08|Aphrodite|あなたはまだ理解できていないようだから、\nもう一度だけ、はっきり言うわ。\n私がせっかくチャンスをあげているのに、\nそれを袖にするなんて… *絶対に*許されないことよ。
AphroditeRejection09|Aphrodite Rejection 09|Aphrodite|私がこんなにも愛を注いであげているのに、\nそんなに簡単に袖にするの？\n今、嫌というほど後悔させてあげるわ。
AphroditeRejection10|Aphrodite Rejection 10|Aphrodite|私、振られ慣れてないの。\nでも、あなたは殺され慣れているわよね…？\n覚悟なさい。
AphroditeRejection11|Aphrodite Rejection 11|Aphrodite|ひどい仕打ち… どうして…？こんなことをされて、\n私がおとなしく引き下がるとでも思っているの…？
AphroditeRejection12|Aphrodite Rejection 12|Aphrodite|愛の女神の心をもてあそぶなんて、大した度胸ね。\nいいわ、あなたの心、粉々に砕いてあげる…！
AphroditeRejection13|Aphrodite Rejection 13|Aphrodite|あなたはオリュンポスの神々とは\n違うと思っていたのに… よくもこんな仕打ちを…\n心底がっかりだわ。
AphroditeRejection14|Aphrodite Rejection 14|Aphrodite|私を袖にするなんてことが、許されると思っているの？いいわ、あなたをこの手で木っ葉微塵にしてあげる…\nどちらが正しいか、はっきりさせましょう？
AphroditeMakeUp01|Aphrodite Make Up 01|Aphrodite|今回は、キスして仲直り、ってことにしましょう。\nでも、今度私を怒らせたら…\nこの手であなたを殺しにいくわ。
AphroditeMakeUp02|Aphrodite Make Up 02|Aphrodite|私の愛の力は強すぎて、ときどき復讐したく\nなっちゃうの。誰にでも欠点ってあるでしょう？
AphroditeMakeUp03|Aphrodite Make Up 03|Aphrodite|あなたとケンカするのはイヤ。\n水に流して、また前みたいに仲よくしましょう？
AphroditeMakeUp04|Aphrodite Make Up 04|Aphrodite|あなたのこと、もう怒ってないわ。でも… これからは、私の機嫌を損ねないように気をつけてちょうだいね。
AphroditeMakeUp05|Aphrodite Make Up 05|Aphrodite|あなたのこと愛してるから、今回は許してあげる。\nその代わり… あなたは私の愛を\nちゃんと受け止めてちょうだいね。うふふふ…
AphroditeMakeUp06|Aphrodite Make Up 06|Aphrodite|私の専門は、愛すること。だからケンカは嫌いよ。\n終わったことは水に流して、前へ進みましょう。
AphroditeMakeUp07|Aphrodite Make Up 07|Aphrodite|つまらないケンカは、やめましょ。\nもう怒ってないわ。でも…\n私の機嫌を損ねたことは、忘れないでちょうだいね。
AphroditeMakeUp08|Aphrodite Make Up 08|Aphrodite|あなたにずっと腹を立てているなんて、私にはムリ。ちょっと誤解はあったけれど、水に流しましょう。
AphroditeMakeUp09|Aphrodite Make Up 09|Aphrodite|愛に常識なんてない。あなたのしたことは\n軽率だったけれど、なかったことにしてあげるわ。
AphroditeMakeUp10|Aphrodite Make Up 10|Aphrodite|ピンチを迎えたときにこそ、愛は試され絆は強くなる。\nでも… ああいう試し方は、感心しないわね。
AphroditeMakeUp11|Aphrodite Make Up 11|Aphrodite|愛に嫉妬はつきもの。でも、できれば愛だけのほうが、お互い楽しいわよね。
AphroditeMakeUp12|Aphrodite Make Up 12|Aphrodite|ああ、もうたくさん！ケンカばかりしていちゃ、\n私たちらしくないもの。キスして仲直りしましょう。
AphroditeGift01|Aphrodite Gift 01|Zagreus|女神アフロディテに目をかけていただき、身に余る光栄です。お近づきのしるしに、これを。
AphroditeGift01|Aphrodite Gift 01|Aphrodite|持ちつ持たれつ… それが、良好な関係を\n長く保つコツよ。私からも、お礼をあげなくちゃね。
AphroditeGift02|Aphrodite Gift 02|Zagreus|わが常闇に光をもたらす女神アフロディテに、\n感謝の供物を。
AphroditeGift02|Aphrodite Gift 02|Aphrodite|まあ！こんなステキな贈り物を、私に…？\nありがたくいただくわ。
AphroditeGift03|Aphrodite Gift 03|Zagreus|女神アフロディテにふさわしい贈り物は、この冥界には存在しない。それでもどうか、この供物を…
AphroditeGift03|Aphrodite Gift 03|Aphrodite|まあ、うれしい！あなたからの好意のしるしとして…\nいえ、ひょっとしたらそれ以上かしら？\nとにかく、ありがたくいただくわ。
AphroditeGift04|Aphrodite Gift 04|Zagreus|ありあまる供物を日々受け取る女神アフロディテに、\nこんな些末な供物は気が引けますが…
AphroditeGift04|Aphrodite Gift 04|Aphrodite|まあ、ステキ。\n私たちの関係を、大切にしてくれているのね…\nこんな贅沢な贈り物をもらえて、とてもうれしいわ！
AphroditeGift05|Aphrodite Gift 05|Zagreus|女神アフロディテの寵愛への、感謝の印を\n受け取り給え。愛と美の女神を知る身となった今、\nオリュンポス山の美しさも想像に難くない。
AphroditeGift05|Aphrodite Gift 05|Aphrodite|うふふ… さすがにそれは、言い過ぎよ。\nそれでも… あなたからの愛、\nまだまだいくらでも受け止めてあげるわ。
AphroditeGift06|Aphrodite Gift 06|Zagreus|女神アフロディテを崇拝する者と、恐れ多くも求愛\nする者は、オリュンポスの一族全員を合わせた数をも\n上回るはず。自分はおそらく、そのいずれにも当て\nはまらないが、愛の女神より受けた恩への感謝の\n気持ちは誠。その印に、この供物を受け取り給え。
AphroditeGift06|Aphrodite Gift 06|Aphrodite|オリュンポスの神々のうち、私ほど崇拝者の多い神は\nいないはず。こんなふうに称えられることにも\n慣れっこだと思っているでしょうけど…\nいくら称えられても飽きることはないわ！\n特に、あなたからの称賛は、格別よ。
AphroditeGift07|Aphrodite Gift 07|Zagreus|女神アフロディテの寵愛を賜り、おのれの持てる力を\n余すことなく発揮できました。多大なる御恩への\n感謝の印として、ささやかな供物、アンブロシアを\n受け取り給え。
AphroditeGift07|Aphrodite Gift 07|Aphrodite|あなたが私を何度称えてくれたか、もう思い出せない\nほど… なんて、ウソ。ちゃんと数えているわ。\nあなたのその情熱とひたむきさ、本当に素敵。\nあなたがオリュンポスの頂に昇り詰める日が楽しみよ。あなたのこと、もっともっとよく知りたいもの。
DionysusWithAphrodite01|Duo - Dionysus and Aphrodite (1)|Dionysus|ザグ、宴のことなら、オレに任せときゃ間違いない。\nおまえもとっくに承知だよな？\nでもな、じつはアフロディテ嬢にも、\nいろいろ手伝ってもらってるんだぜ？
DionysusWithAphrodite01|Duo - Dionysus and Aphrodite (1)|Aphrodite|葡萄酒をいただくと、誰もが皆、普段よりも美しく\n見えるもの… そうやって、末永く続く愛は生まれるの！…もちろん、一瞬で消えてしまう儚い愛も、\nたくさん生まれるけれど。
AthenaWithAphrodite01|Duo - Athena and Aphrodite (1)|Athena|苦境に立ち向かうおまえの姿が、わが一族を\n結束させた。普段は自分以外の者のことなど\n気に掛けぬ者ですら、おまえの力にならんとする\n共通の目的のもとに集ったのだ。
AthenaWithAphrodite01|Duo - Athena and Aphrodite (1)|Aphrodite|アテナ、私にあなたのような深い知恵があれば、\nそういう遠回しな嫌みや侮辱にも、\nすぐに気づけるのでしょうけど。\n残念ながら、あなたの心にもない甘言に\n騙されるひとなんて、いないわ。
AthenaWithAphrodite01|Duo - Athena and Aphrodite (1)|Athena|アフロディテにとっては、「言葉」とは常に裏があるものなのだろう。しかし、他者に手を差し伸べる者全員に\n下心があるわけではない。ザグレウスに助力する気が\nないのなら、身を引くことだ。
DemeterWithAphrodite01|Duo - Demeter and Aphrodite (1)|Demeter|よいですか、ザグレウス。氷のように冷たい心は、\n他者を支配することは決してないのだとか。\nそうでしたね、アフロディテ？
DemeterWithAphrodite01|Duo - Demeter and Aphrodite (1)|Aphrodite|さあ、どうかしら… 氷の心もやがて溶けて、新たな\n活力とともに躍動しはじめることが、多々あるわ。\n幸い、私たち神々は不死。\nデメテルにもいつか、そういう時が訪れるはず。
