Id|Description|Speaker|Text
ArtemisMiscPickup28|Artemis Misc Pickup 28|Artemis|いい？狩りは、「殺すか殺されるか」だよ。
ArtemisMiscPickup29|Artemis Misc Pickup 29|Artemis|ねえ、あたしもついていっていい？
ArtemisMiscPickup30|Artemis Misc Pickup 30|Artemis|くれぐれも気をつけて。
ArtemisMiscPickup31|Artemis Misc Pickup 31|Artemis|これ、うまく役立てて。
ArtemisMiscPickupExtra01|Artemis Misc Pickup Extra 01|Artemis|狩りの知識を言葉で伝えるのは難しいけど、\nザグレウスはちゃんと、現場で吸収できてるね。
ArtemisMiscPickupExtra02|Artemis Misc Pickup Extra 02|Artemis|ザグレウスは、暗い冥界でそんなにすばやく動ける。\nいっしょに狩りをしたらいろんな感覚が鍛えられそう！
ArtemisMiscPickupExtra03|Artemis Misc Pickup Extra 03|Artemis|急所に一発！たいていは、それで仕留められるよ。
ArtemisMiscPickupExtra04|Artemis Misc Pickup Extra 04|Artemis|ザグレウス、どう？順調？
ArtemisMiscPickupExtra05|Artemis Misc Pickup Extra 05|Artemis|ほら、すぐに狩りに出かけるよ！
ArtemisMiscPickupExtra06|Artemis Misc Pickup Extra 06|Artemis|獲物に居場所を知られていたら、\n狩りとはいえないけど… 細かいことは、いいよね！
ArtemisMiscPickupExtra07|Artemis Misc Pickup Extra 07|Artemis|ザグレウスの攻撃が全部、\n獲物の急所という急所を突きますように！
ArtemisMiscPickupExtra08|Artemis Misc Pickup Extra 08|Artemis|ザグレウスによさそうな狩り装備、\nいろいろ持ってきたよ。ちょっと見てくれる？
ArtemisMiscPickupExtra09|Artemis Misc Pickup Extra 09|Artemis|おつかれさま。ひと息ついたら、好きな装備を選んで。今回こそは、脱出できるといいね。
ArtemisMiscPickupExtra10|Artemis Misc Pickup Extra 10|Artemis|今回は、何を狩る？\nまさか… また亡者だなんて言わないよね…？
ArtemisMiscPickupExtra11|Artemis Misc Pickup Extra 11|Artemis|ザグレウスの居場所を特定するなんて、\n簡単なんだから。ひょっとして、\nわざと見つけやすくしてくれてる？
ArtemisMiscPickupExtra12|Artemis Misc Pickup Extra 12|Artemis|また功徳を授けにきたよ。\nただし、あたしに恥はかかせないで。
ArtemisMiscPickupExtra13|Artemis Misc Pickup Extra 13|Artemis|ちょうどいいタイミングで会えたね。\n好きなの選んだら、出発だよ。
ArtemisMiscPickupExtra14|Artemis Misc Pickup Extra 14|Artemis|そこから脱出したいなら、\nあたしの祝福を授からないと、まず無理だよ。
ArtemisMiscPickupExtra15|Artemis Misc Pickup Extra 15|Artemis|いい？ザグレウスは、お父さんはもちろん、\n他の誰にも、無理に従う必要なんてないんだよ。
ArtemisMiscPickupExtra16|Artemis Misc Pickup Extra 16|Artemis|あたしと組めば、そんなところ、\nすぐに脱出できるから。
ArtemisMiscPickupRare01|Artemis Misc Pickup Rare 01|Artemis|今回の狩りに役立つ、とっておきの装備を用意したよ。ザグレウスに扱いきれるかな。
ArtemisMiscPickupRare02|Artemis Misc Pickup Rare 02|Artemis|これ以上、獲物をもてあそんでいても意味ないでしょ。そろそろとどめを刺そう。
ArtemisMiscPickupRare03|Artemis Misc Pickup Rare 03|Artemis|ザグレウスには、なかなかきつい道のりだと思う。\nこれが役に立つといいな。
ArtemisMiscPickupRare04|Artemis Misc Pickup Rare 04|Artemis|いい狩人は、道具にもこだわるものだよ。\nはい、どうぞ。
ArtemisMiscPickupRare05|Artemis Misc Pickup Rare 05|Artemis|いっしょに狩りに行けたら最高だけど…\n今は、こうやって手を貸すだけで、がまんする。
ArtemisMiscPickupAboutCallisto01|Artemis Misc Pickup About Callisto 01|Artemis|カリストだって、はじめは狩りの初心者だった。\nザグレウスも、まだまだ精進することだよ。
ArtemisMiscPickupAboutCallisto02|Artemis Misc Pickup About Callisto 02|Artemis|カリストと狩りに出かけるところだったけど、その前に功徳を授けてあげる。
ArtemisMiscPickupAboutCallisto03|Artemis Misc Pickup About Callisto 03|Artemis|カリストとの約束があるけど、\nその前に力を貸してあげる！
ArtemisMiscPickupAboutCallisto04|Artemis Misc Pickup About Callisto 04|Artemis|いつか、ザグレウスとあたしとカリストの3人で、\n狩りをしよう。今は、力を貸してあげる。
ArtemisMiscPickupAboutCallisto05|Artemis Misc Pickup About Callisto 05|Artemis|元気？カリストと森のニンフたちが、\nザグレウスによろしく、って！
ArtemisMiscPickupAboutCallisto06|Artemis Misc Pickup About Callisto 06|Artemis|ザグレウスを狩りに連れていったらかなり助かりそう。\nまあ、あたしもカリストも、助けなんていらないけど。
ArtemisLootBought01|Artemis Loot Bought 01|Artemis|カロンって、本当に無口だよね…\nまあ、ザグレウスもだけど。\n今日は、いいものあげるね。
ArtemisLootBought02|Artemis Loot Bought 02|Artemis|渡し守のカロンに、お金払ったんだね。\nいくら取られたか知らないけど、損はさせないから。
ArtemisLootBought03|Artemis Loot Bought 03|Artemis|冥界でも、質のいい狩り道具をそろえようと思ったら、\nそれなりに値が張るみたいだね。
ArtemisLootBought04|Artemis Loot Bought 04|Artemis|買い物は済んだ？じゃあ、さっそく狩りに行かない？
ArtemisLootBought05|Artemis Loot Bought 05|Artemis|カロンのお店で、お買い得品を見つけたみたいだね。\n私が用意した狩り装備は、お値段以上の価値があるよ。
ArtemisRejection01|Artemis Rejection 01|Artemis|…どうして…！？…フン。\nやっぱり、しょせんは小神だよね。
ArtemisRejection02|Artemis Rejection 02|Artemis|ザグレウスにはがっかりだよ。\nま、誰かに裏切られたのはこれが初めてじゃないけど。
ArtemisRejection03|Artemis Rejection 03|Artemis|それがザグレウスの選択？結局、キミもオリュンポスの家族といっしょだね…
ArtemisRejection04|Artemis Rejection 04|Artemis|完全に不意を突かれたな… それじゃあ… 仕返しさせてもらうよ！
ArtemisRejection05|Artemis Rejection 05|Artemis|あたしの気持ちをもてあそぶつもり？あたしとの絆は、簡単には築けない。でも、失われるときは一瞬だから。
ArtemisRejection06|Artemis Rejection 06|Artemis|ザグレウス、逃がした獲物は大きいよ。でもあたしは、絶対に的を外さないから。
ArtemisRejection07|Artemis Rejection 07|Artemis|背中を射ぬかれる気持ち、\n久しぶりに味わえてうれしいよ。
ArtemisRejection08|Artemis Rejection 08|Artemis|ザグレウス、あたしをもてあそんでるの？\nバカにしてるの？
ArtemisRejection09|Artemis Rejection 09|Artemis|さ、弓の練習の時間だよ。獲物役は… ザグレウス！早く逃げないと、死ぬよ。
ArtemisRejection10|Artemis Rejection 10|Artemis|こんな仕打ちを受けて、あたしがおとなしくしてると思った？
ArtemisRejection11|Artemis Rejection 11|Artemis|*やっぱりね！*どうせ、そう来るだろうと思ってた。\nザグレウスのことは全部、お見通しだよ。
ArtemisRejection12|Artemis Rejection 12|Artemis|やっぱり裏切るんだ… 驚きもしないよ。\n死にたくなければ、逃げたほうがいいよ。
ArtemisRejection13|Artemis Rejection 13|Artemis|それがザグレウスの判断？まったく、これだから冥界の神は…！
ArtemisMakeUp01|Artemis Make Up 01|Artemis|いいよ。もう怒ってない。さっきほどはね。\nでも、これからは気をつけて。
ArtemisMakeUp02|Artemis Make Up 02|Artemis|まだいたの？\nいいよ。今回はこれでかんべんしてあげる。
ArtemisMakeUp03|Artemis Make Up 03|Artemis|わかった、もう許してあげるから。でも、今度からは、もうちょっと気をつけてよね。
ArtemisMakeUp04|Artemis Make Up 04|Artemis|へえ。けっこうやるじゃない。\nあんな戦いぶりを見せられたら許してあげたくなるよ。
ArtemisMakeUp05|Artemis Make Up 05|Artemis|なかなかの戦いぶりだったよ。テストは合格。\n今回のことは、水に流してあげる。
ArtemisMakeUp06|Artemis Make Up 06|Artemis|死ななかった？そ、よかったね。ごほうびに功徳授けてあげるから、もう行って。
ArtemisMakeUp07|Artemis Make Up 07|Artemis|わかった、認める。今のは、あたしの間違い。\nだからザグレウスも、もう間違えないようにして。
ArtemisMakeUp08|Artemis Make Up 08|Artemis|やめた。殺さない。追い詰められた獲物を殺したって、楽しくないし。これあげるから、もう帰って。
ArtemisMakeUp09|Artemis Make Up 09|Artemis|ザグレウスが今オリュンポスの近くにいたら、あたしがこの弓で射ぬいてあげたのに。
ArtemisMakeUp10|Artemis Make Up 10|Artemis|まあ、ザグレウスは今、大変なときだしね…\nかわいそうだから、お情けの功徳、授けてあげる。
ArtemisMakeUp11|Artemis Make Up 11|Artemis|死ぬまで追い詰めてあげてもいいけど、\nこんなやせっぽちの獲物、狩る価値ないしね。
ArtemisGift01|Artemis Gift 01|Zagreus|女神アルテミス、いつも助けてもらい、感謝している。礼の品を受け取ってほしい。
ArtemisGift01|Artemis Gift 01|Artemis|ありがとう… うれしいよ、本当に。\nじゃあ、あたしからもお礼を。\nその… ただの、お礼だから…！
ArtemisGift02|Artemis Gift 02|Zagreus|女神アルテミス、日頃の助力への感謝のしるしとして、ささやかな供物を受け取り給え。
ArtemisGift02|Artemis Gift 02|Artemis|え… それって… あたしに捧げ物をくれるってこと…？ありがとう… と、とりあえず、狩りに戻ろうか…？
ArtemisGift03|Artemis Gift 03|Zagreus|女神アルテミスより授かりし力と知恵への感謝のしるしとして、この供物を捧げん！
ArtemisGift03|Artemis Gift 03|Artemis|ザグレウス… えっと… その… あ、ありがとう！
ArtemisGift04|Artemis Gift 04|Zagreus|地上においても、冥界でも、女神アルテミスに勝る\n狩人はいない。日頃の助力への感謝のしるしを\n受け取り給え。
ArtemisGift04|Artemis Gift 04|Artemis|な… なんでそんなに優しくする？\n何か裏があるの？でも…\nこれからもその調子で、お願い… したい、かな。
ArtemisGift05|Artemis Gift 05|Zagreus|女神アルテミス。怒りに触れる覚悟で、\n日頃の助力への感謝の品を、ここに捧げる。\n我が真心の潔白の証明となれば…
ArtemisGift05|Artemis Gift 05|Artemis|またネクタル！気が利くね。\nふだん、あんまりお酒は飲まないけど…\nたまにはいいよね。
ArtemisGift06|Artemis Gift 06|Zagreus|女神アルテミスの祝福を受け、幾多の困難を切り抜けてきた。われを見守り、賢き助言を授ける狩猟神の存在に、いつも感謝している。
ArtemisGift06|Artemis Gift 06|Artemis|ザグレウス… あたしも女神だから、崇拝されるのは\n嫌いじゃない。でも… そういうことは、\n森のニンフたちにでも任せておいて… ね？
ArtemisGift07|Artemis Gift 07|Zagreus|オリュンポスでは、アンブロシアなどありふれた品と\n承知している。それでも、これが冥界にまで下り、\n再びオリュンポスに戻ることは稀かと…\n女神アルテミスのおかげで、自分がオリュンポスの\n一族であることに誇りを持てる。感謝している。
ArtemisGift07|Artemis Gift 07|Artemis|この山にいると、いつも気負っちゃう。みんな\nツンケンして、言い争ってばかり。だからあたしは\n森へ逃げる。オリュンポスの家族より、ザグレウスの\nほうがあたしをわかってくれそうだけど… どうかな…\nでも、気にかけてくれることはうれしいよ。
AphroditeWithArtemis01|Aphrodite With Artemis 01|Aphrodite|アルテミスを連れてきてあげたわ。いつも狩りに夢中で\n社交マナーを身につける機会のない娘だから、自分から\nあなたのところへ赴く礼儀をわきまえていないの。
AphroditeWithArtemis01|Aphrodite With Artemis 01|Artemis|フン… みんな好き勝手なことばかり言って…\nザグレウスは、わかってるよね？その気になれば、\nあたしがいつでもキミを見つけられること。\n同じ要領でアフロディテからも逃げられたらいいのに…
DionysusWithArtemis01|Dionysus With Artemis 01|Dionysus|ザグ、アルテミスをなんとかオレの宴に来させたくて、口説き落とそうとしてるんだが… 狩りだかなんだかに\n出かけるから無理だって言うんだ。どうにかしてくれ。
DionysusWithArtemis01|Dionysus With Artemis 01|Artemis|狩りの前に宴だなんて…！獲物を狩るときは絶対に音を立ててはいけないし、全神経を研ぎ澄ませて集中しないといけないのに… わかったら、あたしはもう行くよ。
AthenaWithArtemis01|Athena With Artemis 01|Athena|ザグレウス、少し話せるか？私がおまえを\n“独り占め”していると、わが一族の一柱が\n不平を述べている。彼女の話を聞いてもらえるか？
AthenaWithArtemis01|Athena With Artemis 01|Artemis|ザグレウス？ごめん、アテナは少し大げさというか…\nでも、言っていることはそのとおりというか…\nとにかく、今日は話せてうれしいよ。
AthenaWithArtemis01|Athena With Artemis 01|Athena|では、これで問題は解決だな。わが一族は、\n互いを頼るのが常。ザグレウスには面倒をかけて\nすまぬが、欠点ひとつない一族など、ありはしない…
PoseidonWithArtemis01|Poseidon With Artemis 01|Poseidon|ザグ坊、俺の特技は、誰とでも打ち解けられることだ！\n万人にできることではないぞ！姪のアルテミスなどは、\n冗談がまるで通じない。アルテミス、いつもそんな\n渋面をしていては、いつまでたっても恋人はできんぞ！
PoseidonWithArtemis01|Poseidon With Artemis 01|Artemis|それは残念。どうしてあたしが、\nいつもオリュンポスで渋い顔をしてるのか、\nポセイドン叔父さんには、わからないみたい。\nザグレウスなら、察しがつくんじゃない？
PoseidonWithArtemis01|Poseidon With Artemis 01|Poseidon|ハッハッハ！どうだ、ザグ坊？\n俺の言ったとおりだろう？
DemeterWithArtemis|Demeter With Artemis|Demeter|ザグレウス、たった今、アルテミスが、あなたの旅の\n安全を案じていました。困難に立ち向かうあなたを、\n彼女の力と私の祝福で援助いたしましょう。
DemeterWithArtemis|Demeter With Artemis|Artemis|何を言ってるの…？ザグレウスなら、\n絶対に大丈夫だから！誰かに助けてもらわなくたって、自力でたどりつけるから！でも、一応？念のため？\nもし必要なら、これも使って。
