Id|Description|Speaker|Text
ZeusWithArtemis01|Zeus With Artemis 01|Zeus|ザグレウス、おまえは若く、男振りもよい。\nオリュンポスに到達した暁には、ふさわしき伴侶を\n見つけてやらねばな。幸い、候補には事欠かぬ。\nただし… わが娘アルテミスは例外だ。あれは\n誰に言い寄られても、決して伴侶を持とうとせぬ。
ZeusWithArtemis01|Zeus With Artemis 01|Artemis|容姿じまんの求婚者たちからしょっちゅう\n言い寄られたり、失礼なことを言われたりするけど、\nあたしはひとりが好き。さみしくなったときは、\n友だちのニンフたちと森で過ごす方がぜんぜんいいよ。
ArtemisWithZeus01|Artemis With Zeus 01|Artemis|コホン！ザグレウス殿… こちらにおわしますは、\n慈悲深き、寛大なる、偉大なる、わが父にして、\nそなたの叔父上… ゼウス王なり！
ArtemisWithZeus01|Artemis With Zeus 01|Zeus|…仰々しい紹介、ご苦労。ここはもういいから、\nニンフたちと遊んできなさい。その前にどうしてもと\n言うなら、わが甥にささやかな祝福のひとつでも\nかけてやるといい。
ArtemisWithPoseidon01|Artemis With Poseidon 01|Artemis|ザグレウスは、あたしの父さんと伯父さん、\nもう知ってるよね？ふたりとも神としては最低…\nじゃなくて！ふたりとも、“偉い”！毎日、朝から晩まで\nオリュンポスの麓の海に潜りっぱなしでも「偉い」よ！\nそうでしょ、伯父さま？
ArtemisWithPoseidon01|Artemis With Poseidon 01|Poseidon|アルテミス、ジュニアに俺の偉大さを宣伝する必要\nなどないぞ！普段海中にいようと、海を見下ろして\nいようと、海底のさらに下にいようと、神格には\n関係ない！おまえたちは、まだ若い！日々努力して\nいれば、俺とほぼ同列程度に偉大な神になれる！
ArtemisWithAphrodite01|Artemis With Aphrodite 01|Artemis|ザグレウス！その… ずっと聞きたかったことが\nあって… でも、誤解しないでもらいたいんだけど…\nその… うわ、めんどくさいのが来た…
ArtemisWithAphrodite01|Artemis With Aphrodite 01|Aphrodite|あらあら。アルテミスったら、\nもじもじしちゃって、かわいいわ。ふふふ。\n冥界の王子様のせいかしら？それとも、私のせい？\n大丈夫よ、いずれちゃんと、わかるときがくるから！
ArtemisWithAphrodite01|Artemis With Aphrodite 01|Artemis|だから、そういうんじゃなくて…\nあー、もう！何言おうとしたかわからなくなった！\nザグレウス、また今度ね。
ArtemisWithAphrodite02|Artemis With Aphrodite 02|Artemis|狩人として恥ずかしいんだけど…\nどうしても、アフロディテの追跡をまけなくて…\n何を企んでるのか知らないけど、あたしとふたりで、\nザグレウスに会いたいって言うんだよね…
ArtemisWithAphrodite02|Artemis With Aphrodite 02|Aphrodite|まあ、アルテミスったら！\n獣から身を隠すことはできても、私にはお見通しよ。\n今度からは、もっと自分の気持ちに正直になることね。
ArtemisWithAres01|Artemis With Ares 01|Artemis|あたしたちにも、ザグレウスの声が\n聞こえたらいいのにね。そうすればアレスにも、\n私の力は狩り専用で、戦用の力とは違うって、\nわかってもらえそうなんだけど。
ArtemisWithAres01|Artemis With Ares 01|Ares|アルテミス、われらの力には、かつては別の用途が\nあったのかもしれぬ。しかし、それが今日別の用途に\n変化したとて、異を唱えるのは筋違い。わが眷属に\nわれらの総力を付与し、その結果をただ見守るのみだ。
ArtemisWithAres02|Artemis With Ares 02|Artemis|狩りに出かける前に、ザグレウスとふたりで\n話したかったのに。大勢で群れるの、好きじゃないし。…アレスは、狩りの道具がチラッとでも見えたら、\nすぐに首をつっこんでくるから…
ArtemisWithAres02|Artemis With Ares 02|Ares|アルテミス、狩りは戦の序章なり。\n人間たちが狩りを知らねば、\n互いに殺し合う技に長けることもなかったであろう。
ArtemisWithAres02|Artemis With Ares 02|Artemis|アレス… あたしの射撃の力がほしいなら、\nいくらでも貸すから、あっちへ行って。
ArtemisWithDionysus01|Artemis With Dionysus 01|Artemis|ザグレウス！ちょうどよかった！ディオニュソスと\n話してると、耳にタコが100個ぐらいできそうで…\nザグレウスも、話聞いてあげて。ディオニュソスと\nあたしで、いつもと違う祝福、授けてあげるから！
ArtemisWithDionysus01|Artemis With Dionysus 01|Dionysus|なんだなんだ？オレがそんなにうるさいって？\n黙れって？なんでそんなこと言うんだよー、\n酷いじゃないかー、なあ？酷いと思わないか？
ArtemisWithDemeter01|Artemis With Demeter 01|Artemis|ザグレウス、おつかれさま！デメテルに、そろそろ\n雪をやませてほしいってお願いしてたんだけど、\n全然聞いてくれなくて。人間たちもウンザリしてるし、こんなに積もってちゃ、狩りもしにくいし…
ArtemisWithDemeter01|Artemis With Demeter 01|Demeter|アルテミス、人間たちは器用なものです。\n彼らの、数少ない長所のひとつと\n言ってよいでしょう。終わりなき冬を\n乗り切るすべも、おのずと見いだすでしょう。\nなにしろ、みずから招いたことなのですから。
ArtemisAboutRamaAspect01|Artemis About Rama Aspect 01|Artemis|ザグレウス、コロナハトに話しかけてみた？\nこの前も言ったけど、「われは見る。第7の化身の腕に\n引かれる、そなたの姿を」って言うと、なにかいいこと\nあるみたい。聖なる射手の態が覚醒する、\nとかじゃないかな。近いうちに、唱えてみたら？
ArtemisAboutRamaAspect02|Artemis About Rama Aspect 02|Artemis|あたしが教えた呪文、本当に効果あったんだね！\nここからでも、その弓の光が見える。あたしはまだ\nコロナハトを使ったことはないけど、過去か未来の\n使い手の幻影を運命の三女神が見せてくれたって\nことは… いつかチャンスがめぐってくるのかも！
ArtemisAboutOlympianReunionQuest01|Artemis About Olympian Reunion Quest 01|Zagreus|これは、狩りの女神の印だな。よし…\nハデス神の名において、オリュンポスの神に、\n言づてを捧げん！女神アルテミスよ、受け取り給え！
ArtemisAboutOlympianReunionQuest01|Artemis About Olympian Reunion Quest 01|Artemis|え… あたし宛ての手紙！？…なんだ、全員分あるのか。あたしだけ特別かと思ったのに。しかも、他のみんなといっしょに呼び出し？勘弁してほしいなぁ…
ArtemisPostEpilogue01|Artemis Post Epilogue 01|Artemis|この前、館にお呼ばれしたときは、正直、楽しかった。ザグレウスにも、ハデス伯父さんにも、英雄アキレウスにも会えたし！騙されてたことは、正直ちょっと\nモヤモヤするけど… どうせそのうち忘れちゃうから、\nいいよ。これからも、あたしの助けが必要でしょ？
ArtemisAboutZeus01|Artemis About Zeus 01|Artemis|雷神ゼウスは、私の父さんだよ。雷の力、\n授けてもらったんだね。父さん、世話好きだから。
ArtemisAboutPoseidon01|Artemis About Poseidon 01|Artemis|ポセイドン叔父さんの力、授けてもらったんだね。\nあれがザグレウスのお父さんの弟だなんて…\n「きちんと敬いなさい」、って言われるけど、\n敬えるところがないよ。
ArtemisAboutAthena01|Artemis About Athena 01|Artemis|もうアテナに会ったの？あんなゴテゴテした鎧より、\nあたしの弓のほうがずっといいと思うけど…\nま、人の好みはそれぞれだしね。
ArtemisAboutAres01|Artemis About Ares 01|Artemis|アレスと仲よくしてるみたいじゃない。あいつは\n誰にも心を開かないって、みんな言ってるのに…\nま、くれぐれも用心してつきあうことだよ。
ArtemisAboutAphrodite01|Artemis About Aphrodite 01|Artemis|もうアフロディテに会ったの…？あの女神の\nやりそうなことだね… ヘタに関わると\nトラブルに巻き込まれるから、油断は禁物だよ。
ArtemisAboutDionysus01|Artemis About Dionysus 01|Artemis|飲んだくれでスケベなディオニュソスが、ザグレウスと友だち…？何かの間違いでしょ…？
ArtemisAboutHermes01|Artemis About Hermes 01|Artemis|ザグレウス、ずいぶんすばやくなったね。\nヘルメスから祝福を受けたでしょ？\nでも、最近ヘルメス、見かけないんだよね…\n最後に見たの、いつだっけ…
ArtemisAboutDemeter01|Artemis About Demeter 01|Artemis|デメテルまで、ザグレウスに協力してくれることに\nなったんだ？意外！でも、いろいろ助かると思うよ。ま、機嫌損ねないようにだけ注意ね。\nそれはあたしもだけど！
ArtemisBackstory01|Artemis Backstory 01|Artemis|ザグレウスのこと、ちょっと心配なんだよね。\nなんでそんなに、がむしゃらに戦うの？\nせっかちなだけかと思ってたけど…\n何かに駆り立てられてるみたい。\nザグレウスの本当の目的は、何…？
ArtemisRunProgress01|Artemis Run Progress 01|Artemis|ザグレウスはこれまでに、6つ以上の危険な\n区画を強引に正面突破した。暴れまわる音が、\nオリュンポスまで聞こえてきたよ。\nキミの狩りの手法は、型破りだね。
ArtemisRunProgress02|Artemis Run Progress 02|Artemis|ザグレウスがオリュンポスに着くまで、\nちゃんとそばにいてあげるから。\nでも、着いたら特別あつかいはしないよ？\nうちの家族とまとめて無視するから、そのつもりで。
ArtemisAboutVermin01|Artemis About Vermin 01|Artemis|最近、地上の近くで、害獣狩りをしたでしょ？それってもう、ほとんど本物の狩りといってもいいよね。\n楽しかったでしょ？
ArtemisAboutVermin02|Artemis About Vermin 02|Artemis|害獣狩りも、だいぶ板についてきたね。\nもっと戦い応えのある強敵を\n相手にできる日も、近いんじゃない？
ArtemisVsMeg01|Artemis Vs Meg 01|Artemis|タルタロスで待ち構えてるエリニュスに、手を焼いて\nいるみたいだね。あのコには、狩人の才がある。\nザグレウスの弱点なんてお見通しだと思ってるはず。\n戦術がワンパターンにならないように気をつけて。
ArtemisVsAchilles01|Artemis Vs Achilles 01|Artemis|「冥王ハデスがトロイ戦争の英雄を配下に迎えた」って噂を聞いたんだけど… 何か知ってる？もしアキレウスに会うことがあったら、「アルテミスが崇拝してる」\nって、伝えてもらえる？
ArtemisVsAchilles02|Artemis Vs Achilles 02|Artemis|ザグレウスって、アキレウスからじきじきに\n戦術の指南を受けたんだってね？あの戦いぶり…\nどうりでね！あのひと大英雄なんだから、\nくれぐれも失礼のないようにね。
ArtemisPostFlashback01|Artemis Post Flashback 01|Artemis|あたしはオリュンポスで家族と暮らしてるけど、\nいつも孤独だった。境遇こそ違うけど、\nザグレウスの気持ちは、理解できるよ。
ArtemisHighAffinity01|Artemis High Affinity 01|Artemis|ザグレウスはオリュンポスを気に入るんじゃないかな。\nおいしいごちそうはあるし、空気はきれいだし、\n冥界よりずっと明るいよ。…最高でしょ？
ArtemisHighAffinity02|Artemis High Affinity 02|Artemis|ザグレウスがオリュンポスに来たら、ふたりで\n狩りに行かない？あたしは基本、ひとりが好きだけど、ザグレウスとこんなふうに話すのは楽しくて。
ArtemisHighAffinity03|Artemis High Affinity 03|Artemis|この山の頂で家族と顔をつき合わせてるのはうんざり。\n森のニンフたちと狩りに出てるほうがずっと楽しいよ。\nザグレウスなら、気持ち、わかるでしょ？
ArtemisAboutCallisto01|Artemis About Callisto 01|Artemis|オリュンポスには、ガッカリな面々ばかり…\nってわけでもないよ。ザグレウスもいつか、カリストに\n会えるかもね。あたしが狩りに出るときは、いつも\nいっしょに来てくれるんだ。冥界じゃ、森のニンフに\n出会うことなんてないでしょ？
ArtemisAboutCallisto02|Artemis About Callisto 02|Artemis|ザグレウスが送ってくれたネクタル、カリストたちと\nいっしょに飲んでみたけど、絶品だった！\nすっかり酔っ払って、大騒ぎしちゃった。ありがとね！
ArtemisAboutCallisto03|Artemis About Callisto 03|Artemis|ザグレウスにも、友だちぐらいいるでしょう？\nいつもひとりじゃ、さみしいよね。あたしには、\nカリストや、森のニンフたちや… ザグレウスがいる！\n離れていても、友だちは友だち… だよね？
ArtemisAboutCallisto04|Artemis About Callisto 04|Artemis|ザグレウスのこと、カリストにいろいろ話したの… でも大丈夫、あたりさわりのないことしか話してないから！それに、ふたりで狩りをしているときだったから、他の誰にも聞かれてないし！山の上から大声で叫んだわけじゃないから！
ArtemisAboutCallisto05|Artemis About Callisto 05|Artemis|ザグレウスも動物に変身できたら、飛んだり地面に\n潜ったりして、冥界なんてすぐに脱出できるのにね。\nカリストは、熊に変身できる。毛むくじゃらで、\nおっかないけど、抱きしめたくなっちゃう獣だよ。\nま、その前にこっちが殺されなければ、だけど！
ArtemisAboutCallisto06|Artemis About Callisto 06|Artemis|ザグレウスは、森を見たことないでしょ？\nいつか見せてあげたいな。緑が豊かで、\nおだやかで、本当にきれいなところでね…\nカリストたちにも紹介するよ！\n…っと、なんの話だったっけ？
ArtemisAboutCallisto07|Artemis About Callisto 07|Artemis|ザグレウスって、なんだか不思議。いっしょにといると\n素の自分でいられるっていうか… あたしの話を\nさえぎらずにちゃんと聞いてくれるのって、カリストやニンフたちの他には、ザグレウスだけだからかな。\nま、そっちの声は、あたしには聞こえないけどね…
ArtemisHasWeapon01|Artemis Has Weapon 01|Artemis|それ、コロナハトだよね…？そんな名弓、\nどこで手に入れたの？オリュンポスに来たら、\nあたしにも触らせて！それまで、大事に使ってよ？
ArtemisAboutBowWeaponProgress01|Artemis About Bow Weapon Progress 01|Artemis|コロナハト、かなり使いこなしてるね。\nあたしは寝てても的を外さない弓の達人だけど、\nうかうかしてたらザグレウスに追いつかれちゃいそう。
ArtemisAboutSpearWeapon01|Artemis About Spear Weapon 01|Artemis|それ、「永遠の長槍ヴァラサ」だよね…？\nザグレウスのお父さんが、昔使ってた槍。\n狩りで使うにはちょっと派手すぎるけど…\nそれでもやっぱり、槍っていいよね。
ArtemisAboutAchillesAspect01|Artemis About Achilles Aspect 01|Artemis|それは… 英雄アキレウスの得物だった槍…！\nその特徴のある形… うん、間違いない。\nいったい何人の人間が、その槍の穂先に倒れたことか… 幾多の戦をくぐりぬけた、伝説武具だよ！
ArtemisAboutChironAspect01|Artemis About Chiron Aspect 01|Artemis|それは、コロナハトだよね？でも、あたしの知ってる\n形と違う… ケンタウロスの、 ケイロンが携えた弓？\nすごい！ひょっとして、名弓は全部、コロナハトの\n別バージョン…？まあ、あたしの弓は、違うけど。
ArtemisAboutHeraAspect01|Artemis About Hera Aspect 01|Artemis|それ、あたしのお義母さんのヘラが、昔使った\n弓でしょう？コロナハトの、ヘラの態！その不気味な\nガイコツ、見るからにお義母さんっぽいもの。
ArtemisAboutFistWeapon01|Artemis About Fist Weapon 01|Artemis|それ… 双拳マルフォンだよね？いつ手に入れたの？\n…あ、その武具の場合は、「手“を”入れた」って言う\nべき？フフフ。デメテルは、それで父親の顔を殴った\nそうだよ。ザグレウスも、気持ちわかるんじゃない？
ArtemisAboutGunWeapon01|Artemis About Gun Weapon 01|Artemis|それ、アダマント電磁砲のエクサグリフでしょう？\n構造が複雑すぎるし、うるさすぎるから、\n狩りには向いていないけど。弓は静かでいいよ。\nまあ、好みは人それぞれだけど。
ArtemisRevealsRamaAspect01|Artemis Reveals Rama Aspect 01|Artemis|聞いて… 自分でも何を言っているのかよくわからない\nんだけど… ザグレウスの“弓”に言づてがある。今度、\nコロナハトの前でこう言ってみて。「われは見る。\n第7の化身の腕に引かれる、そなたの姿を」。堂々と、\n自信満々にね。その結果どうなったかも報告して。
ArtemisAboutKeepsake01|Artemis About Keepsake 01|Artemis|「アダマントの矢尻」、身につけてくれてるね。\n本来は獲物の息の根を止める道具だけど、\nザグレウスにあげたのは、暗いところでも\n見つけやすくしたかったからなんだ。\nそれじゃさっそく… 祝福してあげる！
ArtemisAboutZagreus01|Artemis About Zagreus 01|Artemis|「ザグレウス」って、「偉大なる狩人」っていう\n意味なんだよ。お母さんのニュクスは、ザグレウスが\n将来あたしに助けられること、わかってたのかもね。
ArtemisRunCleared01|Artemis Run Cleared 01|Artemis|え…？あと少しだったのに… また戻されたの？\n目的地が見えたところで、うっかりミスをすることは、ありがちだけど… 大丈夫、必ず救い出してあげるから！
ArtemisLowHealth01|Artemis Low Health 01|Artemis|ザグレウス、大丈夫？会えたばかりなのに、死なれたら困るよ…
ArtemisLowHealth02|Artemis Low Health 02|Artemis|え…！ケガしてる！？大丈夫、獲物を狩ることに\n集中していれば、痛みには耐えられるから！
ArtemisLowHealth03|Artemis Low Health 03|Artemis|あたしは狩猟の女神で、薬は専門外だから、\n効くかどうかはわからないけど… 使って！
ArtemisLowHealth04|Artemis Low Health 04|Artemis|狩り、あんまりうまくいってないみたいだね。\nでも、ここから巻き返せるかも…！
ArtemisLowHealth05|Artemis Low Health 05|Artemis|すごい出血… ま、そのおかげで\nザグレウスの居場所がすぐにわかったけど！
ArtemisLegendaryPickUp01|Artemis Legendary Pick Up 01|Artemis|ザグレウス。いまから、狩りの秘技を伝授してあげる。こんな機会はまずないから、心して受け取って。
ArtemisLegendaryPickUp02|Artemis Legendary Pick Up 02|Artemis|今のザグレウスは、獲物をもてあそんでるだけ。一気にとどめを刺せる、とっておきの祝福を授けてあげる！
ArtemisLegendaryPickUp03|Artemis Legendary Pick Up 03|Artemis|あたしのとっておきの狩りの技、誰にでも教えるわけじゃないから、感謝してよね。教わったからには、すぐ死んだりしないでよ！
ArtemisLegendaryPickUp04|Artemis Legendary Pick Up 04|Artemis|今回は、手堅くいかない？とっておきの祝福を\n授けてあげるから、ちゃんと地上にたどり着いてよね！
ArtemisFirstPickUp|Artemis First Pick Up|Zagreus|天界に御座す弓の名手といったら… たぶん、あの\n女神だな。ハデス神の名において、オリュンポスの\n神の御言葉を賜らん！
ArtemisFirstPickUp|Artemis First Pick Up|Artemis|ザグレウス！キミのことは、いろいろ聞いてるよ。\n先に断っておくけど、あたしは他のオリュンポスの\n神とは違うから。獲物を狩る力、授けてあげる。
ArtemisMiscPickup01|Artemis Misc Pickup 01|Artemis|大丈夫。ザグレウスはひとりじゃないから。\nあたしが力になるよ。
ArtemisMiscPickup03|Artemis Misc Pickup 03|Artemis|死者って、狩りの獲物としては、楽勝じゃない？\nザグレウスと私が力を合わせたら何ができるか、\n実践してみせてよ。好きなの選んで。
ArtemisMiscPickup04|Artemis Misc Pickup 04|Artemis|今忙しい？よかったら、狩りのコツを教えてあげようと思って。
ArtemisMiscPickup05|Artemis Misc Pickup 05|Artemis|狩りは順調？「まあまあ」ってところ？\nあたしと力を合わせたら、もっとうまくいくはず！
ArtemisMiscPickup06|Artemis Misc Pickup 06|Artemis|いっしょに狩りに行かない？\nま、実際に狩るのはザグレウスだけど、\nあたしも遠くから応援するよ。
ArtemisMiscPickup07|Artemis Misc Pickup 07|Artemis|「逃げ場がない」って、つらいよね。あたしもときどきつらくなるけど、狩りに出ると気が晴れる。
ArtemisMiscPickup08|Artemis Misc Pickup 08|Artemis|狩りをしていると、頭がすっきりして、獲物を追うことに集中できる。あたしの祝福を受ければ、ザグレウスにもわかるはず。
ArtemisMiscPickup09|Artemis Misc Pickup 09|Artemis|ザグレウスは冥界で、どんなふうに暮らしてるのかな。私の力を授けるから、がんばって脱出して、\nいつか聞かせてね。
ArtemisMiscPickup10|Artemis Misc Pickup 10|Artemis|ザグレウスが戦ってる亡者たちは、もう死んでる。\nなかには、何度も何度も死んだ者だっているはず。\nつまり… 狩るのは楽勝ってことだよ。
ArtemisMiscPickup11|Artemis Misc Pickup 11|Artemis|ねえ、聞いて。あたしに狩れない獲物はない。\nザグレウスも、1匹残らず狩って。\n…聞こえてる…よね？
ArtemisMiscPickup12|Artemis Misc Pickup 12|Artemis|ザグレウスが早く脱出に成功して、\nあたしがこれ以上、めんどくさい家族と\n関わらないで済むようにしてほしいな…
ArtemisMiscPickup13|Artemis Misc Pickup 13|Artemis|がんばってね、ザグレウス。\n汝の矢の、獲物を射止めんことを！\n…ううん、ザグレウスなら、絶対、射止められる！
ArtemisMiscPickup14|Artemis Misc Pickup 14|Artemis|狩りはかなり集中力がいるから、邪魔はしないよ。\n黙ってザグレウスの身ごなしを見守ってる。
ArtemisMiscPickup15|Artemis Misc Pickup 15|Artemis|ザグレウスはそこから脱出したいわけだから、正直、\nあたしの言うことなんて聞かなくてもいいんだけど…\n狩猟の女神の祝福は、きっと役に立つと思うよ。
ArtemisMiscPickup16|Artemis Misc Pickup 16|Artemis|どう？今度こそ脱出できそう？\nそれとも… あたしはまだ、\nひとりぼっちで狩りをしていないとダメ…？
ArtemisMiscPickup17|Artemis Misc Pickup 17|Artemis|あたしの力を貸してあげたほうがよさそうだね。\nそうだな… 今回は、こんな祝福でどう？
ArtemisMiscPickup18|Artemis Misc Pickup 18|Artemis|狩りって結局、「殺すか殺されるか」。\nでも、あたしたち神は不死身だから、\n恥を背負ってずっと生きていくしかない。\nそっちのほうが、しんどくない？
ArtemisMiscPickup19|Artemis Misc Pickup 19|Artemis|冥界でザグレウスの邪魔をしてくる\n亡者たちって、本当にしつこいよね。\nでも、根気よく仕留めつづけるしかないか。
ArtemisMiscPickup20|Artemis Misc Pickup 20|Artemis|狩りのパートナーになってほしい？あたしはどうせ冥界には行けないし、ザグレウスの返事も聞こえないけど… せめて力を貸すよ。
ArtemisMiscPickup21|Artemis Misc Pickup 21|Artemis|ザグレウス！また狩りに同行させてもらうよ。思いきり暴れよう！
ArtemisMiscPickup22|Artemis Misc Pickup 22|Artemis|また会ったね。狩りに出かける準備はいい？\nまたザグレウスと獲物を追える日を楽しみにしてたよ！
ArtemisMiscPickup23|Artemis Misc Pickup 23|Artemis|周囲を警戒して… 足音を立てないように…
ArtemisMiscPickup24|Artemis Misc Pickup 24|Artemis|周りをよく警戒して。
ArtemisMiscPickup25|Artemis Misc Pickup 25|Artemis|狩りの成功を願ってる。
ArtemisMiscPickup26|Artemis Misc Pickup 26|Artemis|今回狙う獲物は何？
ArtemisMiscPickup27|Artemis Misc Pickup 27|Artemis|周辺の警戒は、あたしに任せて。\n…ザグレウスが嫌じゃなければね。
