Id|Description|Speaker|Text
MinotaurClearProgress01|Minotaur Clear Progress 01|Zagreus|おおかた、そのとおりだ。エリュシオンの先に、\nさらに困難が待ち受けている、とだけ伝えておく。\nそれ以上は、聞かないでもらいたい。
MinotaurClearProgress01|Minotaur Clear Progress 01|Minotaur|承知した。私が敗れたのと同じだけ、おまえも\n敗れているということ。この手でおまえを\n殺せなくても、この先で役目を引き継ぐ者のために、\n膳立てを引き受けるとしよう。
MinotaurClearProgress01_B|Minotaur Clear Progress 01 B|Minotaur|小さき者よ、おまえは、冥界から脱したことがあるか？時折、思う… 外の世界は、どんなところなのかと。
MinotaurClearProgress01_B|Minotaur Clear Progress 01 B|Zagreus|…なるほど。あなたは生涯、迷宮の奥に\n閉じ込められていたから、地上を見たことがないのか。自分もほんの一部しか見たことはないが…\n寒いけれど、美しいところだ。ただ… 地上に出るたび、自分が場違いなところにいる気分になる。
MinotaurClearProgress01_B|Minotaur Clear Progress 01 B|Minotaur|場違い… なるほど。その心持ちなら、わかる。\nだが、おまえがなぜそのような場所を目指すのかは、\n理解に苦しむ。実物は、物語に聞く美しさに\nかないはしない。なぜわざわざ、幻想を壊す？
MinotaurPostEpilogue01|Minotaur Post Epilogue 01|Minotaur|皆、「王妃が帰還した」と言う。小さき者よ、どういう意味か、おまえは知っているか？
MinotaurPostEpilogue01|Minotaur Post Epilogue 01|Zagreus|俺には、かなり大きな意味のあることだ。\nその「王妃」は、じつの母親だからな。
MinotaurPostEpilogue01|Minotaur Post Epilogue 01|Minotaur|だが私にとっては、なんの意味もない。おまえと私は、ここで戦う。それだけのこと。ただ… 私の母も、\n王妃だった。おまえと母親の関係が、私と実母の関係\nより良好であることを願う。私がおまえに与える痛みを\nおまえがその母より受けることのなきよう願う。
MinotaurLowHealth01|Minotaur Low Health 01|Minotaur|小さき者よ、おまえの身体から、\n血の臭いがする。深手を負っているな。\nこれでは公正な戦いとは言えない。
MinotaurLowHealth01|Minotaur Low Health 01|Zagreus|なら、今回は戦わずに済ませては？
MinotaurLowHealth01|Minotaur Low Health 01|Minotaur|いかなる状況でも、\n戦う機会をみずから逃すことは不名誉だ。
MinotaurLowHealth02|Minotaur Low Health 02|Minotaur|そのような身体で私と戦うなど無謀。一瞬で死を迎えることになろう。
MinotaurLowHealth02|Minotaur Low Health 02|Zagreus|頭ごなしに決めつけられると、調子が狂う。\nそこまで言うなら、やって見せてもらいたい。
MinotaurLowHealth02|Minotaur Low Health 02|Minotaur|言の葉ごときに心を惑わされるか。では、さらに伝えておこう。おまえに、勝機はない。
MinotaurLowHealth03|Minotaur Low Health 03|Minotaur|道中、ずいぶん多数の手勢を相手にしたようだな。\nここまでたどり着けたのが驚きだ。
MinotaurLowHealth03|Minotaur Low Health 03|Zagreus|タルタロスからここまでの道のりがどれだけ過酷か、\nあなたにはわからない…
MinotaurLowHealth03|Minotaur Low Health 03|Minotaur|生前、大迷宮の奥に幽閉された私には、\nこの程度の道のりなど散歩に等しい。\n来い… この手でとどめを刺してやろう。
MinotaurEncounter01|Minotaur Encounter 01|Minotaur|小さき者よ、再び一戦交えにきたか。
MinotaurEncounter01|Minotaur Encounter 01|Zagreus|「小さき者」…？名誉を重んじるあなたが、\n他者をおとしめる発言をするなんて…
MinotaurEncounter01|Minotaur Encounter 01|Minotaur|対戦相手の揚げ足を取り、動揺を誘う戦術…\nじつにありふれている。覚悟はいいか？
MinotaurEncounter02|Minotaur Encounter 02|Minotaur|再び挑戦しに戻ったか。エリュシオンを彷徨う\n英雄でも、これほどの気概のある者は稀。\n受けて立とう。
MinotaurEncounter02|Minotaur Encounter 02|Zagreus|ここにあなたがいるとは思わなかった。たまたま\n通りかかっただけだ。戦うつもりで来たわけじゃ…
MinotaurEncounter02|Minotaur Encounter 02|Minotaur|ここに足を踏み入れたことこそが、挑戦。\n私が闇に生きる生者であった頃からの習わしだ。\nこの手で、その闇の底へ突き落としてやろう。
MinotaurEncounter03|Minotaur Encounter 03|Minotaur|次なる挑戦者か… この者が私を倒す見込みは、低い。
MinotaurEncounter03|Minotaur Encounter 03|Zagreus|「低い」…？また遠回しに、俺の身長をばかにして…
MinotaurEncounter03|Minotaur Encounter 03|Minotaur|私は、何事も遠回しにはしない。\n一撃、一撃、全力を込めて、直撃させる。\n今、実践してやろう。
MinotaurEncounter04|Minotaur Encounter 04|Minotaur|我が領域に足を踏み入れた… これが何を意味するかは、承知しているな？
MinotaurEncounter04|Minotaur Encounter 04|Zagreus|互いの名誉を賭け、あなたと力の限り戦う意志の表明… どうやらここでは、それぐらいしか、\nやることがないらしい。
MinotaurEncounter04|Minotaur Encounter 04|Minotaur|それは… フン… たしかに、そのとおりだ。覚悟はできているか？
MinotaurEncounter05|Minotaur Encounter 05|Minotaur|…来たか。では、再び楽しませてもらうとしよう。
MinotaurEncounter05|Minotaur Encounter 05|Zagreus|望むところだ。こちらも、巨大な両刃の斧で叩き切られたり、踏みつけられたりするのは楽しい。
MinotaurEncounter05|Minotaur Encounter 05|Minotaur|それは何よりだ。思う存分、享受するといい。
MinotaurEncounter06|Minotaur Encounter 06|Minotaur|小さき者よ、まずは私が相手だ。\n後ほど門前で、王と私が徹底的に叩きのめしてやる。
MinotaurEncounter06|Minotaur Encounter 06|Zagreus|いちいち、小さい、小さいと言われると、傷つく… \nテセウスだって、背丈は大して変わらないはずだ。
MinotaurEncounter06|Minotaur Encounter 06|Minotaur|テセウス王は偉大なお方。アテナイ史上、最も優れた\n王であらせられる。だがおまえは… きまぐれな神の放蕩息子。おまえの父が私を軽んじるように、おまえもまた\n王がじきじきに相手をするまでもない存在。\nここは私が相手になろう。
MinotaurWinStreak01|Minotaur Win Streak 01|Minotaur|私にくだされてなお、再度倒されに戻る挑戦者は稀だ。
MinotaurWinStreak01|Minotaur Win Streak 01|Zagreus|道をふさがれている以上、再戦を申し込む以外に選択肢はない。
MinotaurWinStreak01|Minotaur Win Streak 01|Minotaur|おまえはみずから道を選び、ここへたどり着いた。\n結果、再び私に倒されることになろう。
MinotaurLoseStreak01|Minotaur Lose Streak 01|Minotaur|小さき者よ、思いの外、できるようだな。\n近いうちにぜひ、また手合わせ願いたい。
MinotaurLoseStreak01|Minotaur Lose Streak 01|Zagreus|こちらが勝つたびに、もう一度戦わされるような気が\nするが…
MinotaurLoseStreak01|Minotaur Lose Streak 01|Minotaur|エリュシオンでは、戦勝も、\n我々の存在すらも、ただ一時のもの。\n皆、束の間を享受しながら、死後生を生きている。
MinotaurMiscStart01|Minotaur Misc Start 01|Minotaur|小さき者よ、おまえの挑戦、受けて立とう。
MinotaurMiscStart02|Minotaur Misc Start 02|Minotaur|挑戦者か。来い、私がひねり潰してやろう。
MinotaurMiscStart03|Minotaur Misc Start 03|Minotaur|突然の訪問であろうと、\nすべての挑戦者の相手をするのが、私の務め。
MinotaurMiscStart04|Minotaur Misc Start 04|Minotaur|また現れたな。いつでも受けて立とう。
MinotaurMiscStart05|Minotaur Misc Start 05|Minotaur|我が領域に、再度足を踏み入れたな… 受けて立とう。
MinotaurMiscStart06|Minotaur Misc Start 06|Minotaur|また現れると思っていた。さっそく始めよう。
MinotaurMiscStart07|Minotaur Misc Start 07|Minotaur|再度、互いの腕を試すときが来たようだ。\n覚悟はいいか？
MinotaurMiscStart08|Minotaur Misc Start 08|Minotaur|この手で最後に命を奪ったのは、いつのことか。\n久々に腕が鳴る。
MinotaurMiscStart09|Minotaur Misc Start 09|Minotaur|栄光を求め、再度私と一戦交えに来たか。\n望むところだ。
MinotaurMiscStart10|Minotaur Misc Start 10|Minotaur|何度でも相手をしてやろう。\n鍛錬を積む時間は、我々には無限に存在する。
MinotaurMiscStart11|Minotaur Misc Start 11|Minotaur|小さき者よ、おまえに感謝する。私に敗れて\nなお再挑戦する者は、このエリュシオンでは稀だ。
MinotaurMiscStart12|Minotaur Misc Start 12|Minotaur|地の底より生じた小さき者よ、ようやく再挑戦する気になったか。
MinotaurMiscStart13|Minotaur Misc Start 13|Minotaur|おまえが再びエリュシオンに\n足を踏み入れたと聞き、待ちわびていた。
MinotaurMiscStart14|Minotaur Misc Start 14|Minotaur|手加減は無用。どこからでも掛かってくるがいい。
MinotaurMiscStart15|Minotaur Misc Start 15|Minotaur|戦いを繰り返し、互いに切磋琢磨しよう。
MinotaurMiscStart16|Minotaur Misc Start 16|Minotaur|いかなる者からの挑戦も、私はすべて受けて立つ。
MinotaurMiscStart17|Minotaur Misc Start 17|Minotaur|エリュシオンの覇者にまみえる前に、\n私が相手をしよう。
MinotaurMiscStart19|Minotaur Misc Start 19|Minotaur|エリュシオンの覇者への目通りを望むなら、\nまず私を倒してみよ。
MinotaurMiscStart20|Minotaur Misc Start 20|Minotaur|フン… 最後の戦いはいつだったか…\n思い出せないほど、遠い昔だ。
MinotaurMiscStart21|Minotaur Misc Start 21|Minotaur|おまえとの再戦の時を待ち望んでいた。さっそく始めるとしよう。
MinotaurMiscStart22|Minotaur Misc Start 22|Minotaur|おまえがこちらへ向かっていると聞き、私は、この手で足止めすることを宣言した。さて、結果はいかに。
MinotaurMiscStart23|Minotaur Misc Start 23|Minotaur|こうして一戦交えるごとに、おまえについて\n理解が深まる。さっそく始めるとしよう。
MinotaurMiscStart24|Minotaur Misc Start 24|Minotaur|おまえとは、いずれ再び相まみえることになると\n思っていた。この再戦を待ちわびていた。
MinotaurMiscStart25|Minotaur Misc Start 25|Minotaur|踏み殺すか、あるいは、斬り殺すか… おまえの好む手法で倒してやろう。
MinotaurMiscStart26|Minotaur Misc Start 26|Minotaur|王には、この手でおまえを足止めするとお伝えした。\n私なら難なくやってのけると、王はお考えだ。\nさて、結果はいかに。
MinotaurMiscStart27|Minotaur Misc Start 27|Minotaur|小さき者よ、待ちわびたぞ。さっそく始めよう。
MinotaurMiscStart28|Minotaur Misc Start 28|Minotaur|生きてこの先へ進むため、\nすべきことはわかっているはず。さっそく始めよう。
MinotaurMiscStartExtremeMeasures01|Minotaur Misc Start Extreme Measures 01|Minotaur|この戦い、鎧を帯びて臨ませてもらう。\n小さき者よ、おまえの力を見せてみろ。
MinotaurMiscStartExtremeMeasures02|Minotaur Misc Start Extreme Measures 02|Minotaur|小さき者よ、おまえに、この鎧を破れるか？
MinotaurMiscStartExtremeMeasures03|Minotaur Misc Start Extreme Measures 03|Minotaur|この鎧は重いが、生身の際より素早く動ける。\n覚悟はいいか？
MinotaurMiscStartWinStreak01|Minotaur Misc Start Win Streak 01|Minotaur|小さき者よ、じつに見事な回復力だ。
MinotaurMiscStartWinStreak02|Minotaur Misc Start Win Streak 02|Minotaur|幾度でも殺してやる。\nどこからでも掛かってくるがいい。
MinotaurMiscStartWinStreak03|Minotaur Misc Start Win Streak 03|Minotaur|おもしろい… 私に倒されてなお、再挑戦する者は稀だ。
MinotaurMiscStartWinStreak04|Minotaur Misc Start Win Streak 04|Minotaur|私ごときを倒せぬようでは、エリュシオンの覇者の相手は到底務まらぬ。
MinotaurMiscStartWinStreak05|Minotaur Misc Start Win Streak 05|Minotaur|小さき者よ、その執念深さは、称賛に値する。
MinotaurMiscStartWinStreak06|Minotaur Misc Start Win Streak 06|Minotaur|敗北を喫しても、直ちに立ち直る。\n戦士として、申し分ない気質だ。
MinotaurMiscStartLoseStreak01|Minotaur Misc Start Lose Streak 01|Minotaur|おまえの素早さは、称賛に値する。\n再び私を突破できるか、手並み拝見といこう。
MinotaurMiscStartLoseStreak02|Minotaur Misc Start Lose Streak 02|Minotaur|小さき者よ、再度私をくだしてみろ。\nできるものならば。
MinotaurMiscStartLoseStreak03|Minotaur Misc Start Lose Streak 03|Minotaur|おまえの挑戦なら、喜んで受けよう。\n再度私をくだしてみろ。
MinotaurMiscStartLoseStreak04|Minotaur Misc Start Lose Streak 04|Minotaur|再度私をくだし、栄光をつかめ。いざ、勝負！
MinotaurMiscStartLoseStreak05|Minotaur Misc Start Lose Streak 05|Minotaur|敗北の苦味も、また一興。生者であった頃に\n味わった感覚に近しいものがある。
MinotaurMiscStartLoseStreak06|Minotaur Misc Start Lose Streak 06|Minotaur|おまえの戦術を研究中だ。\n再戦の機会はじつに喜ばしい。
MinotaurMiscStartLoseStreak07|Minotaur Misc Start Lose Streak 07|Minotaur|再度私をくだし、先へ進んでみよ。
MinotaurMiscStartLoseStreak08|Minotaur Misc Start Lose Streak 08|Minotaur|小さき者よ、今回は私が挑戦者だ。
MinotaurMiscStartLoseStreak09|Minotaur Misc Start Lose Streak 09|Minotaur|前回の戦いの礼をする機会を待ちわびていた。
MinotaurMiscStartLoseStreak10|Minotaur Misc Start Lose Streak 10|Minotaur|おまえはなかなか腕が立つ。\nしかし、執念深さでは私も負けぬ。
MinotaurMiscStartLoseStreak11|Minotaur Misc Start Lose Streak 11|Minotaur|この先で、エリュシオンの覇者が待ち受ける。\n今回も私を倒せればの話だが。
MinotaurMiscStartLoseStreak12|Minotaur Misc Start Lose Streak 12|Minotaur|来たな。前回のようにはいかない。私の攻撃が一度でもおまえに命中すれば、勝負がつく。
MinotaurOutro01|Minotaur Outro 01|Minotaur|見事な戦いぶりだ。だが、エリュシオンの覇者には及びもつかない。まもなく思い知ることになるだろう。
MinotaurOutro02|Minotaur Outro 02|Minotaur|強き者には、しかるべき敬意を払う。\n先へ進み、エリュシオンの覇者とまみえるがいい。
MinotaurOutro03|Minotaur Outro 03|Minotaur|おまえとは、ぜひまた一戦交えたいものだ。そのときを楽しみにしている。
MinotaurOutro04|Minotaur Outro 04|Minotaur|おまえはこの先へ進む資格を得た。\nおまえと次にまみえるときに備え、\n傷を癒やしておこう。
MinotaurOutro05|Minotaur Outro 05|Minotaur|おまえとこうして鍛錬を積んできたことを、\n誇りに思う。
MinotaurGilgameshAspectOutro01|Minotaur Gilgamesh Aspect Outro 01|Minotaur|…！これが、ギルガメシュの力… なるほど、理解した。だが、私はその者の友の轍は踏まぬ。じきに再戦を。
MinotaurGilgameshAspectOutro02|Minotaur Gilgamesh Aspect Outro 02|Minotaur|なんという… これがギルガメシュの力か。小さき者よ、よい勝負だった。
