Id|Description|Speaker|Text
NyxAboutEnding03|Nyx About Ending 03|Nyx|新たな職務を得たと聞き及んでいます。今後も引き続き\n当館から地上を目指す意義が生じたと。あなたの努力のたまものです。
NyxAboutEnding03|Nyx About Ending 03|Zagreus|あくまでも形式上のことだと思います。\n“職務”といっても、これまでやってきたことと大して\n変わらない。それでも、あなたにそう言ってもらえると\nうれしいです。脱出することがこの館のために\nなるなんて、なんだか妙な気分ですが。
NyxAboutEnding03|Nyx About Ending 03|Nyx|「なんぴとも逃れられぬ」。冥王神ハデスは、\nこの評判が広く聞こえることを希望しています。\n人間や亡霊たちがあなたが成し遂げたことを\n模倣しようとすることのないように。
NyxAboutEnding03|Nyx About Ending 03|Zagreus|正直、自室でぶらぶらしているよりずっといいのは、\nたしかです。それに… 自分は役立たずだと思わずに\n済むのは、気分がいいものです。
NyxAboutEnding03|Nyx About Ending 03|Nyx|あなたと共に当館に勤めることができ、光栄です。
NyxAboutEnding04|Nyx About Ending 04|Zagreus|ずっと気になっていたんですが… カロンが母上と俺を\n舟に乗せて、館へ運んでくれたことがありました。\nということは… カロンはあなたの下で働いている\nということですか？\nすべては壮大な計画の一部、とか…？
NyxAboutEnding04|Nyx About Ending 04|Nyx|カロンはここ、冥界のみに仕えており、\n信頼が置けます。あなたに対してはともかく、\n女王に対する親しみの念は、いくらか\n持ち合わせていても、不思議ではありません。
NyxAboutOlympianReunionQuest01|Nyx About Olympian Reunion Quest 01|Nyx|あなたはいまだ、苦境に立たされています。その点では\n私も同様。オリュンポスの神々は現在も、あなたが\n彼らのもとを目指していると信じ、私があなたの実母\nであると認識しています。われわれが善意でついた嘘が\n思いも寄らぬ規模に増幅してしまいました。
NyxAboutOlympianReunionQuest01|Nyx About Olympian Reunion Quest 01|Zagreus|たしかに、何か手を打つ必要がありますね…\nこのまま嘘の上塗りを続けるのにも、限界がある…
NyxAboutOlympianReunionQuest01|Nyx About Olympian Reunion Quest 01|Nyx|とはいえ、すべての真相を明かせば、彼らの怒りを\n招きかねません。オリュンポスの神々には、\nこうした欺きに寛容でない者も存在します。
NyxAboutOlympianReunionQuest01|Nyx About Olympian Reunion Quest 01|Zagreus|でも、幸い母上に考えがあるようで、オリュンポスの神々一柱ずつに、連絡を取るよう頼まれています。
NyxAboutOlympianReunionQuest01|Nyx About Olympian Reunion Quest 01|Nyx|あなたの実母は、機知に富んだ女神です。とはいえ、\nその「考え」の具体的な内容は、把握していますか？
NyxAboutOlympianReunionQuest01|Nyx About Olympian Reunion Quest 01|Zagreus|それが… 彼ら全員を館に招いて、アンブロシアを\n振る舞うと言うんです… 信じられますか？
NyxAboutOlympianReunionQuest02|Nyx About Olympian Reunion Quest 02|Zagreus|母上が計画している宴に、カオスを招待しても\nかまわないでしょうか…？
NyxAboutOlympianReunionQuest02|Nyx About Olympian Reunion Quest 02|Nyx|カオスがわれわれの宴に出席するとは考えにくく、\nそもそも出席が可能かも、判然としません。出席を\n希望する可能性については、さらに低いと思われます。それでも、あなたが招待することを望むなら、\nそのようになさい。
NyxPostEpilogue01|Nyx Post Epilogue 01|Nyx|アテナやアレスを始めとする、あなたの家族に\nまみえることができ、光栄でした。\n当館に会した彼らは、私の予想に反し、友好的でした。\n忘れがたき夜となりました。
NyxPostEpilogue01|Nyx Post Epilogue 01|Zagreus|本当に、忘れられない一夜になりましたね。\nディオニュソスだけは、何も覚えていなそうですけど。\nみんな、積年の恨みも吹き飛んだみたいに、仲よく\n楽しんでくれていた。これで万事解決、でしょうか…？
NyxPostEpilogue01|Nyx Post Epilogue 01|Nyx|彼らに知らせるべきことは、ペルセポネがすべて\n説明しました。家族間の問題を解決するには、\n時に、それが唯一の手段となります。とはいえ…\nオリュンポスの神々は何かにつけて誤解しがちです。\nこの団結がいつまで継続するかは、不確かです。
NyxPostEpilogue01|Nyx Post Epilogue 01|Zagreus|平和を楽しめるのも今のうち、ということですね…
NyxPostEpilogue02|Nyx Post Epilogue 02|Nyx|過ぎたる誇りは、欠陥となりえます。\n人間たちはもとより、あなたの一族にも、\n過度の誇りで身を滅ぼした者がいます。\nそれでも… 私はあなたに誇らしさを覚えます。\n誰にでも成し遂げられることではありません。
NyxPostEpilogue02|Nyx Post Epilogue 02|Zagreus|何もかも、あなたの協力があったからです。あなたが\n生みの母親ではないと知ったとき、俺はあなたに当たり\n散らした。それでも、あなたは俺に愛情を注ぎつづけて\nくれた。わが身を危険にさらして、父上に背いてまで、\n俺の力になってくれた。どうしてそこまで…
NyxPostEpilogue02|Nyx Post Epilogue 02|Nyx|私は、当館に永遠に仕える身。あなたの父が冥王の座に\n就く以前の時代から、ここに在りました。冥王ハデスの\n入館後は、冥界の秩序を保ち、冥王との友好的な\n関係構築に尽力しました。ですが、あなたの質問の\n答えとしては、もうひとつ大きな理由があります…
NyxPostEpilogue02|Nyx Post Epilogue 02|Zagreus|オリュンポスの神々との関係を修復するため、ですね？\n彼らはずっと、冥界を忌み嫌ってきた。\nでも、俺たちと交流するようになった今は、\n前よりずっと協力的になった気がします。
NyxPostEpilogue02|Nyx Post Epilogue 02|Nyx|的を得た推論です。そうした要素がないわけでは\nありません。ただ、私があなたに協力した理由は、\nずっと単純です。私はあなたの生みの母でこそ\nありませんが、あなたをわが子同然に育てました。\nあなたを愛しているから、力になったのです。
NyxPostEpilogue02|Nyx Post Epilogue 02|Zagreus|ニュクス… 俺も、同じ気持ちです。何もかも、あなたのおかげです。
NyxPostEpilogue03|Nyx Post Epilogue 03|Nyx|あなたの実母… 女王が、再び旅立ちました。とはいえ、必ず戻るとわかっている分、今回は、見送りの際の心の痛みがずっと軽度で済みました。
NyxPostEpilogue03|Nyx Post Epilogue 03|Zagreus|でも母上は、あれほど嫌っていた\nオリュンポスに戻るのは、つらいでしょうね。\n心配です…
NyxPostEpilogue03|Nyx Post Epilogue 03|Nyx|案ずることはありません。冥界から彼女を見守る術は、\n複数存在します。彼女の身に災いが降りかかることは\n想定していませんが… 相手はオリュンポスの神々。\n用心するに越したことはないでしょう。
NyxPostEpilogue03|Nyx Post Epilogue 03|Zagreus|…寂しくなりますね。
NyxPostEpilogue03|Nyx Post Epilogue 03|Nyx|私も同じ心持ちです。\nが、彼女はすぐに帰還するでしょう。
NyxPostEpilogue04|Nyx Post Epilogue 04|Zagreus|オリュンポスの神々を招いた宴、カオスにも“参加”してもらえてよかったです。少しは話せましたか？
NyxPostEpilogue04|Nyx Post Epilogue 04|Nyx|つかの間でしたが、久しぶりに言葉を交わすことが\nできました。思いのほか、心楽しいひとときでした。\nまたいずれ、カオスと継続的に会話する機会を\n持つことも検討します。あなたが能動的に\n働きかけてくれたおかげです。感謝します。
NyxAboutHypnos01|Nyx About Hypnos 01|Nyx|あなたは最近、ヒュプノスと頻繁に接触しています。\n彼の振る舞いを許容できなければ、私にその旨、\n伝達願います。
NyxAboutHypnos01|Nyx About Hypnos 01|Zagreus|自分の息子を、もっと評価してやってください。\nヒュプノスはいつも眠そうですが、\n底抜けに陽気です。あんなに生き生きと\n仕事をするやつは、そうはいませんよ。
NyxAboutHypnos02|Nyx About Hypnos 02|Zagreus|あなたとヒュプノスが話しているところを\n見たことがないですが… 何か問題でも…？
NyxAboutHypnos02|Nyx About Hypnos 02|Nyx|ヒュプノスは、自立の途上にあります。\n当面は距離を置くことが最善と判断したまで。\nそうでもしなければ、彼は極めて初歩的な依頼ですら、\n私の援助なしでは遂行できぬままとなるでしょう。\n当分は私を頼らぬよう、言い含めてあります。
NyxAboutHypnos02|Nyx About Hypnos 02|Zagreus|“当分”って、具体的にはどのぐらいですか？\nあなたがヒュプノスと口を利いているのを\n最後に見たのがいつだったか、正直思い出せない。
NyxAboutHypnos02|Nyx About Hypnos 02|Nyx|彼の成長速度から判断して、自立訓練期間は、\n次の時代の幕開け前には完了するでしょう。
NyxAboutCharon01|Nyx About Charon 01|Zagreus|最近、カロンに会いましたか？\nあいつは、何を考えているのか察するのが難しくて…
NyxAboutCharon01|Nyx About Charon 01|Nyx|昨今、カロンと連絡を取る機会はありません。\nわが子らの内でも、彼、ならびに運命の三女神は、\n親の助力を必要とせず、高い自立性を備えています。\nカロンについて、私が明言できることは、ただひとつ。\n彼は渡し守という役割に満足しています。
NyxAboutCharon01|Nyx About Charon 01|Zagreus|カロンが俺にいろいろ売ってくれるのは、\nきっとあなたのおかげですね。
NyxAboutCharon01|Nyx About Charon 01|Nyx|すべては、彼がみずからの意志で行っていること。\n言葉での意思疎通ができずとも、知恵を持たぬわけでは\nありません。彼もこの館に仕える身。\nとはいえ、私の配下に属するわけではありません。
NyxAboutCharonFight01|Nyx About Charon Fight 01|Zagreus|仮の話ですが、俺とカロンが戦うことになったとして…\nカロンが手加減してくれる可能性はありますか？\n“戦う”というのは、“殺し合う”という意味ですが…
NyxAboutCharonFight01|Nyx About Charon Fight 01|Nyx|カロンの兄弟たちに、\n彼と戦おうとした者などいません。\nなぜそのような危険な状況を想定するのですか？
NyxAboutCharonFight01|Nyx About Charon Fight 01|Zagreus|じつは… 実際、そういう状況になって…\nカロンがどれだけ強いか、身をもって思い知りました。\nどうにか仲直りする方法はないでしょうか。
NyxAboutCharonFight01|Nyx About Charon Fight 01|Nyx|方法は、ないと推測されます。\nが、その必要もないでしょう。\n好敵手ができたことを、彼なりに喜んでいるかと。\nカロンに挑む者など、滅多に現れません。
NyxMegDefeated01|Nyx Meg Defeated 01|Nyx|メガイラを倒したものと理解しています。彼女は\n酒場で、もう長いこと陰鬱な表情を浮かべています。\n彼女がこの館で鞭を振るうことはありませんが、\n舌鋒を受ける覚悟は必要かと。
NyxMegDefeated01|Nyx Meg Defeated 01|Zagreus|声を掛けたほうがよさそうだな…\n知らせてくれて、ありがとうございます。
NyxMegDefeated01_Alt|Nyx Meg Defeated Alt 01|Nyx|メガイラを倒したものと理解しています。彼女は館の\n片隅で、もう長いこと陰鬱な表情を浮かべています。\n彼女がこの館で鞭を振るうことはありませんが、舌鋒を受ける覚悟は必要かと。
NyxAboutChaos01|Nyx About Chaos 01|Zagreus|「カオス」と名乗る者に、心当たりはありますか？物腰の柔らかい、おだやかな印象の存在でした… 最近接触を受けて、功徳らしきものを授かったんですが…
NyxAboutChaos01|Nyx About Chaos 01|Nyx|原初の混沌、カオス… よく承知しています。\nあなたの試みに、興味を抱いたのでしょう。\nあの者からの授かり物には、くれぐれも警戒を。\nとはいえ、カオスが他者を欺くことはありません。
NyxAboutChaos02|Nyx About Chaos 02|Zagreus|カオスについて、聞きたいことが山ほどあります…\n質問に答えてもらえませんか？
NyxAboutChaos02|Nyx About Chaos 02|Nyx|私は、カオスについて公然と語る立場にありません。\nそれをする権利を有するのは、カオス本人のみ。\n私から言えるのは、カオスはこの世で最古の存在であるという事実のみ。それ以前の世界は、“無”でした。
NyxAboutChaos03|Nyx About Chaos 03|Zagreus|どうも、カオスに気に入られたみたいです…\nあなたのことも、話題にのぼりました。
NyxAboutChaos03|Nyx About Chaos 03|Nyx|カオスは私を失念したものと解釈していました。\nあの者は、私の母であり、父。最後に言葉を\n交わしたのは、太古の昔のことです。
NyxAboutChaos04|Nyx About Chaos 04|Zagreus|何度もしつこくてすみません… またカオスのことです。せめて、連絡を取ってみてもらえませんか？
NyxAboutChaos04|Nyx About Chaos 04|Nyx|カオスが私との関係修復を望むのならば、\nカオス側から接触を試みるべきです。\nこの件について、これ以上話題にすることを、\n私は望みません。
NyxAboutChaos05|Nyx About Chaos 05|Nyx|あなたが何をしたのかは不明ですが… カオスが\n私との接触を試みた痕跡を、わずかに感知しました。\n意識のかたすみに、おぼろげに… しかし、たしかに、\n感じられた… 言づてのようでしたが、内容は\n理解できませんでした。カオスの望みは何ですか？
NyxAboutChaos05|Nyx About Chaos 05|Zagreus|たぶん、あなたと連絡を取りたいんじゃないかと…\n遠い昔に離ればなれになったままだと聞きました。\n俺もタナトスと長いこと疎遠になりましたが、\nあなたとカオスは、その比じゃない。\nなんとかなりませんか？
NyxAboutChaos05|Nyx About Chaos 05|Nyx|にわかには、困難でしょう。今となっては、この館も\n堅固になり、冥界に秩序がもたらされたためです。\n少し検討させてください。
NyxAboutChaos06|Nyx About Chaos 06|Nyx|カオスと私に関して、なすべきことは承知しています。これまで、私があなたに助力を乞うことは\nまずありませんでしたが… 差し支えなければ、\nあなたに実行してもらいたい件があります。
NyxAboutChaos06|Nyx About Chaos 06|Zagreus|もちろんです。何をすれば？
NyxAboutChaos06|Nyx About Chaos 06|Nyx|執務室の内部に、「最古の旗印」があったことを\n記憶していますか？あの旗印を通じ、\n冥界の最暗領域へ、瞬時に移動が可能… ただし\n現在は、カオスのもとへの直接移動は不可能です。\nですが、この点については、対処可能と思われます。
NyxAboutChaos06|Nyx About Chaos 06|Zagreus|…旗印？でも、俺にはあれを使う権限はないし、\n使おうとしても、瞬間移動なんてできませんでした。\nしかも今じゃ、前より権限を制限されてしまって…
NyxAboutChaos06|Nyx About Chaos 06|Nyx|あなたが権限を剥奪されたからこそ、可能な策です。\n闇の結晶を大量に取得できれば、カオスへの架け橋は\n復旧し、私は再び、あの領域を訪問できるでしょう。\n闇の結晶を旗印に集める作業を、あなたに依頼しても？\n可能なときのみで、かまいません。
NyxAboutChaos06|Nyx About Chaos 06|Zagreus|俺にできることなら、何でも。じゃあ、\nこうしましょう。宮大工に依頼を出してください。\nそうすれば、堂々と公に作業できます。
NyxAboutChaos07|Nyx About Chaos 07|Nyx|ついに、カオスのもとへと通じる架け橋は\n再建されました。私は、カオスを訪問します。\n安心なさい。じきに戻ります。あなたのことも、\nカオスに伝えておきましょう。
NyxChaosReunionQuestComplete|Nyx Chaos Reunion Quest Complete|Zagreus|戻ってたんですね！カオスとは、無事に会えましたか？
NyxChaosReunionQuestComplete|Nyx Chaos Reunion Quest Complete|Nyx|有意義な再会となりました。あなたの厚意により、\n太古より存在する祖神と再び接点を得ることができた…\n私にとっても、カオスにとっても、幸甚です。\n長く疎遠となっていた関係の修復に努めました。
NyxChaosReunionQuestComplete|Nyx Chaos Reunion Quest Complete|Zagreus|また普通に話せる関係に戻れたら、近いうちにカオスが\nこの館を訪れることもある、ということですか？
NyxChaosReunionQuestComplete|Nyx Chaos Reunion Quest Complete|Nyx|カオスがみずからの領域を脱することはありません。\n代わりに、私が折を見てあの領域を訪れ、冥界での\n出来事を、逐一報告します。この世界を生み出した\n存在とはいえ、外界に過度の干渉をすべきでないことを\nカオスは十分に自覚しています。
NyxChaosReunionQuestCompleteAftermath01|Nyx Chaos Reunion Quest Complete Aftermath 01|Zagreus|最近、カオスとは、どうですか？カオスは、あなたに\n相当な期待を寄せていたみたいですね。\n「日の光と同等の輝きを放つ」とか…\n俺には想像もつきませんが。
NyxChaosReunionQuestCompleteAftermath01|Nyx Chaos Reunion Quest Complete Aftermath 01|Nyx|輝きに関して、私は不得手です。開闢のとき、私が\n為すべきことは無数に存在しました。この館も、当時はすべて、現在よりも私の趣向に寄っていました。現在のカオスは、私をより正確に理解しています。私は\nここでの仕事を通じ、自身の限界を把握しました。
NyxChaosReunionQuestCompleteAftermath01|Nyx Chaos Reunion Quest Complete Aftermath 01|Zagreus|限界？あなたは、なんだってできるでしょう。きっと、光輝くことだって…
NyxChaosReunionQuestCompleteAftermath01|Nyx Chaos Reunion Quest Complete Aftermath 01|Nyx|限界は、誰にでも存在するものです。
NyxAboutMeg01|Nyx About Meg 01|Nyx|エリニュスの一柱、メガイラが、タルタロスの\n果てであなたを足止めする任に就いています。\nあなた方ふたりの衝突は不可避。\nこのような事態に、胸が痛みます。
NyxAboutMeg01|Nyx About Meg 01|Zagreus|心配いりませんよ。思えば、メガイラとは\nこれまでもさんざん衝突してきました。\n俺たちの関係には、いいスパイスです。
NyxAboutMeg02|Nyx About Meg 02|Zagreus|あなたはメガイラのことを、俺が生まれるより前から知っていますよね。彼女は… その… どんな子どもでしたか？
NyxAboutMeg02|Nyx About Meg 02|Nyx|フフフ… あなた方ふたりの関係が良好であることに、\nうれしさを覚えます。メガイラは、今も昔も\n変わりません。幼い頃から聞き分けがよく、\n几帳面でした。情にも厚く、頼もしく、\n他者を敬う心も持ち合わせていました。
NyxAboutMegRelationship01|Nyx About Meg Relationship 01|Nyx|あなたとメガイラが相互理解を深めたことについて、\nうれしさを覚えます。あなたとメガイラがこうした\n結果に到達する能力を有していることを、\n願っていました。
NyxAboutMegRelationship01|Nyx About Meg Relationship 01|Zagreus|メガイラと俺のこと、よろこんでくれるんですか？\nニュクスのことだから、\n「職務の妨げになる」と心配するかと…\nもちろん、認めてもらえてうれしいですが…
NyxAboutMegRelationship01|Nyx About Meg Relationship 01|Nyx|メガイラが職務怠慢に陥る恐れはないと判断します。\n加えて、こうした事象は総じて、大いなる達成に\nつながるものです。とはいえ、そのような関係に\n求めるものは、大いなる幸福感のみで十分である\n場合が大半です。
NyxAboutMegRelationship01B|Nyx About Meg Relationship B 01|Zagreus|メグと俺が親しくなったこと、\nよろこんでくれるんですか？うれしいですが…\nメグの仕事に支障が出るんじゃないかと、心配で…
NyxAboutMegRelationship01B|Nyx About Meg Relationship B 01|Nyx|あなた方、双方について、そのような懸念は抱いて\nいません。双方とも、みずからの職務に注力して\nいます。ときおり必要となる対戦程度で、\nあなた方の絆がほころぶことはないと考えます。\nだからこそ、絆が結束された… 違いますか？
NyxAboutThanatos01|Nyx About Thanatos 01|Zagreus|地上を目指す途中で、タナトスに会いました。\n俺に協力してくれましたが…\n俺が館を去ったことで、腹を立てているようでした。
NyxAboutThanatos01|Nyx About Thanatos 01|Nyx|タナトスは、あなたの身を案じています。\nあなたが彼から感じた「怒り」の感情は、\n彼の本心ではありません。礼を欠いた\n態度については、目こぼし願います。
NyxAboutThanatos02|Nyx About Thanatos 02|Nyx|タナトスが館に帰還しました。\nすでに再会を果たしましたか？心ここにあらず、\nといった様子でした。あなたとの再会に、\nよろこびを感じているのでしょう。
NyxAboutThanatosRelationship01|Nyx About Thanatos Relationship 01|Nyx|あなたと私の息子が親しくしていることに、\nうれしさを覚えます。タナトスは常に孤独にあり、\nそれに関して不満を口にしたことはありませんが、\n彼なりに、心を許せる相手を求めていたことを、\n私は承知しています。
NyxAboutThanatosRelationship01|Nyx About Thanatos Relationship 01|Zagreus|そう言ってもらえると、うれしいです。\nタナトスも俺も、長年、お互いへの想いを\nうまく伝えられずにいましたが、\nやっと自分の気持ちに正直になれました。
NyxAboutThanatosRelationship01|Nyx About Thanatos Relationship 01|Nyx|では、あなたも、彼も、互いに求めていたものを得たということ。どうか、私の息子をよしなに願います。彼はときに、限界を超過して仕事をする嫌いがあります。
NyxAboutThanatosRelationship01|Nyx About Thanatos Relationship 01|Zagreus|それについては、心配ありませんよ。\nでも、俺も気をつけておきます。
NyxAboutThanatosRelationship01B|Nyx About Thanatos Relationship B 01|Zagreus|冥界でそういう相手を見つけるのは難しいですが、\n俺はいつもタナトスを信頼してきたし、\nあいつも同じ気持ちだと思います。\n以前と比べて、絆が深まった気がします。
NyxAboutThanatosRelationship01B|Nyx About Thanatos Relationship B 01|Nyx|闇深き地底の根城として、当館の存続するかぎり、その絆の続くことを願います。私の息子のことを、よしなに願います。
NyxAboutDusa01|Nyx About Dusa 01|Nyx|何事ですか？あなたは今、通常とは異なる懸案を\n抱いています。私に関連することである点は、\nそこはかとなく察知できます。
NyxAboutDusa01|Nyx About Dusa 01|Zagreus|俺はただ… あなたがデューサに厳しすぎる気がして… べつに責めるつもりはないですが、俺と一切会話するなと命じたそうですね？
NyxAboutDusa01|Nyx About Dusa 01|Nyx|おのれの本分を果たすよう、注意を促したまで。\nこの館で、使用人が礼節をわきまえぬ行動に及ぶことが\nあってはなりません。にも関わらず、あなたは略式な\n態度をとる… 冥王神ハデスの嫡男が交友すべきは神々\nであり、ゴルゴンの頭部は、友として不適切です。
NyxAboutDusa01|Nyx About Dusa 01|Zagreus|くだらない… 俺がそんなに重要な存在なら、\nこの館で誰と交友を深めようと、俺の勝手でしょう？
NyxAboutDusa01|Nyx About Dusa 01|Nyx|あなたは、みずからの立場を理解していません。\nあのゴルゴンの頭部も、立場をわきまえる必要が\nあります。あなたは自分のすべきことに注力し、\nあの者とは関わらぬことです。
