Id|Description|Speaker|Text
ThanatosAboutMyrmidonReunionQuestComplete01|Thanatos About Myrmidon Reunion Quest Complete 01|Zagreus|你也知道，他可不仅仅是我的教练。至于我是怎么做到的，身为冥王的长子，也是他唯一的儿子，我还是有些特权的。现在，阿喀琉斯应该和他相爱的人在一起了。
ThanatosAboutMyrmidonReunionQuestComplete01|Thanatos About Myrmidon Reunion Quest Complete 01|Thanatos|凡人之间的爱很常见，他们的爱真的那么特别，值得这么大费周章吗？而且不仅仅是你愿意帮忙，他们自己也愿意折腾吗？
ThanatosAboutMegaera01|Thanatos About Megaera 01|Thanatos|你最近经常去见墨纪拉吧，扎格？
ThanatosAboutMegaera01|Thanatos About Megaera 01|Zagreus|事情不是那样的，塔纳。她是为了拖慢我的脚步。阻止我的前进。
ThanatosAboutMegaera01|Thanatos About Megaera 01|Thanatos|如果你硬要这样说的话。不过我觉得事情比你说得要复杂。
ThanatosAboutMegaera01|Thanatos About Megaera 01|Zagreus|是啊……她的姐妹们回来了。她们…很难对付。我觉得墨纪跟她们的关系不是很好。
ThanatosAboutMegaera01|Thanatos About Megaera 01|Thanatos|我不是这个意思。也罢，你已经告诉我我想知道的了。
ThanatosAboutMegaera02|Thanatos About Megaera 02|Zagreus|你和墨纪以前就很熟悉，是吧？有时候，我都忘了你们之前走得很近了。
ThanatosAboutMegaera02|Thanatos About Megaera 02|Thanatos|是啊，因为职责的缘故，我和她时常见面。不过，直到我被西西弗斯羞辱的那件事发生之后，我才开始慢慢了解她。
ThanatosAboutMegaera02|Thanatos About Megaera 02|Zagreus|哦，没错，是墨纪亲自下令要把西西弗斯困在塔耳塔罗斯的。所以，你们是因为都很讨厌西西弗斯，才熟悉起来的吗？
ThanatosAboutMegaera02|Thanatos About Megaera 02|Thanatos|没错，我们也得释放一下压力。那差不多是我对付过的最棘手的家伙了，我猜对她来说也是如此。我想，一起经历过这样的事情之后，两个人的距离应该是会拉近的吧。
ThanatosAboutBeingCloseWithMegaera01|Thanatos About Being Close With Megaera 01|Zagreus|塔纳，我想和你说一件事。或者说问你一个问题。你和墨纪拉的关系亲密，所以，我想知道……你对我们都很了解，对吧？
ThanatosAboutBeingCloseWithMegaera01|Thanatos About Being Close With Megaera 01|Thanatos|当然。你为什么要这么问？
ThanatosAboutBeingCloseWithMegaera01|Thanatos About Being Close With Megaera 01|Zagreus|说起来有点……我在想，既然你一直和凡人打交道，我知道他们当中的一些人会选择一个追求者。这是非常合理的习惯，如果是你的……！
ThanatosAboutBeingCloseWithMegaera01|Thanatos About Being Close With Megaera 01|Thanatos|确实，凡人有自己的习惯。实际上，有很多这样的习惯。不过，没有一个是我想不通的。所以，不要让自己卷入其中。
ThanatosAboutBeingCloseWithMegaera01|Thanatos About Being Close With Megaera 01|Zagreus|你是说，你不生我的气？或者生墨纪的气？
ThanatosAboutBeingCloseWithMegaera01|Thanatos About Being Close With Megaera 01|Thanatos|现在不了。下次见到她时，替我向她问好。
ThanatosAboutBeingCloseWithDusa01|Thanatos About Being Close With Dusa 01|Zagreus|塔纳，我和杜莎走得很近，你对此不介意吧？她让这里充满了温暖……我很庆幸这里能有她在。
ThanatosAboutBeingCloseWithDusa01|Thanatos About Being Close With Dusa 01|Thanatos|这种事情不用问我，扎格列欧斯，那是你自己的感觉。
ThanatosAboutAres01|Thanatos About Ares 01|Zagreus|塔纳，你和奥林匹斯山上的阿瑞斯是什么关系？我知道他也在和亡灵打交道，但……他的方式好像和你差别很大。
ThanatosAboutAres01|Thanatos About Ares 01|Thanatos|我完全不关心他用什么方式。但他对我保持着职业上的礼貌。甚至可以说，超过你在奥林匹斯山上的大多数亲戚。
ThanatosAboutAres01|Thanatos About Ares 01|Zagreus|你是说奥林匹斯山上的其他神对你不好？
ThanatosAboutAres01|Thanatos About Ares 01|Thanatos|除了赫尔墨斯，我应该说，其他人跟我一点关系都没有。我能想到原因，我知道你父亲的处境有点复杂。至于阿瑞斯……我觉得他还不错。
ThanatosAboutNyxAndAres01|Thanatos About Nyx And Ares 01|Zagreus|塔纳？你应该和阿瑞斯很熟吧，他……我觉得他对倪克斯很感兴趣，他总想让我替他给倪克斯带话。
ThanatosAboutNyxAndAres01|Thanatos About Nyx And Ares 01|Thanatos|终于啊，奥林匹斯的众神也注意到了暗夜之母，注意到了她的成就。
ThanatosAboutNyxAndAres01|Thanatos About Nyx And Ares 01|Zagreus|终于啊？你不觉得阿瑞斯有什么不良企图之类的吗？
ThanatosAboutNyxAndAres01|Thanatos About Nyx And Ares 01|Thanatos|他如果敢打什么主意，那他就是个白痴了。你觉得奥林匹斯山的那些家伙为什么惧怕我们，扎格列欧斯？难道是因为修普诺斯？我觉得暗夜之母倪克斯并不需要你的担心。不过，如果你想聊聊她的话，可以尽管聊。
ThanatosAboutNyxAndChaos01|Thanatos About Nyx And Chaos 01|Thanatos|倪克斯告诉我，你修复了远古印记，扎格列欧斯。我真不敢相信那是你做的，你做的这一切……对她意义重大。
ThanatosAboutNyxAndChaos01|Thanatos About Nyx And Chaos 01|Zagreus|我很荣幸。和我说说吧，倪克斯有没有和你透露过她和卡俄斯之间的关系？
ThanatosAboutNyxAndChaos01|Thanatos About Nyx And Chaos 01|Thanatos|没有，不是所有人都能像你这样消息灵通，扎格。我也没打算去打探，不过……听起来他们发展得还挺顺利。虽然她本人并没说过什么，不过，还是很谢谢你。
ThanatosAboutNyxAndDusa01|Thanatos About Nyx And Dusa 01|Thanatos|看得出来，倪克斯很不开心，而我不打算这种时候问她。所以我想问你，发生了什么事情？
ThanatosAboutNyxAndDusa01|Thanatos About Nyx And Dusa 01|Zagreus|可能是因为我时不时与杜莎聊天，倪克斯觉得不太妥当吧？这么做真的很不合适吗？父亲好像根本都不在乎。
ThanatosAboutNyxAndDusa01|Thanatos About Nyx And Dusa 01|Thanatos|可母亲会在乎呀！我很清楚我们不该质疑母亲的想法，如果不是因为她，我们根本就不会诞生。所以，如果她想让你做什么，你应该按她说的做。
ThanatosAboutNyxAndDusa01|Thanatos About Nyx And Dusa 01|Zagreus|你是想我从今以后不理杜莎吗，就像你一样？
ThanatosAboutNyxAndDusa01|Thanatos About Nyx And Dusa 01|Thanatos|你是个神。我的意思是，你该有神的样子。
ThanatosAboutNyxAndDusa02|Thanatos About Nyx And Dusa 02|Zagreus|很抱歉上次和你发脾气了，塔纳。我知道倪克斯很在乎这个地方，我们很多人也都是由她抚养成人的。
ThanatosAboutNyxAndDusa02|Thanatos About Nyx And Dusa 02|Thanatos|你应该道歉的人不是我，扎格。不过，至于倪克斯，有的时候最好不要去惹她就是了。至于杜莎嘛……我并没有建议你抛弃你的朋友。
ThanatosAboutNyxAndDusa03|Thanatos About Nyx And Dusa 03|Zagreus|倪克斯把她撵走了，塔纳。我是说，杜莎她走了，我该怎么办？
ThanatosAboutNyxAndDusa03|Thanatos About Nyx And Dusa 03|Thanatos|如果换做是我，我会想办法尽快接受这个事实，但我看你并没有这个打算。记住……或许这件事并不是因你而起，有可能是因为杜莎实在是干不完活了。倪克斯确实很严厉，但她也很公正。
ThanatosAboutNyxAndDusa03|Thanatos About Nyx And Dusa 03|Zagreus|那她应该再给杜莎一个机会才对。墨纪听说这件事情了吗？她一定会火冒三丈的。
ThanatosAboutNyxAndDusa03|Thanatos About Nyx And Dusa 03|Thanatos|墨纪拉才不会呢，不是所有人都喜欢质疑上级的每个决定。
ThanatosAboutNyxAndDusa04|Thanatos About Nyx And Dusa 04|Thanatos|我看到杜莎回来了，你肯定是和倪克斯谈好了吧？真不知道你是怎么做到的，我已经不记得上次见到她让步是什么时候了。
ThanatosAboutNyxAndDusa04|Thanatos About Nyx And Dusa 04|Zagreus|倪克斯真的很在乎这座圣殿，在乎我们，她不得不处理这样的事情。杜莎差不多算是我们之中工作最勤奋的人了，但即便如此，她也有进步空间。
ThanatosAboutNyxAndDusa04|Thanatos About Nyx And Dusa 04|Thanatos|一刻不停的努力可能会带来麻烦，扎格列欧斯。我想，这也正是母亲大人如此在意的原因吧。咱们都知道你父亲是个什么样的人，她不需要像杜莎这样的人来照顾他。
ThanatosAboutHypnos01|Thanatos About Hypnos 01|Zagreus|塔纳，你知道吗，修普诺斯，他可喜欢你了。虽然他可能时不时让你觉得崩溃。
ThanatosAboutHypnos01|Thanatos About Hypnos 01|Thanatos|我已经习惯这样了，谢谢你，扎格列欧斯。看样子你很了解他嘛。
ThanatosAboutHypnos01|Thanatos About Hypnos 01|Zagreus|嗯，看样子重复死亡可以让大家的关系更加亲密。
ThanatosAboutHypnos01|Thanatos About Hypnos 01|Thanatos|我不知道哪个更糟，是重复死亡还是修普诺斯。不过，我应该感谢你能够耐心对待他，扎格。
ThanatosAboutHypnos02|Thanatos About Hypnos 02|Zagreus|有些话我想和你说，塔纳。对修普诺斯来说，你是个很重要的人，可有时候你对他太刻薄了！说实话，我能明白你的感受，可……就是太过了。
ThanatosAboutHypnos02|Thanatos About Hypnos 02|Thanatos|他是个彻头彻尾的废物，扎格。要不是母亲倪克斯总是在鞭策他，让他多少有点人样，他连今天这个位置都走不到。
ThanatosAboutHypnos02|Thanatos About Hypnos 02|Zagreus|是啊，可是……如果不是倪克斯的缘故，这里的一切都不会是这个样子，不是吗？总之，我不是想说你应该对他宽厚点，我只想说……肯定有办法可以不闹得这么僵，你们两个可以相处得更和睦。
ThanatosAboutHypnos02|Thanatos About Hypnos 02|Thanatos|我明白，只是……！你说得没错。我每次和他聊完之后，脾气都会变得特别差。他是个自恋的家伙，而且会让人气不打一处来……不过，我猜他的话都是出于好意，大概吧。
ThanatosAboutHypnos03|Thanatos About Hypnos 03|Zagreus|我简直不敢相信，修普诺斯终于打起精神了吗？就连父亲大人似乎都对他很满意，我可真没想过会这样。
ThanatosAboutHypnos03|Thanatos About Hypnos 03|Thanatos|我也不敢相信，扎格列欧斯。但话说回来，他毕竟是倪克斯的儿子，所以我们也不该太惊讶才是。不过，我得感谢你才是，多亏你前一阵子和我说了他的事情……
ThanatosAboutHypnos03|Thanatos About Hypnos 03|Zagreus|哦，是吗？我发现你们两个的关系最近好了不少，你有什么秘诀吗？
ThanatosAboutHypnos03|Thanatos About Hypnos 03|Thanatos|他喜欢工作清单。虽然暗示之类的事情他听不明白，但只要说明白让他去干什么，他就立刻会去做。至少他醒着的时候是这样的，他现在还在努力不打瞌睡。
ThanatosAboutSingersReunionQuestComplete01|Thanatos About Singers Reunion Quest Complete 01|Thanatos|我发现你撕毁了俄耳甫斯和你父亲之间的契约，所以，他现在可以时不时地去见他的妻子了吗？
ThanatosAboutSingersReunionQuestComplete01|Thanatos About Singers Reunion Quest Complete 01|Zagreus|是啊，而且确实是我干的，塔纳。如果他在余下的永生之中能更开心的话，就算少见他几面，我觉得也是可以忍受的。
ThanatosAboutSingersReunionQuestComplete01|Thanatos About Singers Reunion Quest Complete 01|Thanatos|你真的应该学学少管别人的闲事，他们让你帮忙了吗？我听说过他们最后一面的情形。在我看来，我很难想象俄耳甫斯求你帮这个忙，他的妻子当时肯定也百感交集。
ThanatosAboutSingersReunionQuestComplete01|Thanatos About Singers Reunion Quest Complete 01|Zagreus|你在说什么呢？俄耳甫斯是我的伙伴，塔纳，我和他的缪斯女神欧律狄刻也很熟。他们依然彼此相爱，只是没办法交流而已。
ThanatosAboutSingersReunionQuestComplete01|Thanatos About Singers Reunion Quest Complete 01|Thanatos|所以你决定插手这件事，*唉*。我觉得我对事情的考虑方式和你不太一样。我明白你的意图是好的，不过……算了吧，当我没说。
ThanatosAboutQuestLog01|Thanatos About Quest Log 01|Thanatos|我注意到命运小预言清单被包给了圣殿承包商。没想到你还是命运女神的信使呢，扎格列欧斯。
ThanatosAboutQuestLog01|Thanatos About Quest Log 01|Zagreus|我就是这样总能给人带来惊喜，塔纳托斯。不过命运三女神不是你的姐妹吗？我很惊讶你居然没自己申请命运清单。
ThanatosAboutQuestLog01|Thanatos About Quest Log 01|Thanatos|我猜命运不该如此吧，而且她们三个我完全不认识，她们一直独居在某个地方。有的时候我不禁在想：一切真的是早就注定的吗？还是说，这一切都是他们编出来的？
ThanatosRunCleared01|Thanatos Run Cleared 01|Thanatos|你打败了冥王哈迪斯……你真的做到了。我以前从未见过他如此。他从冥河池爬上来时来时我简直不敢相信，那是他本尊……
ThanatosRunCleared01|Thanatos Run Cleared 01|Zagreus|总体来说似乎还算公平。他在某个时候杀死了自己的父母，对吗？我觉得命运喜欢这种相应的发展。
ThanatosRunCleared01|Thanatos Run Cleared 01|Thanatos|哎呀，扎格。该出手时就出手。不过……我觉得你有些事情要处理，我就先不打扰了，希望你能见谅，你自己多保重。
ThanatosAboutStaying01|Thanatos About Staying 01|Thanatos|……你真的要留在这里吗，扎格列欧斯？我是说……你之前总是一次次徒劳无功地想要跑到地面上去。
ThanatosAboutStaying01|Thanatos About Staying 01|Zagreus|是啊，我发现只有这样，我才能趁你工作的时候打扰你。你工作实在是太卖力了，塔纳。享受一下生活，好吗？
ThanatosAboutStaying01|Thanatos About Staying 01|Thanatos|*呵*，好吧，我尽量试试看吧。不过，你得让我看看你说的*“享受一下生活”*是什么意思。
ThanatosAboutPersephoneMeeting02|Thanatos About Persephone Meeting 02|Zagreus|有件事情得告诉你，塔纳。我的生母……她并没有抛弃我，至少……她并没打算那么做。
ThanatosAboutPersephoneMeeting02|Thanatos About Persephone Meeting 02|Thanatos|她并没*打算*那么做？你在说什么呢，扎格？你一生下来她就走了，在那之后再也没人见过她，听说过她的消息，直到你做了这一切为止。
ThanatosAboutPersephoneMeeting02|Thanatos About Persephone Meeting 02|Zagreus|这么说吧……她根本不知道我还活着。我出生的时候出了很多状况，她一直都处于煎熬之中，我猜她已经承受不了了。等到倪克斯把我救活的时候……我的母亲早就走了。
ThanatosAboutPersephoneMeeting02|Thanatos About Persephone Meeting 02|Thanatos|什么？可倪克斯和你的父亲，他们……他们本可以去找她的，让她知道……他们肯定知道她去了哪里！
ThanatosAboutPersephoneMeeting02|Thanatos About Persephone Meeting 02|Zagreus|倪克斯知道。但我父亲肯定说服了她……他们认为我母亲不知情是最好的，那样她就可以过平静的生活，远离这一切。远离奥林匹斯。
ThanatosAboutPersephoneMeeting02|Thanatos About Persephone Meeting 02|Thanatos|这可真是……复杂啊。
ThanatosAboutRelationship01|Thanatos About Relationship 01|Thanatos|……回答我一个问题吧，扎格列欧斯？对你而言，我究竟是什么样的人呢？因为有的时候，我和你在一起，我……
ThanatosAboutRelationship01|Thanatos About Relationship 01|Zagreus|有的时候我自己也不清楚，塔纳托斯。不过有件事情我很清楚，能见到你我总是很高兴。这么说吧……呃，和你讨论各种事情很有意思！而且我知道，只要来这里就能见到你了。
ThanatosAboutRelationship01|Thanatos About Relationship 01|Thanatos|是啊，我就在这里。虽然你还没回答我的问题。不过，怎么说好呢？就当我没问过吧，我得走了。
ThanatosAboutRelationship02|Thanatos About Relationship 02|Zagreus|嘿，塔纳，抱歉问你这样一个蠢问题，不过和我说说吧……我们还是朋友吧？我是说……我们两个之间。我有没有什么让你讨厌的习惯，或者类似的东西？
ThanatosAboutRelationship02|Thanatos About Relationship 02|Thanatos|说真的，你那些让我讨厌的习惯，我恐怕根本列举不过来，扎格列欧斯。不过……如果有什么事情让我觉得受不了的话，我会告诉你的，好吗？
ThanatosAboutRelationship02|Thanatos About Relationship 02|Zagreus|好了，那我们就还是朋友。我知道我们一直是朋友，但我只是想确认一下。
ThanatosAboutRelationship02|Thanatos About Relationship 02|Thanatos|我们是朋友，下次再见，好吗？
ThanatosAboutRelationship03|Thanatos About Relationship 03|Thanatos|……你的变化真是让我刮目相看，扎格。我还记得你打算把刻耳柏洛斯的尾巴缠在脚上时的样子呢，已经好久没见过你这么做了。
ThanatosAboutRelationship03|Thanatos About Relationship 03|Zagreus|哦，当然了，我已经尝到教训了。不过，谢谢你这么说。顺便一提，你和以前相比也开朗了不少。你现在的样子，和我第一次见你的时候简直判若两人。那个时候，你简直像是要把我脑袋砍下来一样。
ThanatosAboutRelationship03|Thanatos About Relationship 03|Thanatos|那你跑过来告诉我，说我剪了头发就变难看了，肯定下了很大决心吧。我现在还在想，我当时怎么就不能无视你呢？怎么就没把你脑袋砍下来呢？
ThanatosAboutRelationship03|Thanatos About Relationship 03|Zagreus|哎，我猜你现在也随时可以这么做吧。嘿，你有没有想过再把头发留起来？
ThanatosAboutRelationship03|Thanatos About Relationship 03|Thanatos|没有，头发长了总是碍事，剪了就没去在乎了。就……我们都长大了，对吧？
ThanatosAfterPersephoneMeeting03|Thanatos After Persephone Meeting 03|Thanatos|你和你母亲一切都还好吗，扎格列欧斯？这件事情你都没怎么提过了，没出什么问题吧？有什么事情都可以告诉我。
ThanatosAfterPersephoneMeeting03|Thanatos After Persephone Meeting 03|Zagreus|谢谢你的询问，塔纳。发生了这么多事情，我也不知道该说什么好了，我还在想该怎么办才好。我很感谢你时不时地帮我去见她一面。
ThanatosAfterPersephoneMeeting03|Thanatos After Persephone Meeting 03|Thanatos|嗯，如果有什么其它事情可以帮你的话，和我说一声，好吗？看起来，你至少不算是毫无进展。
ThanatosPostEnding01|Thanatos Post Ending 01|Thanatos|想私下和你聊聊……你打算一遍一遍地逃出这个地方。你的行为已经得到正式批准了吗？寻找冥界安保系统的弱点，嗯。
ThanatosPostEnding01|Thanatos Post Ending 01|Zagreus|差不多就是这样吧。这个地方宣称绝对逃不出去，但我已经是逃出这个地方的行家了。我打算和另一边的家人保持联系，时不时地和你一起共事。
ThanatosPostEnding01|Thanatos Post Ending 01|Thanatos|不得不说，我从来没想到会听你说出想工作这种话，扎格。你还好吧？你是不是在地上世界待了太久了？
ThanatosPostEnding01|Thanatos Post Ending 01|Zagreus|哦，我挺好的。我一直以为自己没什么长处，不过……如果我命中注定要和我父亲过不去，成为这方面的行家，好让一切尽善尽美的话，那我觉得我是能接受的。
ThanatosPostEnding01|Thanatos Post Ending 01|Thanatos|很好，我很期待能以更正式的身份与你合作。不过出于面子问题，所有的事情还是必须得保密。那就下次见吧。
ThanatosPostEnding02|Thanatos Post Ending 02|Thanatos|有件事情我得和你说，扎格。你的母亲来了之后，这里一切都不一样了。我不想把话说得这么直，不过……我猜是你的父亲变了。
ThanatosPostEnding02|Thanatos Post Ending 02|Zagreus|我猜他们还有很多事情要做呢，只要他们还愿意努力……他还愿意努力……我觉得现在挺好的，我很高兴她能在这里。
ThanatosPostEnding02|Thanatos Post Ending 02|Thanatos|我觉得所有人都很高兴有她在。另外，希望你别误会了我的意思，不过……我觉得你和你父亲之间也有很多要做的事情。
ThanatosPostEpilogue01|Thanatos Post Epilogue 01|Thanatos|你的母亲非常聪明，扎格列欧斯。我一直以为你的聪明劲儿是从你父亲这里来的，但我现在没那么肯定了。所以，和奥林匹斯众神又重归于好了，是吗？
ThanatosPostEpilogue01|Thanatos Post Epilogue 01|Zagreus|我觉得目前是这样。不过，我猜你也知道他们是什么脾气，我们所有人是什么脾气。
ThanatosPostEpilogue01|Thanatos Post Epilogue 01|Thanatos|*哈*！是啊，没错！我猜，就像凡人们说的那样，及时行乐吧。下次见了。
ThanatosWithHades01|Duo - Thanatos and Hades (1)|Hades|你兄弟可能经常会迟到，但是你不一样，塔纳托斯。你可以说是守时之神。
ThanatosWithHades01|Duo - Thanatos and Hades (1)|Thanatos|大人，对于我犯下的迟到错误，我深表歉意。我认为我最近跟进观察的凡间战争，其中的消耗远超我的预期。
ThanatosWithHades01|Duo - Thanatos and Hades (1)|Hades|塔纳托斯，就算是神也需要时不时休息一下。总有一天我们会让事情正常运转起来，只要等这该死的圣殿修整好。在那之前，我需要你继续努力。但不要累着自己了。
ThanatosWithHades01|Duo - Thanatos and Hades (1)|Thanatos|谢谢您，大人。随时为您效劳。我现在回去工作了。
ThanatosWithHades03|Duo - Thanatos and Hades (3)|Hades|塔纳托斯，我知道你一直在教唆他。背着我！这是背叛。我想知道为什么。好吧？
ThanatosWithHades03|Duo - Thanatos and Hades (3)|Thanatos|大人，他和我……拜托。把我关在塔耳塔罗斯吧，或者给我安上你觉得合适的罪名，可……我的忠诚永远不会变。在你们战斗的时候袖手旁观，我做不到。你和扎格列欧斯之间的事情……总要找到解决的方法才是。
ThanatosWithHades03|Duo - Thanatos and Hades (3)|Hades|你竟敢教训起我来了？啧。对我忠诚的属下怕是越来越少了。这是*你的*地盘，不是我的；我不会把你丢进那可怕的深渊。再说，没有任何人可以取代你。你退下吧。
ThanatosWithHades03|Duo - Thanatos and Hades (3)|Thanatos|非常抱歉，大人……
ThanatosWithHades04|Duo - Thanatos and Hades (4)|Thanatos|您又想见我一面了吗，大人？从上次见您到现在，已经……过了很久了。
ThanatosWithHades04|Duo - Thanatos and Hades (4)|Hades|是啊，我们上次见面的时候你说什么来着？你说，关于我儿子的*事情*，肯定能找到解决方法，是吧？现在看来，问题已经解决了。是吧，孩子？
ThanatosWithHades04|Duo - Thanatos and Hades (4)|Zagreus|我是想说，你依然和以前一样，尽你所能地阻止我逃出你的王国。所以，我也不知道这能不能算是事情都*解决*了，不过……现在的感觉确实和以前不一样了。
ThanatosWithHades04|Duo - Thanatos and Hades (4)|Hades|如你所见……如果你愿意的话，我将继续维持我们共同的利益。这座圣殿只有在高层管理人员达成一致的情况下才能正常运作，你说呢？
ThanatosWithHades04|Duo - Thanatos and Hades (4)|Thanatos|您的话让我不胜荣幸，大人。我很感谢您能亲口告诉我这些话。我也同意您的看法，为了整个冥界的利益，我们每个人都必须继续全力以赴。
ThanatosWithHades04|Duo - Thanatos and Hades (4)|Hades|很好，你一向如此，你可以退下了。
ThanatosWithHypnos01|Duo - Thanatos and Hypnos (1)|Thanatos|修普诺斯，真的，这是我听过最蠢的主意。你知不知道这有多不靠谱？
ThanatosWithHypnos01|Duo - Thanatos and Hypnos (1)|Hypnos|我就是说说，如果你可以，我是说，让所有凡人全部一起死了，那你可不就省不少力气，然后我们就有更多时间在一起了，对不对？
ThanatosWithHypnos01|Duo - Thanatos and Hypnos (1)|Thanatos|我真不知道我怎么会跟你谈这个。我们都回去工作去吧。
ThanatosWithHypnos02|Duo - Thanatos and Hypnos (2)|Thanatos|你真的不能在工作的时候像这样打瞌睡了，修普诺斯。你这样真的不行。
ThanatosWithHypnos02|Duo - Thanatos and Hypnos (2)|Hypnos|我只是稍微打个盹儿而已，塔纳托斯！因为你在这里我才这么容易睡着！如果我真的犯蠢了，我想你应该可以直接把我给杀了之类的，对吧？
ThanatosWithHypnos02|Duo - Thanatos and Hypnos (2)|Thanatos|你可别帮我出主意。打起精神来，别偷懒了。这圣殿需要帮忙，你也有工作要做，开始做事吧！
