Id|Description|Speaker|Text
ThanatosWithHypnos03|Duo - Thanatos and Hypnos (3)|Thanatos|………修普诺斯，这份清单上有很多任务我都不知道是多久以前的了，我是说……上面有几件事已经是我去年干过的了！而且你已经做好了这个星期的登记工作，为什么不把它划掉呢？
ThanatosWithHypnos03|Duo - Thanatos and Hypnos (3)|Hypnos|这么说吧，我刚准备把它划掉！然后你就来了，我就分心了，然后我就把这件事给忘了！这种事情也是难免的，是吧？
ThanatosWithHypnos03|Duo - Thanatos and Hypnos (3)|Thanatos|你得专心点才行，兄弟，否则冥王哈迪斯就又要骂你了。我相信你可不想挨骂。
ThanatosWithHypnos03|Duo - Thanatos and Hypnos (3)|Hypnos|哦，这我可说不准。因为我上次去见冥王大人的时候，他已经说得*很清楚了*，他说他再也不想和我说话了！
ThanatosWithHypnos04|Duo - Thanatos and Hypnos (4)|Thanatos|修普诺斯，你并不是必不可少的人物，你是明白的吧？如果你不赶紧打起精神来，你的工作就要被别人抢走了。
ThanatosWithHypnos04|Duo - Thanatos and Hypnos (4)|Hypnos|哦，我听得很清楚，塔纳托斯！我告诉你吧，要是真的有人来替我了，他就可以干*整个冥界最有意思的工作了*！
ThanatosWithHypnos04|Duo - Thanatos and Hypnos (4)|Thanatos|我觉得我的话你一点都没听进去，兄弟。好吧，等到时候麻烦来了的话，可别怪我没警告过你。
ThanatosWithHypnos05|Duo - Thanatos and Hypnos (5)|Thanatos|……我想问，你花在检查清单上面的时间有多少？如果你总是花很多时间来看清单的话，那你根本没时间去做事情。
ThanatosWithHypnos05|Duo - Thanatos and Hypnos (5)|Hypnos|哦，我*就是喜欢*列清单……我总会阐述这些事项，每个事项都是*独一无二*的！这样别人在检查成果的时候，就会明白每件事的*来龙去脉*了，是吧？不过……我猜这确实耽误了不少时间。
ThanatosWithHypnos05|Duo - Thanatos and Hypnos (5)|Thanatos|您必须得想办法做好你分内的事情。你时不时会休息一下，是吧？或许在每次休息前后，你应该确保你自己做事的优先列表都有好好更新过。
ThanatosWithHypnos05|Duo - Thanatos and Hypnos (5)|Hypnos|等等，我自己的优先事项列表吗……？你指的是，我可以列一个……我自己的列表吗？呃，哇啊，*哇哦*……
ThanatosWithHypnos06|Duo - Thanatos and Hypnos (6)|Thanatos|我听说你最近的工作汇报非常出色，修普诺斯。你必须告诉我，到底是谁在帮你？肯定不是扎格列欧斯吧。
ThanatosWithHypnos06|Duo - Thanatos and Hypnos (6)|Hypnos|哦，*哈哈*，不是，他可没帮忙。我只是列了个列表，把重要的事情排在了前面，花更多时间在优先度比较高的报告上，结果……你看，就做得很好！
ThanatosWithHypnos06|Duo - Thanatos and Hypnos (6)|Thanatos|听着，虽然我不知道是怎么回事……但你工作成效提高了，大家也都看在眼里。你得坚持下去。
ThanatosWithHypnos07|Duo - Thanatos and Hypnos (7)|Thanatos|……不过，我想说的是……我很抱歉，修普诺斯。你是我的兄弟，但我一直以来都没把你当成过兄弟，你可以原谅我吗？
ThanatosWithHypnos07|Duo - Thanatos and Hypnos (7)|Hypnos|哎哟，别这样，塔纳托斯，你是在和我开玩笑吧？我们简直是穿一条裤子的好兄弟！你是我最出色的兄弟，也一直都在好好照顾我。就算你已经不知多长时间没来找过我了，我也这么觉得！
ThanatosWithHypnos07|Duo - Thanatos and Hypnos (7)|Thanatos|嗯，咱们还是先别说得太远了吧。咱们都有重要的事情要做，是这样吧，兄弟？
ThanatosWithHypnos08|Duo - Thanatos and Hypnos (8)|Thanatos|……恭喜你，兄弟！我注意到你终于改头换面了，我们都为你感到骄傲。
ThanatosWithHypnos08|Duo - Thanatos and Hypnos (8)|Hypnos|没错！我还真厉害，是吧？不过抱歉，塔纳托斯，我现在没时间聊天。幽灵们一直在涌过来，我得一个一个接待他们，帮他们登记……有很多工作要做，你明白的吧？
ThanatosWithHypnos08|Duo - Thanatos and Hypnos (8)|Thanatos|我很明白这种感觉。好吧，那我们两个都保持住这种劲头，好吗？
ThanatosWithNyx01|Duo - Thanatos and Nyx (1)|Thanatos|母亲，发生了这些事情，我能帮上什么忙吗？我离开圣殿太久了，还请您示下。
ThanatosWithNyx01|Duo - Thanatos and Nyx (1)|Nyx|你已经帮了不少忙了，我的孩子。继续这样做就好了。目前正是紧要关头，你的支持和选择将会影响事情的结果。
ThanatosWithNyx01|Duo - Thanatos and Nyx (1)|Thanatos|明白了，我会全力以赴的。谢谢您对所有事情的关照。母亲，我相信您，相信这座圣殿。再见了。
ThanatosWithNyx02|Duo - Thanatos and Nyx (2)|Thanatos|是我的错觉吗，母亲？还是说，这座圣殿里的气氛确实变得缓和了？虽然我明白，我这么说会让命运三女神情不自禁地想插手。
ThanatosWithNyx02|Duo - Thanatos and Nyx (2)|Nyx|是所有人的共同努力，才让这座圣殿欣欣向荣的，至少目前如此。不过，只有你和这里的很多其他人持之以恒地努力工作，才能让这个势头维持下去。这种时候很适合稍微休息一番，但我们这里依然需要你尽最大的努力才行，塔纳托斯。
ThanatosWithNyx02|Duo - Thanatos and Nyx (2)|Thanatos|我明白……希望你知道，我永远感激你，母亲，我也非常爱你。要不是你，我们现在会在什么地方呢？你为我们所做的一切，我都不会当做理所当然，这里的其他人也不会这么想。请你放心吧。
ThanatosWithMegaera01|Duo - Thanatos and Megaera (1)|Megaera|……但此一时彼一时，我们还有事情要做……啊，好了，塔纳，我们最好再找时间讨论这个话题。
ThanatosWithMegaera01|Duo - Thanatos and Megaera (1)|Thanatos|你打断了私人谈话，扎格列欧斯。走开。
ThanatosWithMegaera01|Duo - Thanatos and Megaera (1)|Megaera|不，如果他想留下的话，就让他留下。有什么不妥吗？他本来就可以在这里自由出入，但是他要知道，他早已经不受欢迎了。
ThanatosWithPersephone01|Duo - Thanatos and Persephone (1)|Thanatos|珀尔塞福涅冥后，我们所有人都很高兴您能回来。如果有什么可以帮助您适应这座神殿的话，您尽管开口。
ThanatosWithPersephone01|Duo - Thanatos and Persephone (1)|Persephone|哦，谢谢你，塔纳托斯！如果有什么事情需要你帮忙的话，我会向你开口的。不过，天啊，你都长这么大了！我猜，这段时间里，你肯定一直都在照顾我的儿子吧？
ThanatosWithPersephone01|Duo - Thanatos and Persephone (1)|Thanatos|您的儿子，他……看起来很擅长照顾自己。不过我也会在他身边，以防万一。不过请允许我先行告退，冥后，地面上还有一些事情在等着我处理。
ThanatosWithPersephone02|Duo - Thanatos and Persephone (2)|Thanatos|……谢谢您的祝福，珀尔塞福涅冥后。您的儿子和我……我们的关系一直都很亲密。不过一起经历了这些磨难之后，我觉得，我们的感情已经变得密不可分了。
ThanatosWithPersephone02|Duo - Thanatos and Persephone (2)|Persephone|是吗，看得出来，他比我挑人的品味可好多了，塔纳托斯！我感觉得到你是多么勤奋的人。希望你能照顾好自己，也希望你们两个都能照顾好对方，好吗？
ThanatosWithPersephone02|Duo - Thanatos and Persephone (2)|Thanatos|如您所愿，冥后。我是说，没问题。
ThanatosHomeChat01|Thanatos Home Chat 01|Thanatos|不好意思，扎格列欧斯，我得走了。最近工作特别忙。我是真的分身乏术啊。
ThanatosHomeChat02|Thanatos Home Chat 02|Thanatos|闲聊是最没用的，对吧，扎格列欧斯？
ThanatosHomeChat03|Thanatos Home Chat 03|Thanatos|我有工作要做，没兴趣跟你说话。我们外头见。
ThanatosHomeChat04|Thanatos Home Chat 04|Thanatos|没事，扎格列欧斯。我正要离开。
ThanatosHomeChat05|Thanatos Home Chat 05|Thanatos|看在我俩的份上，我希望你已经想明白这些事情了。
ThanatosHomeChat06|Thanatos Home Chat 06|Thanatos|我不可能每次都帮你摆脱困境。
ThanatosHomeChat07|Thanatos Home Chat 07|Thanatos|我得说，你确实让自己陷入了不小的麻烦，扎格列欧斯。
ThanatosHomeChat08|Thanatos Home Chat 08|Thanatos|你最好知道你在做什么。
ThanatosHomeChat09|Thanatos Home Chat 09|Thanatos|你在浪费时间。走吧。
ThanatosHomeChat10|Thanatos Home Chat 10|Thanatos|你不是应该去外面，让自己死上几次吗？
ThanatosHomeChat11|Thanatos Home Chat 11|Thanatos|你知道我现在有多少麻烦要处理吗？
ThanatosHomeChat12|Thanatos Home Chat 12|Thanatos|我们现在没什么好说的。
ThanatosHomeChat13|Thanatos Home Chat 13|Thanatos|别说话。走。
ThanatosHomeChat14|Thanatos Home Chat 14|Thanatos|不好意思，我有事。
ThanatosHomeChat15|Thanatos Home Chat 15|Thanatos|现在不行，我得走了。
ThanatosHomeChat16|Thanatos Home Chat 16|Thanatos|我不知道你想要我干什么。
ThanatosHomeChat17|Thanatos Home Chat 17|Thanatos|我得继续工作了。
ThanatosHomeChat18|Thanatos Home Chat 18|Thanatos|你真是麻烦不断啊。
ThanatosHomeChat19|Thanatos Home Chat 19|Thanatos|你在外头注意安全。
ThanatosHomeChat20|Thanatos Home Chat 20|Thanatos|你自己保重。
ThanatosHomeChat21|Thanatos Home Chat 21|Thanatos|我想，我们外头再见吧。
ThanatosHomeChat22|Thanatos Home Chat 22|Thanatos|我希望这一切都值得。
ThanatosHomeChat23|Thanatos Home Chat 23|Thanatos|我们会在外头再见的。
ThanatosHomeChat24|Thanatos Home Chat 24|Thanatos|我希望你知道自己在做什么。
ThanatosHomeChat25|Thanatos Home Chat 25|Thanatos|现在不行，我要工作。
ThanatosHomeChat26|Thanatos Home Chat 26|Thanatos|我得工作了，回头见。
ThanatosHomeChat27|Thanatos Home Chat 27|Thanatos|你父亲会找我麻烦的。
ThanatosHomeChat28|Thanatos Home Chat 28|Thanatos|你是真不知道我有多少麻烦要处理…
ThanatosHomeChat29|Thanatos Home Chat 29|Thanatos|我到底让自己怎么了，扎格…
ThanatosHomeMaxChat01|Thanatos Home Max Chat 01|Thanatos|尽管我很想留下来聊聊天，但我还是走吧。
ThanatosHomeMaxChat02|Thanatos Home Max Chat 02|Thanatos|扎格，现在我手头上有好多凡人……
ThanatosHomeMaxChat03|Thanatos Home Max Chat 03|Thanatos|我们外面见，好吗？
ThanatosHomeMaxChat04|Thanatos Home Max Chat 04|Thanatos|如果你在外面太长时间，我就去把你抓回来。
ThanatosHomeMaxChat05|Thanatos Home Max Chat 05|Thanatos|听起来我们最近都很忙。
ThanatosHomeMaxChat06|Thanatos Home Max Chat 06|Thanatos|既然你来了，我终于可以出去了。
ThanatosHomeMaxChat07|Thanatos Home Max Chat 07|Thanatos|我们改天再找时间好好聊吧。
ThanatosHomeMaxChat08|Thanatos Home Max Chat 08|Thanatos|对不起，扎格。我现在要去多抓些凡人了。
ThanatosHomeMaxChat09|Thanatos Home Max Chat 09|Thanatos|不好意思，扎格，刚刚得到消息，上面需要我。
ThanatosHomeMaxChat10|Thanatos Home Max Chat 10|Thanatos|希望你的父亲可以好好处理这些事。
ThanatosHomeMaxChat11|Thanatos Home Max Chat 11|Thanatos|我们上次不是教训过那些暗灵吗？
ThanatosHomeMaxChat12|Thanatos Home Max Chat 12|Thanatos|很高兴能在外面遇到你，很高兴你成功了。
ThanatosHomeMaxChat13|Thanatos Home Max Chat 13|Thanatos|你可以再次走得这么远，太让我钦佩了。
ThanatosHomeMaxChat14|Thanatos Home Max Chat 14|Thanatos|能有机会在外面为你提供支援，我很高兴。
ThanatosHomeMaxChat15|Thanatos Home Max Chat 15|Thanatos|我听说你上次在外面干得不错。
ThanatosHomeMaxChat16|Thanatos Home Max Chat 16|Thanatos|暗灵都在私下流传着你最近的功绩，扎格。
ThanatosHomeMaxChat17|Thanatos Home Max Chat 17|Thanatos|我现在没时间和你在这里叙旧，扎格。
ThanatosHomeIntermissionChat01|Thanatos Home Intermission Chat 01|Thanatos|你不赶时间吧，扎格？
ThanatosHomeIntermissionChat01|Thanatos Home Intermission Chat 01|Thanatos|那么……上面有些凡人活得很好，寿命很长。
ThanatosHomeIntermissionChat02|Thanatos Home Intermission Chat 02|Thanatos|介意我展现一下和其他人一起瞬移的本事吗？
ThanatosHomeIntermissionChat02|Thanatos Home Intermission Chat 02|Thanatos|嗯…我自己觉得这次试验很成功，你说呢？
ThanatosHomeIntermissionChat03|Thanatos Home Intermission Chat 03|Thanatos|我要瞬移离开这里，你想和我一起吗……
ThanatosHomeIntermissionChat03|Thanatos Home Intermission Chat 03|Thanatos|糟糕，我没办法把你瞬移到上面去，其实也没那么糟糕。
ThanatosHomeIntermissionChat04|Thanatos Home Intermission Chat 04|Thanatos|嘿，我们离开这里一会儿，好吗？
ThanatosHomeIntermissionChat04|Thanatos Home Intermission Chat 04|Thanatos|呼。谢谢你给我这个休息的机会，现在继续吧。
ThanatosHomeIntermissionChat05|Thanatos Home Intermission Chat 05|Thanatos|我正要休息，如果你愿意和我一起的话。
ThanatosHomeIntermissionChat05|Thanatos Home Intermission Chat 05|Thanatos|很高兴和你叙叙旧。你自己保重，扎格。
ThanatosHomeIntermissionChat06|Thanatos Home Intermission Chat 06|Thanatos|我觉得你最好还是回自己住处，扎格列欧斯。
ThanatosHomeIntermissionChat06|Thanatos Home Intermission Chat 06|Thanatos|唔。我现在最好重新肩负起自己的责任。
ThanatosChatWithMegaera01|Duo - Chat and Megaera (1)|Megaera|这是私人谈话，你可以回避一下吗，扎格？
ThanatosChatWithMegaera01|Duo - Chat and Megaera (1)|Thanatos|我们外面见，扎格列欧斯。
ThanatosChatWithMegaera02|Duo - Chat and Megaera (2)|Thanatos|刚刚和墨纪拉在这里叙旧呢，扎格。
ThanatosChatWithMegaera02|Duo - Chat and Megaera (2)|Megaera|我们还谈到你了，扎格列欧斯。
ThanatosChatWithMegaera03|Duo - Chat and Megaera (3)|Megaera|谁让她是我们俩共同的好朋友呢。
ThanatosChatWithMegaera03|Duo - Chat and Megaera (3)|Thanatos|和我们一起享受祥和宁静吧，扎格。
ThanatosChatWithMegaera04|Duo - Chat and Megaera (4)|Megaera|如果你不介意的话，我刚才和塔纳托斯聊了一会儿。
ThanatosChatWithMegaera04|Duo - Chat and Megaera (4)|Thanatos|我们在讨论和工作有关的事情，扎格列欧斯。
ThanatosChatWithMegaera05|Duo - Chat and Megaera (5)|Megaera|看看那是谁，塔纳。扎格列欧斯。
ThanatosChatWithMegaera05|Duo - Chat and Megaera (5)|Thanatos|我们就最近的任务交换了一些想法。
ThanatosChatWithHypnos01|Duo - Chat and Hypnos (1)|Thanatos|……看起来你已经把一切都办好了。干得漂亮，修普诺斯。
ThanatosChatWithHypnos02|Duo - Chat and Hypnos (2)|Thanatos|……等你把事情忙完之后，就有很多时间可以睡觉了。是吧，兄弟？
ThanatosChatWithHypnos03|Duo - Chat and Hypnos (3)|Thanatos|……我听说你最近的表现很不错，修普诺斯，再接再厉。
ThanatosChatWithHypnos04|Duo - Chat and Hypnos (4)|Thanatos|……总之，你很有进步，修普诺斯。
ThanatosChatWithHypnos05|Duo - Chat and Hypnos (5)|Thanatos|……新来的就是这些了，不过我很快会带另一批人来。
ThanatosChatWithHypnos06|Duo - Chat and Hypnos (6)|Thanatos|……好了，我得出发了。多保重，兄弟。
ThanatosChatWithNyx01|Duo - Chat and Nyx (1)|Nyx|……我们有另一个任务要交给你。
ThanatosChatWithNyx01|Duo - Chat and Nyx (1)|Thanatos|如您所愿，母亲，我会立刻把这件事情办好。
ThanatosChatWithNyx02|Duo - Chat and Nyx (2)|Thanatos|……我明白了，母亲，我马上着手去办。
ThanatosChatWithNyx03|Duo - Chat and Nyx (3)|Nyx|……我们又需要你的专业技术了。
ThanatosChatWithNyx03|Duo - Chat and Nyx (3)|Thanatos|好的，了解了，母亲。我马上动身，很快就能回来。
ThanatosChatWithNyx04|Duo - Chat and Nyx (4)|Thanatos|……我愿按照您的意思行事，母亲。等事情做好了，我就回来。
ThanatosChatWithNyx05|Duo - Chat and Nyx (5)|Thanatos|谢谢您考虑我来做这件事情，我会尽快把事情办好。
ThanatosChatWithNyx06|Duo - Chat and Nyx (6)|Thanatos|……我清楚了，母亲。我要走了，您吩咐的事情会做好的。
ThanatosChatWithHades01|Duo - Chat and Hades (1)|Thanatos|……如您所愿，大人，我很快就会向您禀报。
ThanatosChatWithHades02|Duo - Chat and Hades (2)|Thanatos|……没问题，大人。我立刻去办，事情办好之前是不会回来的。
ThanatosChatWithHades03|Duo - Chat and Hades (3)|Thanatos|……如果就是这样，大人，那我立刻前往地上世界。
ThanatosChatWithHades04|Duo - Chat and Hades (4)|Thanatos|……我明白了，大人。我知道他们在哪，马上就把他们带回来。
ThanatosChatWithHades05|Duo - Chat and Hades (5)|Thanatos|……很感谢您的信任，大人，请容我告退。
ThanatosChatWithHades06|Duo - Chat and Hades (6)|Thanatos|……这件事情我会妥善处理的，大人，我马上就回来。
ThanatosGift01|Thanatos Gift 01|Zagreus|虽然不是很多，塔纳，但是我有东西要给你。
ThanatosGift01|Thanatos Gift 01|Thanatos|你想让我从你手上拿走吗，行。但是你得从我这里接受这个，这样别人问的时候就知道，我俩都不欠谁的。或者，别这样，谁也别告诉，知道吗？
ThanatosGift02|Thanatos Gift 02|Thanatos|什么，真的…？不是吧，这是什么，扎格列欧斯。你觉得把这个给我就能弥补你一直以来给我们找的麻烦吗？
ThanatosGift02|Thanatos Gift 02|Zagreus|只不过是我在外面找到的东西，我想你可能会喜欢的，塔纳。可别想多了。
ThanatosGift03|Thanatos Gift 03|Thanatos|为何要做这种没有意义的事情，扎格。你既然说你要离开这里，那就好好去做，别管我。
ThanatosGift03|Thanatos Gift 03|Zagreus|这可不是没意义，塔纳。另外，如果我不是好好做我自己的事，我早就把它喝了。
ThanatosGift04|Thanatos Gift 04|Thanatos|你真的不用这样做，扎格。既然你站了边，事情就不一样了。解决那样的问题一定费了你不少心思。
ThanatosGift04|Thanatos Gift 04|Zagreus|我们经历了很多，塔纳，我觉得以后还要经历更多事。就把他当作是我们亲情的象征吧。
ThanatosGift04_B|Thanatos Gift 04 B|Thanatos|我不知道你在想什么，才把这个东西给我。如果你在打什么主意的话，我可不想知道。
ThanatosGift05|Thanatos Gift 05|Thanatos|最近怎么这么大方了…？如果你除了把这东西给我以外，没其他可做的，那我就只好把这些东西都存起来了。
ThanatosGift05|Thanatos Gift 05|Zagreus|这主意不错。总有一天，我们会有足够多的这些东西，全拿出来摆宴席，羡煞奥林匹斯众神。
ThanatosGift06|Thanatos Gift 06|Thanatos|你没开玩笑吧…你认真的…？*呃*还是算了，我收下这个，然后我们就各干各事去吧。但我还是不明白你为何这样。
ThanatosGift06|Thanatos Gift 06|Zagreus|为何？除了时不时给你带来这些东西之外，我还能怎样表达自己的心情呢？
ThanatosGift07_A|Thanatos Gift 07 A|Zagreus|嘿，塔纳。每次都是你救我出来，每次你总是守护在我身边……我只能给你这个。货真价实的好东西。
ThanatosGift07_A|Thanatos Gift 07 A|Thanatos|是仙馔密酒……！扎格列欧斯，你是从哪里……你不觉得这有点太奢侈了吗？
ThanatosGift07_A|Thanatos Gift 07 A|Zagreus|你的口气就好像它不是什么好东西一样。偶尔奢侈一下是不会有什么坏处的，我向你保证。
ThanatosGift07_A|Thanatos Gift 07 A|Thanatos|哦，我会让你大吃一惊的。虽然让你这么破费，不过我也会给你一份回礼，好好看着吧！
ThanatosGift08|Thanatos Gift 08|Zagreus|这是给你的，塔纳托斯。奥林匹斯的众神可能已经喝惯了这种东西，不过我觉得，我们也应该尝尝才对，至少你应该尝尝。
ThanatosGift08|Thanatos Gift 08|Thanatos|不得不说……奥林匹斯的众神在这方面很有眼光。你之前给的我那瓶蜜酒……味道比我想象得还要好。不过，我已经差不多下定决心要戒酒了。
ThanatosGift08|Thanatos Gift 08|Zagreus|再喝一口嘛！再尝一口，就当是比较一下味道吧。你知道吧，每一瓶蜜酒的味道都不一样。
ThanatosGift08|Thanatos Gift 08|Thanatos|不一样吗，哈，好吧，那我就试试你说的“不一样”是什么意思吧。谢谢你，扎格，你真不用这么破费。
ThanatosGift09|Thanatos Gift 09|Zagreus|我希望你能够找到货真价实的东西，塔纳，因为我可以给你一些，而且我保证你在看到以后不会做出*“啧，这是什么，扎格”*这样的反应。
ThanatosGift09|Thanatos Gift 09|Thanatos|啊，这是什么？拜托，扎格列欧斯，你是在和我捣乱吗？如果你刚刚得到什么好东西，怎么可能就这么草率地决定送给我？
ThanatosGift09|Thanatos Gift 09|Zagreus|为了……哦，不，这是我在不停洗劫我的父亲的地盘时找到的，而且因为我喜欢你，塔纳托斯。如果还有疑虑，那真的是大可不必。
ThanatosGift09|Thanatos Gift 09|Thanatos|你*喜欢*我，扎格列欧斯……？我从来没想过这种事情，我……不知道为什么，这句话从你嘴里说出来很奇怪，尤其是考虑到最近发生的事情。
ThanatosGift09|Thanatos Gift 09|Zagreus|是吗。现在的情况是，如果你对我并没有相同的感觉，就让我知道你的真实想法。不要再这样扭扭捏捏地交换什么礼物了。
ThanatosGift09|Thanatos Gift 09|Thanatos|我从来没说过这样的话！你知道吗，还有很多凡人……等着我去抓。再见。
ThanatosGift10|Thanatos Gift 10|Zagreus|塔纳托斯，我想为上次给你的那瓶所谓的货真价实的东西道歉，要不我们再交换一次礼物吧。可以吗？
ThanatosGift10|Thanatos Gift 10|Thanatos|*唔*！你在征求我的同意，要给我一件很好的礼物吗？行！我答应你了。不过，是什么让你这么有信心这次会比上次更加成功呢？
ThanatosGift10|Thanatos Gift 10|Zagreus|我也没把握。我根本不知道自己在你心中的位置。但我很清楚自己的感受，所以我宁愿和你直说，即使冒着和你的关系破裂的风险，就像现在这样。
ThanatosGift10|Thanatos Gift 10|Thanatos|我们的关系？如果你不记得了，让我来提醒你。不久前为了回到阳间，你还把它抛在脑后。而现在，你竟然说你在乎我，你……究竟要干什么，扎格列欧斯？
ThanatosGift10|Thanatos Gift 10|Zagreus|是的，我真的在乎你，塔纳。我不应该不辞而别。但就在你找到我的时候，我……就是那个时候……那个时候我才明白，或者开始意识到，你懂我的意思吗？
ThanatosGift10|Thanatos Gift 10|Thanatos|我……知道。我知道，因为……当时听说你走了，我心里非常气恼……自己都控制不了。所以……*呃*。那我们现在怎么办？
ThanatosGift10|Thanatos Gift 10|Zagreus|也许我们应该慢慢来？不像那个所谓货真价实的东西，它只不过是件随处可见的商品罢了。别忘了……如果你和我有同样的感受……你就会知道在哪里可以找到我。如果没有……我还是很感激。
ThanatosGift10|Thanatos Gift 10|Thanatos|……我知道了。好吧……我现在可以说的，也只有感激而已。你自己保重，扎格。
ThanatosGift07|Thanatos Gift 07|Thanatos|我一定要把这个给你，扎格，你为了让我能原谅你做过的事，可真是下了番工夫啊。说真的，我很吃惊。
ThanatosGift07|Thanatos Gift 07|Zagreus|不用不用。你说的那宴席，一定能成，塔纳。
ThanatosFirstAppearance|Thanatos First Appearance|Thanatos|……你难不成就想这样摆脱我了？
ThanatosFirstAppearance|Thanatos First Appearance|Zagreus|塔纳托斯。我早知道，父亲派你来阻止我，恐怕只是时间问题。
ThanatosFirstAppearance|Thanatos First Appearance|Thanatos|扎格列欧斯，你真的以为我是因为这个才来的吗？我们来看看你能对付多少位英灵战士吧，除非你更希望我送你上路。
ThanatosFieldAboutHermes01|Thanatos Field About Hermes 01|Thanatos|在这里很少听到你的消息呀，扎格。我猜肯定是赫尔墨斯在帮助你。
ThanatosFieldAboutKeepsake01|Thanatos Field About Keepsake 01|Thanatos|你还带着我送给你的蝴蝶呢。好吧，离远点，等我这边的事情忙完之后，它就会让你变得更加强大了。
ThanatosFieldAboutLegendary02|Thanatos Field About Legendary 02|Thanatos|你已经有那个小莫特了，呵。好吧，看来你这次不用再召唤我了。
ThanatosFieldRunCleared01|Thanatos Field Run Cleared 01|Thanatos|你回来了。我还以为你逃出去了呢，不过不要紧。
ThanatosFieldPostEnding01|Thanatos Field Post Ending 01|Thanatos|很高兴能以更正式的身份和你合作，扎格。那咱们可以开始了吗？
ThanatosMiscIntro01|Thanatos Misc Intro 01|Thanatos|我就知道能在外头看到你。不过，看到你还活着我也蛮惊讶的。
ThanatosMiscIntro01|Thanatos Misc Intro 01|Zagreus|也许你不知道，我还是有两把刷子的，塔纳。
ThanatosMiscIntro01|Thanatos Misc Intro 01|Thanatos|我确实不知道，扎格！往后站，让专业的来。
