Id|Description|Speaker|Text
AchillesPostEnding01|Achilles Post Ending 01|Achilles|La Reine est de retour ! Tu l'as fait, mon garçon. Vous devez avoir beaucoup de choses à rattraper. Ou à réparer. Et, de ce que j'ai compris, tes tentatives d'évasion sont désormais officiellement approuvées, si je ne me trompe ?
AchillesPostEnding01|Achilles Post Ending 01|Zagreus|Vous ne vous trompez point, monsieur. Pour l'instant, je me sens d'humeur à continuer à me battre pour atteindre la surface. C'est un bon défouloir, et, comme l'a dit Hypnos, ça fait des Enfers un meilleur endroit ! Même si ce n'est qu'indirectement.
AchillesPostEnding01|Achilles Post Ending 01|Achilles|Eh bien, il me tarde de pouvoir travailler à tes côtés de manière plus formelle. Et je souhaite de tout mon cœur que toi, ta mère et ton père puissiez apprendre à mieux vous connaître, et à mieux cohabiter.
AchillesPostEnding02|Achilles Post Ending 02|Zagreus|Bonjour, monsieur. J'espère que vous ne vous êtes pas attiré trop d'ennuis en me laissant entrer dans les appartements de Père.
AchillesPostEnding02|Achilles Post Ending 02|Achilles|Ne t'en fais pas, mon garçon. C'était un risque que j'étais prêt à prendre, et ton père a choisi de passer l'éponge pour cette fois. Cela dit, je ne m'attendais pas à ce que tu obtiennes la permission d'y entrer comme bon te semble.
AchillesPostEpilogue01|Achilles Post Epilogue 01|Achilles|Dis-moi, mon garçon, comment était le festin familial ? Tout s'est bien passé ?
AchillesPostEpilogue01|Achilles Post Epilogue 01|Zagreus|Eh bien, j'avoue que j'étais un peu nerveux tout du long, mais... au final, je me suis bien amusé, et je suis vraiment, vraiment soulagé que les choses se soient finies de cette façon. Et vous ?
AchillesPostEpilogue01|Achilles Post Epilogue 01|Achilles|C'était très agréable, oui. La dernière fois que j'ai participé à un festin remonte à l'époque où je guerroyais à la surface, pour tout te dire. Je dois reconnaître que ta mère a un vrai don avec les mots ! Avec elle, tout le monde riait, et bavardait...
AchillesPostEpilogue01|Achilles Post Epilogue 01|Zagreus|Elle a vraiment réussi ! Mais... malgré toute sa confiance en soi, je ne pense pas qu'elle s'en croyait capable. Parce que si c'était le cas... si elle avait pris contact avec l'Olympe plus tôt... beaucoup de choses se seraient passées très différemment.
AchillesPostEpilogue01|Achilles Post Epilogue 01|Achilles|N'y pense pas trop. J'ai discuté un peu avec Nyx. Ta mère avait ses raisons. C'est difficile de savoir parfaitement ce qu'on fait, tu sais. Nous n'avons que ce que nous pensons savoir, et ce que nous dit notre conscience. Ta mère a réussi à mettre son plan à exécution... et c'est entièrement grâce à toi.
AchillesPostEpilogue01|Achilles Post Epilogue 01|Zagreus|Entièrement grâce à moi ? J'ai eu beaucoup d'aide en chemin. Tenez, par exemple, je n'aurais jamais pu y arriver sans *vous*, monsieur. Sans votre aide, je suis sûr que je serais encore en train de me battre dehors avec un vieux pied de chaise pour seule arme.
AchillesPostEpilogue01|Achilles Post Epilogue 01|Achilles|Et ce serait un effroyable pied de chaise que tu aurais là ! Enfin bref... tu comptes sortir bientôt ? L'Olympe doit se réjouir d'avance de t'aider dans tes contrôles de sécurité. Si c'est bien comme ça qu'on les appelle, maintenant.
AchillesPostEpilogue01|Achilles Post Epilogue 01|Zagreus|Oui, je ferais mieux d'y aller. On se revoit bientôt.
AchillesPostEpilogue02|Achilles Post Epilogue 02|Achilles|Je suis franchement impressionné par ce que tu as accompli, mon garçon. Quand j'avais ton âge... ou l'âge que tu sembles avoir... je ne cherchais que la gloire, le renom éternel... et regarde où ça m'a mené ! Je suis content que tu sois plus intelligent que je ne l'étais.
AchillesPostEpilogue02|Achilles Post Epilogue 02|Zagreus|Donc, à poursuivre la gloire... vous pensez l'avoir perdue ? Pardon, mais je ne suis pas d'accord. J'ai juste réglé une querelle de famille, moi. Vous, vous avez changé le cours d'une guerre à vous seul !
AchillesPostEpilogue02|Achilles Post Epilogue 02|Achilles|Une guerre stupide. La gloire revient à ceux qui s'investissent dans des causes nobles. Ça ne doit être qu'une simple conséquence, pas un but en soi. Enfin bon, ça, tu le sais déjà.
AchillesPostEpilogue02|Achilles Post Epilogue 02|Zagreus|Je ne serais arrivé à faire ce que j'ai fait sans votre aide et vos conseils. C'est aussi vous qui m'avez préparé. Moi, j'appelle ça une cause noble. Et donc, ça veut dire que vous avez eu votre part de gloire au final, non ?
AchillesCodexProgress01|Achilles Codex Progress 01|Achilles|Ton Codex commence à être bien rempli, mon garçon. Ça fait plaisir à voir. Mes responsabilités à la Maison m’empêchent de voyager autant qu'avant, vois-tu.
AchillesCodexProgress01|Achilles Codex Progress 01|Zagreus|J’essaierai de voyager pour nous deux, Achille. J’ai vu tellement peu de choses en dehors de ces murs...
AchillesCodexProgress02|Achilles Codex Progress 02|Achilles|Regarde-toi, avec ce Codex rempli de notre histoire ! Je savais que je pouvais compter sur toi pour le compléter. À mon époque, personne n'aurait jamais cru un mot de ce qui se passe ici.
AchillesCodexProgress02|Achilles Codex Progress 02|Zagreus|Je suis sûr que les mortels ont quand même dû entendre des histoires. Sur ce qui leur arrive après leur mort, et quand ils se retrouvent ici.
AchillesCodexProgress02|Achilles Codex Progress 02|Achilles|Oh, c'est même certain. Ils craignent ton père, comme tu peux l'imaginer. Ils craignent aussi ton chien. Mais la plupart d’entre eux ne savent pratiquement rien d’autre. Même leurs peurs, je pense, naissent de leur ignorance. Comme la plupart des peurs, à vrai dire.
AchillesCodexProgress03|Achilles Codex Progress 03|Zagreus|Achille... dans le Codex, vous parlez de quelqu’un avec qui vous avez partagé votre vie... quand vous étiez encore chair et sang ?
AchillesCodexProgress03|Achilles Codex Progress 03|Achilles|...*Ah*. C'est très personnel, mon garçon. Ça date d’une époque où j’étais convaincu que je serais le seul et unique lecteur de mon Codex. Mon passé n'a pas grande importance, et je suis actuellement de service, alors... si tu veux bien m’excuser.
AchillesCodexProgress05|Achilles Codex Progress 05|Zagreus|*Euh*, Achille, je voulais vous demander, à propos de votre Codex... ce sont bien vos mots, mais pourtant, c’est par mes actes que je réussis à les assimiler. Ça marche toujours comme ça, avec les écrits des mortels ?
AchillesCodexProgress05|Achilles Codex Progress 05|Achilles|*Ah*. Mon garçon, tu dois comprendre que j'ai rejoint le royaume de ton père depuis un certain temps déjà. Mes écrits font comme partie intégrante de moi-même, si tu veux, un peu comme cette lance. Mais avec le temps, ces parties intégrantes peuvent me quitter. Et mon savoir peut devenir le tien. Quelle que soit son étendue.
AchillesCodexProgress06|Achilles Codex Progress 06|Achilles|J'ai eu une étrange sensation à l'instant, mon garçon. Est-ce que... je pourrais voir ton Codex, s'il te plaît ?
AchillesCodexProgress06|Achilles Codex Progress 06|Zagreus|Bien sûr, monsieur ! Je m'en suis bien occupé, comme vous pouvez le voir. Il est presque terminé !
AchillesCodexProgress06|Achilles Codex Progress 06|Achilles|Il *est *terminé ! Incroyable... une chronique de ce royaume... de tout ce que j'ai appris et vécu...
AchillesCodexProgress06|Achilles Codex Progress 06|Zagreus|Mais il y a toujours plus de choses à apprendre et à vivre, pas vrai ?
AchillesMysteryDoor01|Achilles Mystery Door 01|Zagreus|Hé, Achille ? Vous ne pourriez pas me laisser jeter un œil aux appartements de mon père ? Je suis sûr que je pourrais y trouver beaucoup de choses utiles.
AchillesMysteryDoor01|Achilles Mystery Door 01|Achilles|Tu sais que je ferais tout ce que je peux pour t'aider, mon garçon. Malheureusement, ma capacité à intervenir dépend de ma capacité à garder mon travail. Mais ne t'inquiète pas, si j'entends parler de quelque chose demandant ton attention là-bas, je te le ferai savoir.
AchillesDrinking01|Achilles Drinking 01|Achilles|Je t'inviterais bien à boire un verre, mon garçon, mais je sais que tu as une mission à accomplir, et l’alcool endort les sens. C'est peut-être une bonne chose dans la plupart des circonstances, mais malheureusement pas dans les tiennes. Vas-y, je boirai seul pour nous deux.
AchillesDrinking01|Achilles Drinking 01|Zagreus|Une autre fois, Achille. Je passais juste prendre de vos nouvelles, je repars bientôt.
AchillesBackstory01|Achilles Backstory 01|Zagreus|Achille, est-ce que... vous pouvez m’en dire plus sur Patrocle ? Vous aviez dit que vous étiez proches.
AchillesBackstory01|Achilles Backstory 01|Achilles|Nous n’aurions pu l’être plus. Nos cendres sont encore mêlées les unes aux autres quelque part à la surface. Que dire de plus, mon garçon ? Je l’aimais de tout mon cœur... et il m’a quitté bien trop tôt.
AchillesBackstory01|Achilles Backstory 01|Zagreus|Alors, il doit sûrement être quelque part dans les Enfers... vous n'avez jamais essayé de le retrouver ? Ou demandé à mon père où il était ?
AchillesBackstory01|Achilles Backstory 01|Achilles|*Hah, ha ha. *J’ai essayé, mon garçon, j’ai essayé. J'ai tout essayé. Malheureusement, rien n’est jamais aussi simple dans les Enfers. Tu as vu comment les choses se passent dehors... il est difficile de retrouver son chemin. Mais tu sais quoi ? Si jamais tu croises Patrocle parmi toutes les ombres, salue-le de ma part.
AchillesBackstory01B|Achilles Backstory 01 B|Zagreus|Mais vous êtes tous les deux ici dans les Enfers, maintenant ! Vous ne pouvez pas simplement aller le retrouver ? Ou revoir votre accord avec mon père ?
AchillesBackstory01B|Achilles Backstory 01 B|Achilles|*Ha, hah. *J’ai essayé, mon garçon, j’ai essayé. J'ai tout essayé. Malheureusement, rien n’est jamais aussi simple dans les Enfers. Cela dit, j'ai une autre idée. La prochaine fois que tu croises Patrocle sur ton chemin, continue de lui parler pour moi, tu veux bien ?
AchillesAboutPatroclus01A|Achilles About Patroclus 01 A|Achilles|Comment se déroule ton périple, mon garçon ? Tu as une drôle de tête. Tout va bien ?
AchillesAboutPatroclus01A|Achilles About Patroclus 01 A|Zagreus|C’est juste que... dans l’Élysée, j’ai rencontré une ombre qui prétend vous avoir connu. Elle m’a dit que vous lui manquiez. Vous connaissez un certain Patrocle, monsieur ?
AchillesAboutPatroclus01A|Achilles About Patroclus 01 A|Achilles|Quoi...? Je... oui. J'ai connu Patrocle. Est-ce que... est-ce qu'il va bien ?
AchillesAboutPatroclus01A|Achilles About Patroclus 01 A|Zagreus|Il... je ne sais pas. Je dirais qu'il a certainement connu des jours meilleurs. Est-ce que... vous avez un message à faire passer, au cas où je le retrouve ?
AchillesAboutPatroclus01A|Achilles About Patroclus 01 A|Achilles|...Transmets-lui mes salutations, s'il te plaît. Et... tout mon amour. Je pense toujours à lui, mais je ne peux plus jamais le voir. Et tu ne dois surtout pas me demander pourquoi, tu as compris ? Maintenant laisse-moi, mon garçon, s'il te plaît. J'ai besoin d'être seul un moment.
AchillesAboutPatroclus01B|Achilles About Patroclus 01 B|Zagreus|C’est juste que... j'ai rencontré une ombre dans l’Élysée. C’était votre Patrocle. Il va bien, mais il a l'air d'avoir connu des jours meilleurs. Est-ce que vous avez un message à faire passer, au cas où je le recroise ?
AchillesAboutPatroclus01B|Achilles About Patroclus 01 B|Achilles|Oh...! Eh bien, transmets-lui mes salutations, s'il te plaît. Et... tout mon amour. Je pense toujours à lui, mais je ne peux plus jamais le voir. Et tu ne dois surtout pas me demander pourquoi, tu as compris ? Maintenant laisse-moi, mon garçon, s'il te plaît. J'ai besoin d'être seul un moment.
AchillesAboutPatroclus02|Achilles About Patroclus 02|Achilles|Hé, mon garçon, écoute-moi une seconde. J'aimerais que tu fasses preuve de discrétion au sujet de la personne dont nous avons parlé la dernière fois. L’ombre que tu as rencontrée dans l’Élysée.
AchillesAboutPatroclus02|Achilles About Patroclus 02|Zagreus|Je vois. Comment est-ce que je peux me rendre utile, monsieur ? Je dois bien pouvoir être capable d'aider d'une manière ou d'une autre. Mais d'abord, vous devez me dire ce qu'il se passe entre vous.
AchillesAboutPatroclus02|Achilles About Patroclus 02|Achilles|Pour faire simple, il est la raison pour laquelle je me trouve ici. Patrocle a perdu la vie avant moi. À cause de moi. Je n’ai pas tardé à le suivre, dans un accès de rage. Quand je suis arrivé ici, j’ai été accueilli comme un héros. Ton père m'a conduit en personne à l’Élysée. Mais ce n’était pas ce que je voulais.
AchillesAboutPatroclus02|Achilles About Patroclus 02|Zagreus|Vous vouliez voir Patrocle. Mais, il est à l’Élysée, alors que vous... oh, non.
AchillesAboutPatroclus02|Achilles About Patroclus 02|Achilles|J’ai signé un pacte, mon garçon. J'ai trouvé que les termes étaient assez satisfaisants. Il pouvait vivre là-haut, à condition que je choisisse de vivre ici, du moins pendant quelque temps. De tels accords sont rares, et leur confidentialité doit être respectée. Mais évitons d'en parler davantage pour le moment, d’accord ? Une autre fois.
AchillesAboutPatroclus03|Achilles About Patroclus 03|Zagreus|Il faut que vous m'en disiez plus sur ce pacte que vous avez signé, Achille. Patrocle et vous... vous êtes condamnés à ne jamais vous revoir ?
AchillesAboutPatroclus03|Achilles About Patroclus 03|Achilles|Inutile de révéler les détails, mon garçon. Mais ce n'est pas aussi grave que tu le penses. J’ai veillé à ce que Patrocle ne manque de rien. Et de toute façon, nous n’aurions pas pu être ensemble. Au départ, il n’avait pas été envoyé dans l’Élysée, vois-tu.
AchillesAboutPatroclus03|Achilles About Patroclus 03|Zagreus|Il doit bien y avoir un moyen pour moi de résoudre la situation. Pas seulement pour lui, mais pour vous aussi.
AchillesAboutPatroclus03|Achilles About Patroclus 03|Achilles|Tu as d'autres problèmes bien plus urgents à régler, mon garçon. Et puis, Patrocle et moi avons tout notre temps. Je sais que tu souhaites bien faire, mais... n'en parle surtout pas à ton père pour le moment. J'ai peur que ça ne fasse qu'aggraver les choses. Tu as compris ?
AchillesAboutPatroclus04|Achilles About Patroclus 04|Zagreus|Le... guerrier de l’Élysée dont nous avons parlé l'autre fois. Il a l’air d’être quelqu’un de bien, mais... est-ce qu'il a toujours été aussi déprimé ?
AchillesAboutPatroclus04|Achilles About Patroclus 04|Achilles|Non, mon garçon. J'ai peut-être été comme ça, mais pas lui. À ma connaissance, il était... il était l’un des rares hommes qui ne m'ait jamais considéré comme une menace. Il voyait quelque chose en moi dont j'ignorais moi-même l'existence... et à mon tour, avec lui, je me sentais... comment dire ? Calme. Entier.
AchillesAboutPatroclus04|Achilles About Patroclus 04|Zagreus|*Hah *! Moi, je suis tout le temps agité. Je ne peux qu'imaginer.
AchillesAboutPatroclus04|Achilles About Patroclus 04|Achilles|Il avait ce sens de l’humour empreint d'ironie, comme s’il était sage avant l’âge. Je suis sûr que cette qualité l'aidera à traverser cette épreuve. Cela dit... j'espérais qu'en vivant à l’Élysée, il n'aurait plus d'épreuves à traverser.
AchillesAboutPatroclusBackstory01|Achilles About Patroclus Backstory 01|Zagreus|Je sais que c'est un sujet douloureux, monsieur, mais... qu'est-ce qui s'est passé pendant la guerre qui vous a tués, Patrocle et vous ? Il en a parlé un peu avec moi la dernière fois. Il a dit que vous aviez refusé de vous battre.
AchillesAboutPatroclusBackstory01|Achilles About Patroclus Backstory 01|Achilles|Jusqu'à ce qu'il meure. C'est vrai, j'ai toujours refusé de me battre, mais c'était jusqu'à ce qu'il meure...*ngh*, écoute, mon garçon, s'il faut qu'on discute de ces choses-là, je préfèrerais le faire dans le salon, pas ici.
AchillesAboutPatroclusBackstory01|Achilles About Patroclus Backstory 01|Achilles|...J'étais au service d'un roi idiot. Jamais je ne serais parti au combat pour lui. Mais Patrocle, il voyait toujours les choses d'un autre œil. Alors que je refusais de me battre, il a choisi de partir. Il a mis mon armure et a mené mes frères au combat en se faisant passer pour moi. Il s'est vaillamment battu, mais... au final, il est... enfin, voilà.
AchillesAboutPatroclusBackstory01|Achilles About Patroclus Backstory 01|Zagreus|Et donc, quand vous avez appris la nouvelle... vous avez voulu le venger. Et vous l'avez vengé.
AchillesAboutPatroclusBackstory01|Achilles About Patroclus Backstory 01|Achilles|Ça, oui. Au bout du compte, nos ennemis m'ont eu, mais j'en avais déjà décimé un nombre considérable. La guerre a pris fin peu de temps après. C'est vraiment terrible de savoir que pour mettre un terme à un conflit, il suffit seulement de prendre d'innombrables vies d'un seul coup. Je n'avais pas encore compris ça, à l'époque.
AchillesAboutPatroclusBackstory01|Achilles About Patroclus Backstory 01|Zagreus|Est-ce que vous... vous vous êtes laissé mourir ? Pour pouvoir retrouver Patrocle ici ?
AchillesAboutPatroclusBackstory01|Achilles About Patroclus Backstory 01|Achilles|...Je ne sais pas. Peut-être. Tout ce que je sais, c'est que j'étais fou de rage. Mais cette rage s'est calmée peu de temps après mon arrivée ici. Après ça, je me suis senti... vide. Je n'ai jamais revu Patrocle depuis, mais j'ai appris que mes frères d'armes avaient honoré mon dernier vœu, celui que mes cendres soient mêlées aux siennes. *<Soupir> *Enfin bref...! Merci pour le verre.
AchillesAboutPatroclusBackstory01|Achilles About Patroclus Backstory 01|Achilles|Bon, je pense que je ferais mieux de retourner à mon poste, maintenant. Mais cette guerre, mon garçon ? Ne m'en reparle plus jamais. D'accord ?
AchillesAboutPatroclus05|Achilles About Patroclus 05|Achilles|Est-ce que tu l'as revu pendant tes trajets récemment, mon garçon ? Comment va-t-il ? Je parle du guerrier que tu as croisé dans l'Élysée.
AchillesAboutPatroclus05|Achilles About Patroclus 05|Zagreus|Il se porte relativement bien, je crois. Il y a beaucoup de choses que vous m'avez dit... que lui ignorait. Notamment sur les circonstances de son séjour dans l’Élysée, et du vôtre ici.
AchillesAboutPatroclus05|Achilles About Patroclus 05|Achilles|Alors, tu lui as dit. Sans même me demander la permission ! Qu'est-ce que tu lui as raconté, exactement ?
AchillesAboutPatroclus05|Achilles About Patroclus 05|Zagreus|Achille, je... je suis désolé, je... je lui ai juste parlé de vos cendres mélangées... et du pacte, aussi. Vous m'aviez dit de lui transmettre vos salutations et tout votre amour. Ça ne l'a pas rendu heureux du tout. Au lieu de ça, il se pose plein de questions, maintenant ! Vous m'aviez dit de ne rien dire à Père, pas à lui !
AchillesAboutPatroclus05|Achilles About Patroclus 05|Achilles|*<Soupir>*...Tu as raison, je... j'aurais dû préciser. Ou peut-être pas, en fin de compte, parce que ce que tu as fait était probablement la meilleure chose à faire. Pardon de m'être emporté, mon garçon, c'est juste que... écoute, je te remercie de veiller sur lui. Sur nous. Mais par pitié, sois prudent.
AchillesAboutMyrmidonReunionQuest01|Achilles About Myrmidon Reunion Quest 01|Zagreus|J'ai un message pour vous de la part du guerrier déchu de l'Élysée, monsieur Achille. Il dit... il m'a seulement demandé de vous dire de tenter le tout pour le tout.
AchillesAboutMyrmidonReunionQuest01|Achilles About Myrmidon Reunion Quest 01|Achilles|Le tout pour le tout ? Il a vraiment dit de tenter le tout pour le tout ?
AchillesAboutMyrmidonReunionQuest01|Achilles About Myrmidon Reunion Quest 01|Zagreus|Oui. Est-ce que... cette expression a un sens particulier ?
AchillesAboutMyrmidonReunionQuest01|Achilles About Myrmidon Reunion Quest 01|Achilles|La dernière fois qu'il m'a dit ça... eh bien, je ne l'ai pas écouté. Mais j'aurais dû. J'aurais vraiment dû.
AchillesAboutMyrmidonReunionQuest01|Achilles About Myrmidon Reunion Quest 01|Zagreus|Il vous demande de retenter votre chance.
AchillesAboutMyrmidonReunionQuest01|Achilles About Myrmidon Reunion Quest 01|Achilles|Non... je crois plutôt qu'il me donne une autre chance. Je... laisse-moi seul un moment, mon garçon. Merci pour le message.
AchillesAboutMyrmidonReunionQuest02|Achilles About Myrmidon Reunion Quest 02|Zagreus|À propos de risquer le tout pour le tout, monsieur... est-ce que vous savez ce que ça signifie, maintenant ? Ce que vous devez faire ?
AchillesAboutMyrmidonReunionQuest02|Achilles About Myrmidon Reunion Quest 02|Achilles|Pas encore, mon garçon. Au combat, j'agissais d'instinct, je prenais des décisions presque instantanément. Mais pour le reste... j'ai besoin de temps. Un peu de patience, s'il te plaît. Je te dirai si je trouve quelque chose.
AchillesAboutMyrmidonReunionQuest03_A|Achilles About Myrmidon Reunion Quest 03 A|Achilles|J'ai besoin de ton aide pour quelque chose, mon garçon, parce que je pense être prêt à tenter le tout pour le tout. Tu as un moment à m'accorder ?
AchillesAboutMyrmidonReunionQuest03_A|Achilles About Myrmidon Reunion Quest 03 A|Zagreus|Bien sûr, monsieur, je vous écoute. De quoi s'agit-il ?
AchillesAboutMyrmidonReunionQuest03_A|Achilles About Myrmidon Reunion Quest 03 A|Achilles|Le pacte que j'ai signé avec ton père. Il doit être enfoui quelque part dans la chambre administrative juste à côté. Je n'osais pas te demander de le retrouver, de peur d'aggraver la situation, mais...
AchillesAboutMyrmidonReunionQuest03_A|Achilles About Myrmidon Reunion Quest 03 A|Zagreus|...Mais la peur est pour les faibles, monsieur Achille.
AchillesAboutMyrmidonReunionQuest03_A|Achilles About Myrmidon Reunion Quest 03 A|Achilles|Exact. Et puis... ton père s'est montré bien plus respectueux que je ne l'aurais pensé quand tu as annulé la Sentence du Roi Déchu, alors... peut-être que mon cas n'est pas encore désespéré.
AchillesAboutMyrmidonReunionQuest03_A|Achilles About Myrmidon Reunion Quest 03 A|Zagreus|J'en parlerai à Nyx à la première occasion. Et je ferai attention à moi, monsieur. Je vous le promets.
AchillesAboutMyrmidonReunionQuest03_B|Achilles About Myrmidon Reunion Quest 03 B|Achilles|Exact. Et puis... ton père s'est montré bien plus respectueux que je ne l'aurais pensé quand tu as annulé le pacte qui séparait Orphée et Eurydice, alors... peut-être que mon cas n'est pas encore désespéré.
AchillesAboutMyrmidonReunionQuest03_C|Achilles About Myrmidon Reunion Quest 03 C|Achilles|Exact. Et puis... ton père s'est montré bien plus respectueux que je ne l'aurais pensé quand tu as annulé les pactes d'Orphée et de Sisyphe, alors... peut-être que mon cas n'est pas encore désespéré.
AchillesAboutMyrmidonReunionQuest04|Achilles About Myrmidon Reunion Quest 04|Zagreus|J'essaye de trouver votre pacte, Achille. Il me faut encore un peu de temps.
AchillesAboutMyrmidonReunionQuest04|Achilles About Myrmidon Reunion Quest 04|Achilles|Je suis quelqu'un de patient, mon garçon, et je tâcherai de calmer mon espoir. Merci pour tout ce que tu fais. Quand je te reverrai, peut-être que tu me diras que tu as réussi.
MyrmidonReunionQuestComplete|Myrmidon Reunion Quest Complete|Zagreus|Achille ! Votre pacte avec Père a officiellement été amendé. Plus exactement, il n'existe plus aucune clause vous interdisant l'accès à l'Élysée tant que vous travaillez pour nous. Par les pouvoirs qui me sont conférés, et au nom d'Hadès, je vous remercie pour votre service.
MyrmidonReunionQuestComplete|Myrmidon Reunion Quest Complete|Achilles|Quoi ? Tu... tu es sérieux ? Je peux partir ? Tu as raison, je peux le sentir. Je suis libre. Alors, je peux... tout simplement m'en aller... tout de suite.
MyrmidonReunionQuestComplete|Myrmidon Reunion Quest Complete|Zagreus|Vous pouvez partir, dès maintenant. Et je dirais qu'il est grand temps.
MyrmidonReunionQuestComplete|Myrmidon Reunion Quest Complete|Achilles|Je... je ferais mieux d'y aller, dans ce cas, mais... je ne suis pas prêt, je... je ne pensais pas que ce moment finirait par arriver un jour. Ce n'est pas que je n'avais pas confiance en toi, mais...
MyrmidonReunionQuestComplete|Myrmidon Reunion Quest Complete|Zagreus|Il se trouve qu'il y a une clairière dans l’Élysée que je vous recommande vivement de visiter... allez le voir, monsieur. Vous avez assez attendu. La peur est pour les faibles.
MyrmidonReunionQuestComplete|Myrmidon Reunion Quest Complete|Achilles|...La peur est pour les faibles. À bientôt, mon garçon. Je ne pourrai jamais assez te remercier.
AchillesAfterMyrmidonReunionQuestComplete01|Achilles After Myrmidon Reunion Quest Complete 01|Zagreus|Monsieur, vous êtes de retour ! Comment c'était, dans l'Élysée ? Tout s'est bien passé ?
AchillesAfterMyrmidonReunionQuestComplete01|Achilles After Myrmidon Reunion Quest Complete 01|Achilles|Tout s'est bien passé, mon garçon. Aussi bien que je l'espérais. Mieux que je le craignais. Et n'en veux pas à Patrocle de t'appeler étranger, d'accord ? Il a des mots bien moins aimables envers ceux qui ne lui plaisent guère.
AchillesAfterMyrmidonReunionQuestComplete01|Achilles After Myrmidon Reunion Quest Complete 01|Zagreus|Allons, Achille, je veux en savoir plus ! Que vous est-il arrivé, à tous les deux ? Si ça ne vous dérange pas de me raconter.
