Id|Description|Speaker|Text
AchillesAfterMyrmidonReunionQuestComplete01|Achilles After Myrmidon Reunion Quest Complete 01|Achilles|*Ah, ah... * Eh bien... Heureusement, grâce à tes efforts, nous n'avons pas eu grand-chose à nous dire, à mon arrivée. Il a juste prononcé mon nom, et puis... nous étions deux âmes réunies. Les ombres ont toutes quelque chose de triste, ici. Mais à ce moment-là, ce n'était pas le cas.
AchillesAfterMyrmidonReunionQuestComplete01|Achilles After Myrmidon Reunion Quest Complete 01|Zagreus|Je suis heureux de l'entendre. Votre présence a dû l'inspirer. Vous avez sûrement beaucoup de temps à rattraper.
AchillesAfterMyrmidonReunionQuestComplete01|Achilles After Myrmidon Reunion Quest Complete 01|Achilles|Oui, c'est le moins qu'on puisse dire. Et nous avons enfin du temps à partager. C'est étrange, parce que beaucoup de mes souvenirs de lui proviennent de la guerre. Maintenant, nous pouvons nous faire de nouveaux souvenirs en paix. Bref... À bientôt, j'espère.
AchillesAboutHadesBedroom01|Achilles About Hades Bedroom 01|Achilles|Qu'y a-t-il, mon garçon, quelque chose ne va pas ? Est-ce que je peux t'aider ?
AchillesAboutHadesBedroom01|Achilles About Hades Bedroom 01|Zagreus|Laissez-moi entrer dans les appartements de Père. S'il vous plaît.
AchillesAboutHadesBedroom01|Achilles About Hades Bedroom 01|Achilles|...Ça fait partie des choses que je ne peux faire pour personne et sous aucun prétexte. Que cherches-tu exactement ? Moi-même, je n'y suis jamais entré...
AchillesAboutHadesBedroom01|Achilles About Hades Bedroom 01|Zagreus|Je ne sais pas, je n'en sais rien ! Mais, si je connais bien Père, et je pense bien le connaître, il doit avoir quelque chose qui lui appartient là-dedans. Qui appartient à Mère ! Elle ne comprend toujours pas, elle ne me croit pas, alors... je lui ai dit que je lui prouverais... que Père se soucie d'elle !
AchillesAboutHadesBedroom01|Achilles About Hades Bedroom 01|Achilles|Je vois, calme-toi, je comprends. Écoute... ça risque de m'apporter beaucoup d'ennuis, tu n'as pas idée. Et pas seulement à moi, d'ailleurs, alors... fais attention, et agis vite, tant qu'il est encore absent. Prends ça et file. Et surtout, ne touche à rien, d'accord ?
AchillesAboutReunionQuests01|Achilles About Reunion Quests 01|Zagreus|Achille... si un de vos amis avait besoin d'aide, mais que le seul moyen de l'aider était de changer les termes d'un ancien pacte probablement imposé par Père, qu'est-ce que vous feriez ?
AchillesAboutReunionQuests01|Achilles About Reunion Quests 01|Achilles|Avant tout, je serais extrêmement prudent. Tu m'entends, mon garçon ? Je veillerais à ne pas accidentellement aggraver les choses. Combien de pactes comme celui dont tu parles sont enfouis dans la chambre administrative ? Même ton père ne s'y retrouve plus. Par contre... peut-être que Nyx pourra t'aider.
AchillesAboutReunionQuests01|Achilles About Reunion Quests 01|Zagreus|Nyx... oui, vous avez raison. Elle sait tout ! J'imagine que ça ne ferait pas de mal de lui demander...
AchillesAboutOffice01|Achilles About Office 01|Achilles|Un instant, mon garçon ! Tu as regagné l'accès à la chambre administrative, n'est-ce pas ? Je n'aurais jamais cru que tu souhaiterais y retourner un jour.
AchillesAboutOffice01|Achilles About Office 01|Zagreus|Oh, ce n'est pas le cas, croyez-moi. Mais j'aime pouvoir aller où je veux sans la moindre restriction. Et puis, je ne raterais jamais une occasion de contrarier Père.
AchillesAboutOffice01|Achilles About Office 01|Achilles|Je vois. Dans ce cas, en vertu de mon autorité limitée, j'ai le plaisir de t'annoncer... que tu peux passer.
AchillesAboutOffice02|Achilles About Office 02|Zagreus|Achille, maintenant que j'ai de nouveau accès à la chambre administrative, je... eh bien, j'ai accès aux archives, et... j'ai le pouvoir de les déclarer nulles et non avenues, dans certaines circonstances. Et donc, je pensais à votre pacte...
AchillesAboutOffice02|Achilles About Office 02|Achilles|Mon garçon, je sais que tu ne penses pas à mal, et je te remercie du fond de là où était mon cœur, vraiment. Mais... n'exerce pas ton influence dans cette affaire. Du moins, pas maintenant. Les Moires peuvent déformer les intentions. Je ne voudrais pas prendre ce risque.
AchillesAboutOffice02|Achilles About Office 02|Zagreus|Vous êtes sûr...? Bon, alors... j'attendrai. Mais je ne veux pas en rester là pour toujours. Il faut qu'on fasse quelque chose. Patrocle attend.
AchillesAboutOrpheus01|Achilles About Orpheus 01|Zagreus|Dites, je me demandais, Achille... est-ce que vous avez eu des nouvelles d’Orphée dernièrement ? Ça fait un moment que je ne l’ai pas vu. Il est toujours en train de purger sa peine ?
AchillesAboutOrpheus01|Achilles About Orpheus 01|Achilles|Je crois bien que oui, mon garçon. Ton père était très fâché contre lui la dernière fois que je l’ai vu ici. J’ai fait de mon mieux pour désamorcer la situation, mais... tu sais comment ça se passe. J’espère que ton père finira par lever sa sentence.
AchillesAboutOrpheus01|Achilles About Orpheus 01|Zagreus|Je l'espère aussi. Si jamais vous le voyez, dites-lui bonjour de ma part.
AchillesAboutOrpheus02|Achilles About Orpheus 02|Zagreus|Je suis content qu’Orphée soit de retour parmi nous. Il n’a pas changé du tout. Vous savez s'il a toujours été comme ça ?
AchillesAboutOrpheus02|Achilles About Orpheus 02|Achilles|Je ne pense pas, non. Je ne l’ai jamais connu de mon vivant, mais il a toujours été du genre mélancolique depuis que je l'ai rencontré ici. Cela dit, les quelques fois où je l’ai entendu chanter...? C’était magnifique. Ça ne m'étonne pas que ton père l’ait gardé ici.
AchillesWithHades01|Achilles With Hades 01|Achilles|...Vous m’aviez demandé de l’entraîner, Maître. De le préparer aux épreuves de la vie. Vous l’aviez ordonné ! Et maintenant, vous me réprimandez ?
AchillesWithHades01|Achilles With Hades 01|Hades|Surveille ton ton et ton comportement, Ombre. Tu es à mon service. Au lieu de cela, tu pourrais te retrouver à errer dans les prairies de l’Élysée. Ou en des lieux moins glorieux, si je le décidais.
AchillesWithHades01|Achilles With Hades 01|Achilles|Que voulez-vous me faire faire ?
AchillesWithHades01|Achilles With Hades 01|Hades|Je l'ignore encore. En attendant, veille sur ce couloir. Et veille aussi à ne plus commettre d'impertinences.
AchillesWithHadesAboutMyrmidonReunionQuest01|Achilles With Hades About Myrmidon Reunion Quest 01|Hades|...J'ai cru comprendre que les termes de notre pacte ont été modifiés en mon nom, Ombre. Estime-toi heureux que ces changements ne nécessitent pas mon approbation dans ton cas. Mais tu restes à mon service, n'est-ce pas ?
AchillesWithHadesAboutMyrmidonReunionQuest01|Achilles With Hades About Myrmidon Reunion Quest 01|Achilles|Pour autant que je sache, oui, Maître. J'ai juré fidélité éternelle à cette Maison, mais... il semble que je suis maintenant libre de me rendre à l'Élysée de temps en temps. En dehors de mon service, bien sûr.
AchillesWithHadesAboutMyrmidonReunionQuest01|Achilles With Hades About Myrmidon Reunion Quest 01|Hades|C'est effrayant à quel point les pactes sont permissifs de nos jours ! Tu n'es pas en service actuellement, n'est-ce pas ? Alors va, profite donc de tes nouveaux privilèges.
AchillesWithMegaera01|Achilles With Megaera 01|Megaera|...Qu’est-ce que tu as là, Ombre ? Ça m’a tout l’air d’être de la contrebande.
AchillesWithMegaera01|Achilles With Megaera 01|Achilles|C'en est, Maîtresse. Je suis content que vous soyez ici, vous pourrez peut-être m’aider à m’en débarrasser rapidement.
AchillesWithMegaera01|Achilles With Megaera 01|Megaera|Occupons-nous en immédiatement, dans ce cas. Avant que sa présence dans la Maison ne crée des problèmes.
AchillesWithMegaera02|Achilles With Megaera 02|Megaera|...Il doit être quelque part dans l’Élysée, je pense. Où est-ce qu'il serait, sinon ?
AchillesWithMegaera02|Achilles With Megaera 02|Achilles|Je suis d’accord, Maîtresse, c’est juste que... il me semble que nous avons d’autres problèmes plus urgents à régler, comme... nous débarrasser de cette contrebande.
AchillesWithMegaera02|Achilles With Megaera 02|Megaera|Je vois. Très bien. Mais tu devras affronter tes peurs un jour. Tu agis comme si tu ne peux absolument pas te permettre de faire quoi que ce soit... mais il est un peu tard pour ça.
AchillesWithMegaeraAboutMyrmidonReunionQuest01|Achilles With Megaera About Myrmidon Reunion Quest 01|Megaera|...Et donc, tu as fini par le trouver ? Grâce à Zag ? C'est... tu as de la chance, Ombre.
AchillesWithMegaeraAboutMyrmidonReunionQuest01|Achilles With Megaera About Myrmidon Reunion Quest 01|Achilles|C'est assurément plus que ce que je mérite, Maîtresse. Cela dit, il est peut-être préférable qu'une ombre oubliée rejoigne ses semblables. Ainsi, vous n'aurez plus à vous faire du souci pour moi.
AchillesWithMegaeraAboutMyrmidonReunionQuest01|Achilles With Megaera About Myrmidon Reunion Quest 01|Megaera|Eh bien, si tes voyages te font quitter cette Maison, alors... tu n'es qu'une Ombre, et donc... il y en aura d'autres, mais... prends soin de toi, d'accord ?
AchillesWithPersephone01|Achilles With Persephone 01|Persephone|...C'est un honneur de vous rencontrer, noble Achille. Notre garde royal ! C'est bon de savoir vers qui se tourner par ici en cas de problème. C'est donc vous qui avez entraîné mon fils au combat ?
AchillesWithPersephone01|Achilles With Persephone 01|Achilles|Effectivement, Votre Grâce. Il a été un élève talentueux. Si seulement vous aviez été là pour suivre ses progrès. Cela vous aurait certainement empli de fierté.
AchillesWithPersephone01|Achilles With Persephone 01|Persephone|Je *suis * emplie de fierté ! Vous savez, vous étiez déjà plutôt célèbre à la surface, quand je vivais encore sur l'Olympe. Je dirais que votre légende a encore beaucoup voyagé, depuis !
AchillesWithPersephone01|Achilles With Persephone 01|Achilles|Oh, j'en doute fort... mais je vous remercie, Votre Grâce.
AchillesChat01|Achilles Chat 01|Achilles|Souviens-toi de ton entraînement, mon garçon.
AchillesChat02|Achilles Chat 02|Achilles|Je ne doute pas une seconde que tu puisses réussir.
AchillesChat03|Achilles Chat 03|Achilles|Courage, mon garçon, et fais ce que tu as à faire.
AchillesChat04|Achilles Chat 04|Achilles|Je surveillerai l’évolution des choses pendant ton absence.
AchillesChat05|Achilles Chat 05|Achilles|Ne reste pas plus longtemps que nécessaire, mon garçon.
AchillesChat06|Achilles Chat 06|Achilles|Je n'ai plus rien à t'apprendre, mon garçon.
AchillesChat07|Achilles Chat 07|Achilles|Bats-toi comme si tu n'avais qu'une vie à vivre.
AchillesChat08|Achilles Chat 08|Achilles|Bats-toi comme je me battrais, là-dehors.
AchillesChat09|Achilles Chat 09|Achilles|Reviens le plus tard possible, mon garçon.
AchillesChat10|Achilles Chat 10|Achilles|Laisse tes instincts te guider, là-dehors.
AchillesChat11|Achilles Chat 11|Achilles|La Maison est en sécurité, mon garçon. Vas-y.
AchillesChat12|Achilles Chat 12|Achilles|L’expérience est le meilleur des mentors, mon garçon.
AchillesChat13|Achilles Chat 13|Achilles|Sors, et termine ce que tu as commencé, mon garçon.
AchillesChat14|Achilles Chat 14|Achilles|Nyx et moi avons la situation sous contrôle.
AchillesChat15|Achilles Chat 15|Achilles|Les erreurs sont des occasions d’apprendre, mon garçon.
AchillesChat16|Achilles Chat 16|Achilles|Va dans ta chambre, Zagreus.
AchillesChat17|Achilles Chat 17|Achilles|Je te couvrirai. Quoi qu’il arrive.
AchillesChat18|Achilles Chat 18|Achilles|Prépare-toi, mon garçon, et essaie à nouveau.
AchillesChat19|Achilles Chat 19|Achilles|Il n’y a pas de divinités inférieures, mon garçon.
AchillesChat20|Achilles Chat 20|Achilles|Si je peux faire quoi que ce soit pour t'aider, tu n'as qu'à me demander.
AchillesChat21|Achilles Chat 21|Achilles|Il n'y a rien que tu ne puisses pas faire. J'en suis certain.
AchillesChat22|Achilles Chat 22|Achilles|Ne gâche pas ta vie comme je l’ai fait, mon garçon.
AchillesChat23|Achilles Chat 23|Achilles|Je suis heureux de savoir que tu as trouvé une raison de te battre.
AchillesChat24|Achilles Chat 24|Achilles|Tu peux le faire, mon garçon. Maudites soient les Moires.
AchillesChat25|Achilles Chat 25|Achilles|Ton cœur est bon, mon garçon. Reste à son écoute.
AchillesChatWithMegaera01|Achilles Chat With Megaera 01|Megaera|Cette ombre me faisait juste le récit d'une célèbre guerre.
AchillesChatWithMegaera01|Achilles Chat With Megaera 01|Achilles|J'ai bien peur que la plupart de mes récits ne parlent que de massacres...
AchillesChatWithMegaera02|Achilles Chat With Megaera 02|Megaera|...La lance a beau être efficace entre de bonnes mains, elle ne peut pas arrêter un fouet.
AchillesChatWithMegaera02|Achilles Chat With Megaera 02|Achilles|Je dois admettre, Maîtresse, que je n'ai pas assez d'expérience contre une telle arme pour vous contredire. Fort heureusement.
AchillesChatWithMegaera03|Achilles Chat With Megaera 03|Megaera|...Ouvre donc une autre bouteille quand tu en auras fini avec celle-là, Ombre.
AchillesChatWithMegaera03|Achilles Chat With Megaera 03|Achilles|Comme vous voudrez, Maîtresse ! Excuse-nous un moment, mon garçon.
AchillesGift01|Achilles Gift 01|Zagreus|Hé, Achille. Écoutez, ce n’est vraiment pas grand-chose, mais... tenez.
AchillesGift01|Achilles Gift 01|Achilles|C’est pour moi ? Tu m’as devancé, car je comptais te donner ceci à notre prochaine rencontre. Je t'en prie, prends-le donc.
AchillesGift02|Achilles Gift 02|Achilles|Non, c’est pour moi ? Tu n'aurais vraiment pas dû. Tu me gâtes...!
AchillesGift02|Achilles Gift 02|Zagreus|Je pense juste que vous méritez mieux que le sort qu'on vous réserve ici, Achille.
AchillesGift03|Achilles Gift 03|Achilles|Quoi, c'est pour moi...? Je ne peux pas accepter un tel cadeau, mon garçon, tu le sais bien.
AchillesGift03|Achilles Gift 03|Zagreus|Allez, Achille, vivez un peu... dans la mesure du possible. Je ne dirai rien si vous ne dites rien.
AchillesGift04_A|Achilles Gift 04 A|Achilles|*Ah*, en voilà une bonne surprise, mon garçon ! Ne me dis pas que tu es revenu juste pour m’apporter ceci, je m'en voudrais vraiment. En tout cas, je te suis reconnaissant.
AchillesGift04_A|Achilles Gift 04 A|Zagreus|Vous avez toujours été là pour moi, Achille. Même quand Père m’a rejeté. Ce n’est rien. Je ne vous remercierai jamais assez.
AchillesGift05_A|Achilles Gift 05 A|Achilles|Mon garçon, tant de générosité, je... Je ne voudrais pas que tu te fasses une fausse idée. Je suis seul, oui, mais mon cœur appartient à quelqu’un. Depuis ma vie terrestre. J’espère que tu comprendras.
AchillesGift05_A|Achilles Gift 05 A|Zagreus|Je... Je l’avais bien compris, Achille. Je voulais vous donner ceci. Ne noyez pas votre chagrin, car il semble vous rendre plus fort.
AchillesGift05_A|Achilles Gift 05 A|Achilles|Alors, merci, et ne t'inquiète pas pour moi. Depuis longtemps, je suis passé outre le chagrin et la rage que j’ai ressentis quand mon cœur s’est brisé. Aujourd’hui, ce n’est qu’une cicatrice de plus. On dit que ce sont nos cicatrices qui nous donnent du caractère.
AchillesGift05_B|Achilles Gift 05 B|Achilles|Mon garçon, tant de générosité, je... Tu me traites comme un roi, moi qui ne suis qu'un vieil assassin. C'est bien la dernière chose à laquelle je m'attendais en entrant dans cette maison.
AchillesGift05_B|Achilles Gift 05 B|Zagreus|Vous étiez un grand héros, Achille, et devinez quoi ? Vous l'êtes encore ! Et vous le serez toujours, en tout cas à mes yeux. Vous méritez tellement mieux que ça. Si seulement je pouvais en faire plus pour vous.
AchillesGift05_B|Achilles Gift 05 B|Achilles|Alors, merci, et ne t'inquiète pas pour moi. J'ai de la chance d'être ici, et de plus... Aucun mentor n'aurait pu espérer meilleur élève.
AchillesGift06_A|Achilles Gift 06 A|Zagreus|Achille, je me demandais si vous partageriez ça avec moi au salon. Une sorte de prétexte pour que nous fassions une petite pause tous les deux ?
AchillesGift06_A|Achilles Gift 06 A|Achilles|Tu es sûr d’avoir du temps à m’accorder, mon garçon...? Ah, comment pourrais-je refuser. Je te retrouve là-bas.
AchillesGift06_A|Achilles Gift 06 A|Achilles|...J’ai été stupide, vois-tu. Les dieux m’avaient promis la gloire éternelle, même après la mort. J’aurais pu ne pas partir à la guerre. J'aurais pu rester à la maison avec Patrocle. Au lieu de ça, j’ai choisi de tout gâcher, et d'envoyer tant d’hommes ici...
AchillesGift06_A|Achilles Gift 06 A|Zagreus|Ce qui est fait est fait, monsieur. À mes yeux, vous êtes le plus grand guerrier qui ait jamais existé. Et donc, c'est toujours la gloire que vous cherchez, ou bien Patrocle ?
AchillesGift06_A|Achilles Gift 06 A|Achilles|Ce n’est plus la gloire, mon garçon. J’en suis certain. En revanche, Patrocle, je... je crains de l’avoir perdu à tout jamais. Son ombre réside peut-être encore dans ce royaume, mais nous nous sommes quittés en des termes que je ne pardonnerais jamais si j’étais à sa place. Quoi qu'il en soit... je pense que je ferais mieux de retourner à mon poste, maintenant.
AchillesGift06_A|Achilles Gift 06 A|Achilles|...J’espère ne pas avoir trop assombri l'ambiance durant notre petite beuverie. Je suis très heureux que nous ayons eu cette occasion de nous retrouver. Maintenant, va ! Fais attention à toi lors de ta prochaine escapade.
AchillesGift07_A|Achilles Gift 07 A|Zagreus|Achille, je me suis dit que vous aimeriez peut-être avoir ça, la prochaine fois que vous irez à l'Élysée. Pour la partager.
AchillesGift07_A|Achilles Gift 07 A|Achilles|De l'ambroisie... C'est un honneur, mon garçon. Mais c'est moi qui devrais te remettre des cadeaux pour ce que tu as fait pour moi, et pas l'inverse. Et il se trouve que j'en ai un là. De la part de Pat et de la mienne.
AchillesGift08_A|Achilles Gift 08 A|Zagreus|C'est difficile d'imaginer quelqu'un qui le mérite plus que vous, Maître. Alors la prochaine fois que vous avez du temps libre ou que l'occasion se présente, profitez-en, d'accord ?
AchillesGift08_A|Achilles Gift 08 A|Achilles|J'imagine que ça doit être ça, d'être un dieu. De recevoir une telle affection. Et des offrandes ! Tu es sûr ?
AchillesGift08_A|Achilles Gift 08 A|Zagreus|Oh oui, absolument. Sans vos conseils, jamais je n'aurais été prêt à endurer tout ce que j'ai enduré. Et je ne parle pas que des combats.
AchillesGift08_A|Achilles Gift 08 A|Achilles|Allons, mon garçon. Je sais que j'étais très fort à ce que je faisais, mais il ne s'agissait que de tuer des gens. Je me méfierais de mes conseils, si j'étais toi.
AchillesGift08_A|Achilles Gift 08 A|Zagreus|Vous voyez ? Vous venez encore de me donner un bon conseil !
AchillesGift09_A|Achilles Gift 09 A|Zagreus|À votre santé, Maître ! Et à celle de Patrocle. Puisse le reste de l'éternité compenser tout ce qu'il vous a fallu pour en arriver là.
AchillesGift09_A|Achilles Gift 09 A|Achilles|Oh, merci, mon garçon. Prince. Zagreus. Tu n'aurais pas dû. D'ailleurs, c'est la dernière bouteille que j'accepte de ta part.
AchillesGift09_A|Achilles Gift 09 A|Zagreus|Vraiment ? Oh, je ne faisais pas ça pour vous gêner... Je pensais juste que vous aimiez ça.
AchillesGift09_A|Achilles Gift 09 A|Achilles|Nous aimons ça, et pas qu'un peu, mais dans l'Élysée c'est quelque chose qu'on gagne plus que quelque chose qu'on accepte, et... être ici nous redonne un peu de notre fierté passée.
AchillesGift09_A|Achilles Gift 09 A|Zagreus|Tant mieux. Vous avez vraiment de quoi être fier, Achille. Vous êtes un grand guerrier. Un grand mentor. Un grand ami.
AchillesGift09_A|Achilles Gift 09 A|Achilles|...S'il y a la moindre chose dont je peux être fier, mon garçon... c'est bien que quelqu'un comme toi me dise ça sans mentir.
AchillesGift04|Achilles Gift 04|Achilles|Tu as ma parole. C’est vraiment gentil d’avoir pensé à moi, mon garçon.
AchillesGift04|Achilles Gift 04|Zagreus|C’était la moindre des choses après tout ce que vous m’avez appris.
AchillesGift07|Achilles Gift 07|Achilles|Je risque de faire beaucoup de jaloux dans la Maison avec ça, mon garçon. Ça ne te dérange pas si je le partage un peu ?
AchillesGift07|Achilles Gift 07|Zagreus|C’est à vous, Achille ! À vrai dire, j'espère, non, j’insiste pour que vous le partagiez.
NyxWithAchilles01|Nyx With Achilles 01|Achilles|...J’ai fait de mon mieux pour le préparer. Mais j’ai peur que cela n’ait pas été suffisant. Personne n’est jamais sorti de cet endroit.
NyxWithAchilles01|Nyx With Achilles 01|Nyx|Votre expertise l’a bien préparé, Achille. Mais je sens que c’est votre confiance en lui qui le stimule. Ce n’est pas le moment de perdre confiance en vous, ou il finira par perdre confiance en lui.
NyxWithAchilles02|Nyx With Achilles 02|Achilles|...Vous l'avez bien élevé, Ô Nuit. Vous le savez, j'espère ? Cela dit, je suis sûr que même vous, vous n'aviez pas prévu cette issue. Merci... d'avoir rendu tout ça possible. Pour nous tous.
NyxWithAchilles02|Nyx With Achilles 02|Nyx|Tout ça, c'est aussi grâce à toi. Peut-être même plus, d'ailleurs. Car je n'ai d'autre choix que celui de servir cette Maison. J'ai été créée dans ce royaume et il représente tout pour moi. Mais toi ? Personne n'aurait pu s'attendre à une telle loyauté.
NyxWithAchilles02|Nyx With Achilles 02|Achilles|*Oh*, eh bien... je me suis seulement dit que je n'avais pas d'autre choix que de servir cette Maison. Au début, en tout cas. Mais, aussi étrange que cela puisse paraître... en entraînant le Prince... en le préparant pour l'avenir... je me suis à nouveau senti vivant, voyez-vous.
NyxWithAchilles02|Nyx With Achilles 02|Nyx|Quoi qu'il en soit, étant donné les circonstances de ta vie et de ta servitude, tu n'avais pas besoin de donner autant de toi-même. La grandeur de ta vie mortelle t'a suivi jusque dans la mort.
NyxWithAchillesAfterMyrmidonReunionQuest01|Nyx With Achilles After Myrmidon Reunion Quest 01|Achilles|Ô Nuit, je ne pourrai jamais vous rendre le service que vous m'avez rendu. Sachez seulement que je suis honoré de rester à votre service.
NyxWithAchillesAfterMyrmidonReunionQuest01|Nyx With Achilles After Myrmidon Reunion Quest 01|Nyx|Je ne sais absolument pas de quoi vous parlez, Achille. Mais votre loyauté ici est plus que bienvenue. C'est moi qui suis honorée.
OrpheusWithAchilles01|Orpheus With Achilles 01|Orpheus|...Vous êtes bien trop modeste pour quelqu'un qui a autant d'exploits et de décapitations à son actif, Seigneur Achille ! Vous devriez prendre exemple sur Zagreus, et vous en vanter plus souvent !
OrpheusWithAchilles01|Orpheus With Achilles 01|Achilles|Oh, ne vous inquiétez pas, Orphée, je me vantais beaucoup, de mon vivant... et voyez-vous où cela m’a mené ? Et puis, je n’ai pas assez d’imagination pour inventer des histoires aussi fantastiques que celles de notre Prince Zagreus.
OrpheusWithAchilles02|Orpheus With Achilles 02|Orpheus|...Cela vous manque-t-il, à vous, Seigneur Achille ? L'air frais. Le besoin de prendre plusieurs repas par jour, et toutes ces choses.
OrpheusWithAchilles02|Orpheus With Achilles 02|Achilles|Je m’en souviens à peine, mon ami. Cela dit, vos chansons rafraîchissent ma mémoire, parfois. Je crois que je me suis habitué à la vie ici, pour ainsi dire. Pas vous ?
OrpheusWithAchilles02|Orpheus With Achilles 02|Orpheus|Oh, au contraire, monsieur, je suis profondément satisfait. Nous avons beaucoup de chance d’avoir un emploi même après la mort. Imaginez reposer éternellement, alors que nous pourrions travailler !
PatroclusWithAchilles01|Patroclus With Achilles 01|Achilles|Je savais qu'on finirait par te croiser, mais... comme c'est étrange de nous retrouver ici, mon garçon. De voir cet endroit de mes propres yeux. Je n'en reviens toujours pas...
PatroclusWithAchilles01|Patroclus With Achilles 01|Patroclus|Vraiment, il n'y a rien à faire. Pourtant, je n'arrête pas de lui dire que c'est la réalité. On n'obtient rien sans prendre de risques, pas vrai ? Oh, mais nous devons te remercier, étranger. Rien ne t'obligeait à te préoccuper de nos problèmes.
PatroclusWithAchilles01|Patroclus With Achilles 01|Zagreus|Je vous en prie, monsieur. Vous êtes mon ami. Et Achille... je ne sais pas ce que je serais sans vous.
PatroclusWithAchilles01|Patroclus With Achilles 01|Patroclus|Allons, inutile de la jouer sentimental. Nous autres Myrmidons, nous ne sommes pas de ce genre-là. Achille fait simplement une pause après un travail exigeant, c'est tout. Toi aussi, ton travail est exigeant, alors tiens ! Mon petit cadeau habituel.
PatroclusWithAchilles02|Patroclus With Achilles 02|Patroclus|Tiens donc, le disciple d'Achille est venu nous rendre visite. Je ne sais pas comment je pourrai te remercier pour ce que tu as fait, étranger. En fait, je crois bien que c'est impossible.
PatroclusWithAchilles02|Patroclus With Achilles 02|Achilles|J'en étais plus ou moins arrivé à la même conclusion, Pat.
PatroclusWithAchilles02|Patroclus With Achilles 02|Zagreus|Et si vous continuiez de me proposer tous ces objets de grande qualité dont vous n'avez pas besoin quand je passe par ici ? Je pense que ça suffira pour qu'on soit quittes. Ça vous dit ?
PatroclusWithAchilles02|Patroclus With Achilles 02|Patroclus|C'est ce que je comptais faire de toute façon, mais... si jamais tu penses à autre chose, n'hésite pas à nous le faire savoir.
