Id|Description|Speaker|Text
NyxAboutLegendary01|Nyx About Legendary 01|Nyx|J'avais anticipé ceci, et je suis heureuse pour toi. Mais tu n'aurais jamais simplement découvert une telle chose. Chacun de ces Compagnons sont des reliques uniques qui doivent être données de plein gré afin qu'elles gardent toute leur forme et leur pouvoir.
NyxAboutLegendary01|Nyx About Legendary 01|Zagreus|Je dois admettre, et je dis ça comme un compliment bien sûr, que j'ai du mal à imaginer l'incarnation de la Nuit elle-même façonner ces petits souvenirs à échanger entre amis.
NyxAboutLegendary01|Nyx About Legendary 01|Nyx|Ne les sous-estime pas malgré leur apparence insignifiante. Ils renferment le pouvoir extraordinaire d'une union indéfectible entre deux âmes.
NyxAboutLegendary02|Nyx About Legendary 02|Zagreus|Nyx, tu as vraiment donné à Dusa l'édition epsilon d'un Compagnon Chthonien ? C'était une version si limitée, il n'en reste qu'une dans tous les Enfers ! Elle en est très reconnaissante, au point qu'elle m'a confié Fidi. C'est ainsi que leur pouvoir grandit, n'est-ce pas ?
NyxAboutLegendary02|Nyx About Legendary 02|Nyx|La tête de gorgone tranchée n'est pas sans qualités, mon enfant. Même si je m'attendais à ce que ce compagnon arrive tôt ou tard jusqu'à toi, au vu de l'attachement grandissant que vous éprouviez l'un pour l'autre. Ainsi, en une action, vous avez trouvé tous deux de la motivation.
NyxWithHades01|Nyx With Hades 01|Hades|...Tu ne dois pas lui offrir ton assistance, Nyx. Sa sottise ne mérite que le mépris et la réprimande, pas l’indulgence. Est-ce que nous nous sommes bien compris ?
NyxWithHades01|Nyx With Hades 01|Nyx|Nous nous sommes bien compris, Hadès, oui. Après tout, il reste ton fils, et par conséquent ta responsabilité. Quant à moi, j'ai mes propres engagements envers ce royaume et cette Maison. Tu m'as aidée à les honorer, et je te suis donc à jamais redevable.
NyxWithHades01|Nyx With Hades 01|Hades|Il n’est pas nécessaire de me le rappeler. Ceux qui ont autrefois défié mes frères et moi préféreraient certainement une place dans ma Maison à un séjour éternel dans les tréfonds du Tartare. Encore que l’obscurité ne te dérangerait guère.
NyxWithHades02|Nyx With Hades 02|Hades|...Il me paraît clair que tu es en train de l’aider, et ce en dépit de mes ordres. Comment veux-tu que je réagisse, Nyx ? Que ferais-tu à ma place ? On me trahit dans mon propre foyer, ma propre demeure...! Réponds-moi.
NyxWithHades02|Nyx With Hades 02|Nyx|Hadès, mon rapport avec lui reste inchangé. Il est le même que depuis le premier jour où tu m'as demandé de m'occuper de lui. Il a tout mon soutien, et l’aura toujours. Tu dois en rester conscient. Il souhaite maintenant partir ; je ne ferai rien pour l’en empêcher.
NyxWithHades02|Nyx With Hades 02|Hades|*Tch*. À quoi de bon servez-vous, tous les deux ? Il n’est même pas ton fils, et pourtant tu le choies comme tel. Tu sais aussi bien que moi qu’il ne peut pas réussir. Tu remplis son crâne d'illusions qui lui coûteront cher. Si c’est ce que tu souhaites pour lui, eh bien soit ! Continue ainsi.
NyxWithHades03|Nyx With Hades 03|Hades|*L'Olympe est au courant *?! Ils lui accordent tous leurs pathétiques bénédictions, ici, dans mon royaume ! Dans *notre *royaume ! Explique-moi exactement comment cela est possible, Nyx. Soit ton pouvoir apparemment illimité se tarit, soit tu manigances quelque chose.
NyxWithHades03|Nyx With Hades 03|Nyx|Ne doute pas de mon pouvoir, Hadès. Plus ton fils se rapprochait de la surface, plus il risquait d'être découvert. Les dieux de l'Olympe sont heureux de savoir qu'ils ont un parent éloigné, et l'accueillent à bras ouverts sur leur montagne. C'est tout. Leur influence est très limitée.
NyxWithHades03|Nyx With Hades 03|Hades|Sang et ténèbres ! Ne me parle pas de leur *influence *! Je sais parfaitement de quoi elle est capable. Tu as fait une erreur stupide.
NyxWithHades03|Nyx With Hades 03|Nyx|Tu oses me parler d'erreurs stupides ? Tu ne peux pas changer le cours du destin. Quoi que tu fasses.
NyxWithHades04|Nyx With Hades 04|Hades|Et maintenant, Nyx ? Te rends-tu compte du danger auquel tu l'as exposée, à présent ? Tu dis tenir à elle, mais maintenant, elle risque d'être découverte... *ils *risquent de tout découvrir !
NyxWithHades04|Nyx With Hades 04|Nyx|Hadès. Y a-t-il eu un seul instant où je ne savais pas exactement ce que je faisais ? Aucun mal ne s'abattra sur la Reine, ou sur ton fils.
NyxWithHades04|Nyx With Hades 04|Zagreus|...Du mal à la Reine...? Attendez, de quoi vous parlez, là ?
NyxWithHades04|Nyx With Hades 04|Nyx|Mon enfant ! Zagreus. As-tu l'intention de révéler la présence de ta véritable mère aux Olympiens ?
NyxWithHades04|Nyx With Hades 04|Zagreus|Non ! Bien sûr que non. Elle... elle a l'air d'être contente de vivre seule.
NyxWithHades04|Nyx With Hades 04|Hades|Et tu le crois sur parole ? Comment peux-tu croire qu'il ne va pas tout ruiner ?
NyxWithHades04|Nyx With Hades 04|Nyx|C'est exactement ainsi que j'espérais qu'il nous amène à ce point.
NyxWithHades05|Nyx With Hades 05|Hades|...Ce que j'essaie de te dire, Nyx, c'est que je te suis reconnaissant de notre longue collaboration. Ma règle t'a été imposée, ainsi qu'aux tiens. Tu aurais très bien pu choisir de t'opposer au moindre de mes faits et gestes. J'ai souvent cru que tu agirais ainsi. Pourtant, quand j'ai rompu les liens avec l'Olympe... tu es restée de mon côté.
NyxWithHades05|Nyx With Hades 05|Nyx|Je suis la Nuit incarnée, Hadès, comme tu le sais. Comme je te l'ai déclaré à notre première rencontre : je resterai à tes côtés tant que tu demeureras le souverain prédestiné de ce royaume.
NyxWithHades05|Nyx With Hades 05|Hades|Ce ne sera pas la peine de me le rappeler. Sache à ton tour que je gouvernerai toujours ce royaume au maximum de mes capacités.
NyxWithAchilles01|Nyx With Achilles 01|Achilles|...J’ai fait de mon mieux pour le préparer. Mais j’ai peur que cela n’ait pas été suffisant. Personne n’est jamais sorti de cet endroit.
NyxWithAchilles01|Nyx With Achilles 01|Nyx|Votre expertise l’a bien préparé, Achille. Mais je sens que c’est votre confiance en lui qui le stimule. Ce n’est pas le moment de perdre confiance en vous, ou il finira par perdre confiance en lui.
NyxWithAchilles02|Nyx With Achilles 02|Achilles|...Vous l'avez bien élevé, Ô Nuit. Vous le savez, j'espère ? Cela dit, je suis sûr que même vous, vous n'aviez pas prévu cette issue. Merci... d'avoir rendu tout ça possible. Pour nous tous.
NyxWithAchilles02|Nyx With Achilles 02|Nyx|Tout ça, c'est aussi grâce à toi. Peut-être même plus, d'ailleurs. Car je n'ai d'autre choix que celui de servir cette Maison. J'ai été créée dans ce royaume et il représente tout pour moi. Mais toi ? Personne n'aurait pu s'attendre à une telle loyauté.
NyxWithAchilles02|Nyx With Achilles 02|Achilles|*Oh*, eh bien... je me suis seulement dit que je n'avais pas d'autre choix que de servir cette Maison. Au début, en tout cas. Mais, aussi étrange que cela puisse paraître... en entraînant le Prince... en le préparant pour l'avenir... je me suis à nouveau senti vivant, voyez-vous.
NyxWithAchilles02|Nyx With Achilles 02|Nyx|Quoi qu'il en soit, étant donné les circonstances de ta vie et de ta servitude, tu n'avais pas besoin de donner autant de toi-même. La grandeur de ta vie mortelle t'a suivi jusque dans la mort.
NyxWithAchillesAfterMyrmidonReunionQuest01|Nyx With Achilles After Myrmidon Reunion Quest 01|Achilles|Ô Nuit, je ne pourrai jamais vous rendre le service que vous m'avez rendu. Sachez seulement que je suis honoré de rester à votre service.
NyxWithAchillesAfterMyrmidonReunionQuest01|Nyx With Achilles After Myrmidon Reunion Quest 01|Nyx|Je ne sais absolument pas de quoi vous parlez, Achille. Mais votre loyauté ici est plus que bienvenue. C'est moi qui suis honorée.
NyxWithPersephone01|Nyx With Persephone 01|Nyx|...Perséphone, ma reine... Cela fait bien trop longtemps. Mais le temps vous a été clément. C'est un honneur de vous revoir.
NyxWithPersephone01|Nyx With Persephone 01|Persephone|Oh, s'il te plaît, Nyx... pas de formalités entre nous. Moi aussi, je suis heureuse de te revoir, mon amie. Les jours à la surface étaient différents, mais les nuits... Elles me rappelaient les moments que nous passions ensemble.
NyxWithPersephone01|Nyx With Persephone 01|Nyx|De bons moments, il me semble.
NyxWithPersephone01|Nyx With Persephone 01|Persephone|De bons moments, évidemment ! J'essaie d'oublier les autres !
NyxWithPersephone01|Nyx With Persephone 01|Nyx|Nous sommes heureux de te retrouver. Mais l'adaptation sera à nouveau difficile pour toi, je le crains. Et pour nous tous.
NyxWithPersephone01|Nyx With Persephone 01|Persephone|Eh bien, m'étant construit une petite maison toute seule, là-haut, je me crois prête à tout ! Tu sais ce que c'est.
NyxChat01|Nyx Chat 01|Nyx|Que les ténèbres te guident, mon enfant.
NyxChat02|Nyx Chat 02|Nyx|Je suis occupée, mon enfant. Je te prie de m'excuser.
NyxChat03|Nyx Chat 03|Nyx|Prends soin de toi, mon enfant.
NyxChat04|Nyx Chat 04|Nyx|Je veillerai toujours sur toi, comme sur notre Maison.
NyxChat05|Nyx Chat 05|Nyx|Ne t'inquiète pas pour ton père. Je le surveillerai.
NyxChat06|Nyx Chat 06|Nyx|N’aie crainte pour Cerbère. Il est bien traité et nourri en ton absence.
NyxChat07|Nyx Chat 07|Nyx|Va, remplis le rôle qui t'es destiné, mon enfant.
NyxChat08|Nyx Chat 08|Nyx|Ton destin t'attend quelque part par-delà ces murs, mon enfant.
NyxChat09|Nyx Chat 09|Nyx|Tu seras toujours le bienvenu à mes côtés, mon enfant.
NyxChat10|Nyx Chat 10|Nyx|Ne perds pas espoir, et garde ta détermination, mon enfant.
NyxChat11|Nyx Chat 11|Nyx|N’oublie pas tous ceux qui ont de l'affection pour toi, mon enfant.
NyxChat12|Nyx Chat 12|Nyx|Ne laisse pas les circonstances ébranler ta détermination, mon enfant.
NyxChat13|Nyx Chat 13|Nyx|Merci de m’avoir rendu visite, mon enfant.
NyxChat14|Nyx Chat 14|Nyx|Ces brefs échanges me réjouissent, mon enfant.
NyxChat15|Nyx Chat 15|Nyx|Ton père est comme il a toujours été, mon enfant.
NyxChat16|Nyx Chat 16|Nyx|Un jour, tu obtiendras ce que tu désires, mon enfant.
NyxChat17|Nyx Chat 17|Nyx|La vie que les Moires t'ont réservée t'attend, mon enfant.
NyxChat18|Nyx Chat 18|Nyx|Puisses-tu découvrir un jour ce que tu recherches, mon enfant.
NyxChat19|Nyx Chat 19|Nyx|Je te protégerai pendant ton séjour ici, mon enfant.
NyxChat20|Nyx Chat 20|Nyx|Je vais bien, mais je te remercie de t'être souvenu de moi, mon enfant.
NyxChat21|Nyx Chat 21|Nyx|Je suis heureuse de voir que tu es indemne, mon enfant.
NyxChat22|Nyx Chat 22|Nyx|Je suis toujours heureuse d’être en ta compagnie, mon enfant.
NyxChat23|Nyx Chat 23|Nyx|C'est très gentil à toi de venir prendre de mes nouvelles, mon enfant.
NyxChat24|Nyx Chat 24|Nyx|Tu m’as l’air en pleine forme, mon enfant.
NyxChat25|Nyx Chat 25|Nyx|Je suis toujours ravie d’échanger quelques mots avec toi, mon enfant.
NyxChat26|Nyx Chat 26|Nyx|Ma foi en toi n’a jamais vacillé, mon enfant.
NyxChat27|Nyx Chat 27|Nyx|Je sens ton inquiétude pour moi, mon enfant, mais je t'en prie, ne t'encombres pas de tels sentiments.
NyxChat28|Nyx Chat 28|Nyx|Bien que tes déplacements te mènent en des terres lointaines, j’ai toujours du plaisir à te voir, mon enfant.
NyxChat29|Nyx Chat 29|Nyx|Mon attention se porte actuellement sur d'autres affaires.
NyxChat30|Nyx Chat 30|Nyx|Je te prie de me laisser me concentrer sur les tâches qui m'incombent actuellement.
NyxChat31|Nyx Chat 31|Nyx|Nous parlerons une autre fois, si tu veux bien.
NyxChat32|Nyx Chat 32|Nyx|Je ferai tout mon possible pour te soutenir, mon enfant.
NyxChat33|Nyx Chat 33|Nyx|Quel que soit ton échec, tu seras toujours le bienvenu ici avec moi, mon enfant.
NyxChat34|Nyx Chat 34|Nyx|La nature de ce royaume, mon enfant, n'est connue ni comprise de personne.
NyxChat35|Nyx Chat 35|Nyx|Il n'existe aucun obstacle que tu ne peux pas surmonter.
NyxChat36|Nyx Chat 36|Nyx|Tout va pour le mieux actuellement, mon enfant.
NyxChat37|Nyx Chat 37|Nyx|Tous tes efforts ont profité à la maison, mon enfant.
NyxChat38|Nyx Chat 38|Nyx|Tes prouesses m'emplissent de fierté.
NyxChat39|Nyx Chat 39|Nyx|Va, et sers cette Maison.
NyxChat40|Nyx Chat 40|Nyx|Puisse Thanatos te venir en aide, si tu croises son chemin.
NyxChat41|Nyx Chat 41|Nyx|Reste imperceptible, mon enfant.
NyxChat42|Nyx Chat 42|Nyx|Nul doute que la Reine Perséphone est très fière de toi.
NyxChat43|Nyx Chat 43|Nyx|Va, et honore ta mère, la Reine.
NyxChat44|Nyx Chat 44|Nyx|Cette Maison est plus forte maintenant que la Reine est revenue.
NyxChat45|Nyx Chat 45|Nyx|Honore la Reine, mon enfant.
NyxChat46|Nyx Chat 46|Nyx|Ton père est de meilleure humeur, ces derniers temps.
NyxChat47|Nyx Chat 47|Nyx|Ta mère t'attend. Pars la retrouver, mon enfant.
NyxChat48|Nyx Chat 48|Nyx|Pars retrouver ta mère une nouvelle fois, mon enfant.
NyxChat49|Nyx Chat 49|Nyx|Perséphone t'attend à la surface.
NyxChat50|Nyx Chat 50|Nyx|Je suis certaine que ta mère t'attend là-haut avec impatience.
NyxChat51|Nyx Chat 51|Nyx|Va. Tu sais exactement où la trouver, désormais.
NyxChat53|Nyx Chat 53|Nyx|J'ai bien peur de ne pas être en mesure de t'aider pour le moment.
NyxChat54|Nyx Chat 54|Nyx|Tu découvriras ce que tu recherches le moment venu.
NyxGift01|Nyx Gift 01|Zagreus|*Euh*, Nyx ? Tu as tant fait pour moi, je... je me suis dit que ceci pourrait peut-être te faire plaisir.
NyxGift01|Nyx Gift 01|Nyx|Tu sais bien que ton père n'aime pas que l'on distribue du Nectar dans cette Maison, mon enfant. Cependant, je ne suis pas comme lui... et je souhaite te donner un gage de mon affection en échange.
NyxGift02|Nyx Gift 02|Nyx|Comment accepter une telle générosité, mon enfant ? D’autres personnes sont certainement plus méritantes de telles offrandes.
NyxGift02|Nyx Gift 02|Zagreus|Je t'en prie, Nyx. C’est à toi que revient ce présent. Tu t'es toujours souciée de moi. Jamais je ne pourrai te remercier assez.
NyxGift03|Nyx Gift 03|Nyx|Ta gentillesse envers moi est excessive, mon enfant. Tu sais que je n’attends pas de cadeaux, de toi ni de personne.
NyxGift03|Nyx Gift 03|Zagreus|Je pense toujours à toi, Nyx. Tu m’as élevé comme ton propre fils, et je t'en suis reconnaissant.
NyxGift04|Nyx Gift 04|Nyx|Tu m’honores, mon enfant, bien que je craigne ne pas mériter une telle générosité. Rien ne sert de me flatter de la sorte.
NyxGift04|Nyx Gift 04|Zagreus|Les choses sont comme elles sont, Nyx ! J’aimerais tout de même que tu l’acceptes, avec mes respects.
NyxGift05|Nyx Gift 05|Nyx|Tous les cadeaux du monde ne seront jamais plus précieux que le lien qui nous unit, mon enfant. Cela dit, ton offrande me touche.
NyxGift05|Nyx Gift 05|Zagreus|Ce n'est rien, Nyx. Vraiment. Je sais que tu as toujours cru en moi, et c'est un privilège auquel je tiens à me montrer digne.
NyxGift06|Nyx Gift 06|Nyx|Parmi mes nombreux enfants, ceux que j'ai enfantés et ceux qui m'ont été confiés, tu es l'un des plus attentionnés et généreux.
NyxGift06|Nyx Gift 06|Zagreus|Tu as toujours pris soin de moi et m'as toujours protégé. Et donné l'occasion d'admirer quelqu'un. Ce n'est rien, Nyx.
NyxGift07|Nyx Gift 07|Zagreus|Nyx, si tu veux bien me pardonner cette transgression pour un moment, j'aimerais te donner cette bouteille d'Ambroisie millésimée. Tu peux la remettre à Mégère comme contrebande, mais... juste au cas où, je voulais que tu l'aies en premier.
NyxGift07|Nyx Gift 07|Nyx|*Ah*. Une bouteille en cristal descendue tout droit des hauts sommets du mont Olympe jusqu'à ces profondeurs souterraines. Ton père a toujours dit détester ça.
NyxGift07|Nyx Gift 07|Zagreus|On sait tous que Père a des goûts discutables.
NyxGift07|Nyx Gift 07|Nyx|*Ah, hahahaha*. J'accepte ce cadeau avec gratitude. C'est une boisson raffinée que je n'ai pas encore eu la chance de goûter. Peut-être que je la garderai pour une occasion plus appropriée. Merci, mon enfant.
NyxGift08|Nyx Gift 08|Nyx|Au passage, je voulais te dire, mon enfant. Te souviens-tu de l'Ambroisie que tu m'as donnée ? Plutôt que de la garder indéfiniment, j'ai récemment décidé d'y goûter. Les dires de ton père quant à sa saveur sont bien loin de la vérité. Je n'avais jamais rien goûté de tel.
NyxGift08|Nyx Gift 08|Zagreus|Je suis si heureux que ça t'ait plu, Nyx ! Ça tombe plutôt bien, parce que... J'ai une autre bouteille pour toi. On raconte qu'il n'y en a pas une ayant un goût similaire ! Et puis, les plaisirs de l'Olympe devraient se partager. Tu ne vois pas d'inconvénient à la prendre, j'espère ?
NyxGift08|Nyx Gift 08|Nyx|Tu es persuasif comme ta mère et déterminé comme ton père, mon enfant. Mais si tu insistes, je ne vais pas me priver des simples plaisirs de cette boisson. Bien que les occasions d'en profiter ici-bas soient rares.
NyxGift09|Nyx Gift 09|Zagreus|Nyx, en plus de te donner cette bouteille d'ambroisie, il y a quelque chose que je voulais te dire. Les Trois Moires ont fait preuve d'une grande bonté envers moi. Elles m'ont arraché ma vraie mère, mais... j'ai pu grandir à tes côtés en retour. Sans ta présence rassurante en ces lieux, je... je ne peux pas imaginer ce que les choses seraient.
NyxGift09|Nyx Gift 09|Nyx|Oh. Les Trois Moires sont bien facétieuses, assurément. À ta naissance, quand j'étais emplie de peur quant à ce qu'être responsable de toi signifiait, ce que le fait que tu sois vivant signifiait... Je dois admettre que j'étais loin de deviner qu'un soir, tu m'offrirais un tel cadeau, et de telles émotions.
NyxGift09|Nyx Gift 09|Zagreus|Je soutiens chaque mot que j'ai dit. Je t'aime, Nyx.
NyxInChaos01|Nyx In Chaos 01|Nyx|Salutations, mon enfant. Comme il est curieux que nous nous rencontrions ici. Chaos et moi avons beaucoup de choses à rattraper. Va donc vaquer à tes occupations, nous nous reverrons en temps voulu au sein de la Maison. Si tu viens à y retourner, bien sûr. Et, encore une fois, je te remercie.
NyxInChaos02|Nyx In Chaos 02|Nyx|Chaos et moi avons beaucoup de choses à nous raconter.
NyxInChaos03|Nyx In Chaos 03|Nyx|Comme c'est curieux de te voir ici, mon enfant.
NyxInChaos04|Nyx In Chaos 04|Nyx|Je t'en prie, ne fais pas attention à moi et poursuis ton chemin, mon enfant.
NyxInChaos05|Nyx In Chaos 05|Nyx|Je te remercie de tenir compagnie à Chaos.
NyxInChaos06|Nyx In Chaos 06|Nyx|Va donc, portant avec toi la marque de Chaos.
NyxInChaos07|Nyx In Chaos 07|Nyx|Chaos et moi avons encore beaucoup de choses à nous dire.
NyxInChaos08|Nyx In Chaos 08|Nyx|Il est réconfortant d'être de retour ici, au cœur des ténèbres.
NyxInChaos09|Nyx In Chaos 09|Nyx|Je te reverrai bientôt à la Maison, mon enfant.
NyxInChaos10|Nyx In Chaos 10|Nyx|Comme il est étrange de retourner sur mon lieu de naissance.
NyxInChaos11|Nyx In Chaos 11|Nyx|Nous sommes heureux de ta visite, aussi brève soit-elle.
NyxInChaos12|Nyx In Chaos 12|Nyx|Chaos n'étant pas en mesure de nous rendre visite facilement, c'est moi qui lui rends visite.
HypnosWithNyx01|Hypnos With Nyx 01|Hypnos|...J'ai juste sommeil parfois, maman, je veux dire, je travaille *tellement *ces derniers temps là-bas, tu sais ? Tu m'as sûrement vu en train de saluer les ombres, faire ma liste, créer une atmosphère accueillante...
HypnosWithNyx01|Hypnos With Nyx 01|Nyx|Souviens-toi de ce dont nous avons parlé, Hypnos. Ne m'adresse pas la parole ainsi quand nous sommes ici. Conduis-toi de manière digne d'un serviteur de la Maison d'Hadès... et continue de développer ton indépendance, s'il te plaît.
HypnosWithNyx02|Hypnos With Nyx 02|Nyx|Tu as fait preuve d'une compétence constante à ton travail, Hypnos. Je suis heureuse de constater tes progrès. Tes efforts sont félicités.
HypnosWithNyx02|Hypnos With Nyx 02|Hypnos|Oh, woah, *merci *! Mais qui est-ce qui me félicite, exactement ? Mégère ? Thanatos ? Dusa, peut-être ! C'est quand même pas le Maître lui-même, si ?!
HypnosWithNyx02|Hypnos With Nyx 02|Nyx|C'est moi qui te félicite. Je ne suis pas en mesure de veiller sur tous mes enfants en permanence, comme tu le sais. Par conséquent, c'est à eux de veiller sur eux-mêmes, ainsi que sur leurs obligations envers le royaume. En tant que mère... cela me rassure de voir que tu en es capable.
HypnosWithNyx02|Hypnos With Nyx 02|Hypnos|Capable ? Moi ? *Ooh*, maman... je veux dire, euh, *Mère Nyx *! Personne m'avait encore *jamais *appelé comme ça !
HypnosWithNyx02|Hypnos With Nyx 02|Nyx|Tu es mon fils. Je n'en attendais pas moins de toi. Mais... je sais qu'être utile n'est pas chose aisée. Continue ainsi. Je te surveillerai.
ThanatosWithNyx01|Thanatos With Nyx 01|Thanatos|Mère, est-ce que je peux faire quelque chose pour t'aider, avec tout ce qui se passe en ce moment ? Je passe trop de temps loin de la Maison. S'il te faut quoi que ce soit, n'hésite pas.
ThanatosWithNyx01|Thanatos With Nyx 01|Nyx|Tu fais déjà tout ce que tu peux pour aider, mon fils. Continue ainsi. Les affaires actuellement en jeu te concernent, et nous concernent tous. Ton support et tes choix aident à façonner le futur que nous désirons.
ThanatosWithNyx01|Thanatos With Nyx 01|Thanatos|Je comprends, et je ferai de mon mieux. Merci pour tout, Mère. J'ai foi en toi, et en cette Maison. À bientôt.
ThanatosWithNyx02|Thanatos With Nyx 02|Thanatos|Mère, est-ce que c'est moi, ou tout semble bien se passer dans cette Maison, pour une fois ? Sans vouloir tenter les Moires en disant ça, bien sûr.
ThanatosWithNyx02|Thanatos With Nyx 02|Nyx|C'est grâce à nos efforts combinés que la Maison s'épanouit. Cela dit, il n'en sera ainsi que si nous tous, toi y compris, continuons de travailler assidûment. C'est l'occasion idéale pour faire une brève pause, Thanatos. Mais nous avons besoin que tu fasses de ton mieux, comme toujours.
ThanatosWithNyx02|Thanatos With Nyx 02|Thanatos|Eh bien... sache que je te suis éternellement reconnaissant, Mère. Et je t'aime du fond du cœur. Qu'est-ce que nous serions devenus sans toi ? Je prends ce que tu as fait pour nous à sa juste valeur, et c'est le cas de tout le monde ici. Sois tranquille.
ThanatosChatWithNyx01|Thanatos Chat With Nyx 01|Nyx|...Nous avons une nouvelle tâche pour toi.
ThanatosChatWithNyx01|Thanatos Chat With Nyx 01|Thanatos|Compris, Mère. Je m'y mets de ce pas.
ThanatosChatWithNyx03|Thanatos Chat With Nyx 03|Nyx|...Nous avons à nouveau besoin de tes compétences.
ThanatosChatWithNyx03|Thanatos Chat With Nyx 03|Thanatos|Très bien, Mère, je m'y mets tout de suite. À bientôt.
DusaWithNyx01|Dusa With Nyx 01|Nyx|...Et après cela, Dusa, vous devrez de nouveau dépoussiérer le plafond, et tailler les arbres des jardins. Il sera alors temps de briquer la cuisine, puis de balayer le salon une deuxième fois...
DusaWithNyx01|Dusa With Nyx 01|Dusa|O-oui, madame, je m'y mets tout de suite !
DusaWithNyx02|Dusa With Nyx 02|Nyx|...Enfin, Dusa, vous ne devez en aucun cas vous adresser au Prince, à moins qu’il ne vous adresse la parole en premier. Pour lui, vous êtes invisible. Me suis-je bien fait comprendre ?
DusaWithNyx02|Dusa With Nyx 02|Dusa|Oui, madame Nyx, vous êtes comprise, enfin, je veux dire... j'ai compris. Je... j'y vais, alors.
DusaWithNyx03|Dusa With Nyx 03|Dusa|Madame Nyx, vous... ? Si je veux récupérer ma place, je... *Oh là là*, plus que tout au monde ! Ce travail représente tout, pour moi. Je veux dire... Travailler avec *vous * ! Vous êtes la Nuit incarnée ! Cet endroit, et vous tous... C'est tellement incroyable pour moi, et je... veux juste me rendre utile ! Donnez-moi une seconde chance !
DusaWithNyx03|Dusa With Nyx 03|Nyx|Votre seconde chance n'est pas sans conditions, Dusa. Si vous pensez qu'il vous faut plus de temps que prévu pour vos responsabilités, j'attends de vous que vous le demandiez. Vous ne portez pas à vous seule la destinée de cette Maison. Votre attitude envers votre travail est aussi importante que le résultat final. Maintenant... je vous demande de retourner à votre poste.
DusaWithNyx03|Dusa With Nyx 03|Dusa|Quoi, je... Madame Nyx, vous voulez dire... commencer maintenant ? Là *tout de suite * ? Je veux dire, je... je n'ai rien de pressant à faire alors... je vais le faire, *oui * !! J'accepte ! Je suis tellement contente d'être de retour ! Je ne sais par où commencer, je peux examiner le salon, nettoyer les toiles d'araignées, promener Cerbère, vérifier le garde-manger, ah, OK, j'y vais !!
DusaWithNyx04|Dusa With Nyx 04|Nyx|... et par conséquent, pour votre diligence et vos services, et pour avoir fait de tels progrès... Au nom de mon autorité en tant que la Nuit incarnée, je vous nomme ici Concierge en chef de la Maison d'Hadès et vous accorde les privilèges associés à votre fonction. Assumez ces responsabilités avec honneur, Dusa.
DusaWithNyx04|Dusa With Nyx 04|Dusa|Madame Nyx, je suis sincèrement honorée et reconnaissante de cette opportunité et de la confiance que vous me témoignez en m'accordant cette promotion. Je vous promets de ne pas vous décevoir. Ni vous, ni personne ! Merci infiniment !
DusaWithNyx04|Dusa With Nyx 04|Nyx|Je vous en prie. L'ordre qui règne dans cette Maison est le reflet de l'ensemble du royaume. Vous avez assimilé ceci et compris qu'une approche disciplinée du travail est bien plus importante que de simples efforts. Même si vous comprenez également l'utilité de faire ces efforts.
MegaeraWithNyx01|Megaera With Nyx 01|Nyx|...Nous avons tous nos engagements envers cette Maison, Mégère. Tu ne dois pas avoir honte des tiens. Et tant que tes sœurs sont absentes, tu portes aussi le fardeau de leurs responsabilités.
